IV,I,PAROLLES,"I recovered it."
IV,I,Second Lord,"You shall hear one anon."
IV,I,PAROLLES,"A drum now of the enemy's,--"
IV,I,Second Lord,"Throca movousus, cargo, cargo, cargo."
IV,I,All,"Cargo, cargo, cargo, villiando par corbo, cargo."
IV,I,PAROLLES,"O, ransom, ransom! do not hide mine eyes."
IV,I,First Soldier,"Boskos thromuldo boskos."
IV,I,PAROLLES,"I know you are the Muskos' regiment:"
IV,I,PAROLLES,"And I shall lose my life for want of language;"
IV,I,PAROLLES,"If there be here German, or Dane, low Dutch,"
IV,I,PAROLLES,"Italian, or French, let him speak to me; I'll"
IV,I,PAROLLES,"Discover that which shall undo the Florentine."
IV,I,First Soldier,"Boskos vauvado: I understand thee, and can speak"
IV,I,First Soldier,"thy tongue. Kerely bonto, sir, betake thee to thy"
IV,I,First Soldier,"faith, for seventeen poniards are at thy bosom."
IV,I,PAROLLES,"O!"
IV,I,First Soldier,"O, pray, pray, pray! Manka revania dulche."
IV,I,Second Lord,"Oscorbidulchos volivorco."
IV,I,First Soldier,"The general is content to spare thee yet;"
IV,I,First Soldier,"And, hoodwink'd as thou art, will lead thee on"
IV,I,First Soldier,"To gather from thee: haply thou mayst inform"
IV,I,First Soldier,"Something to save thy life."
IV,I,PAROLLES,"O, let me live!"
IV,I,PAROLLES,"And all the secrets of our camp I'll show,"
IV,I,PAROLLES,"Their force, their purposes; nay, I'll speak that"
IV,I,PAROLLES,"Which you will wonder at."
IV,I,First Soldier,"But wilt thou faithfully?"
IV,I,PAROLLES,"If I do not, damn me."
IV,I,First Soldier,"Acordo linta."
IV,I,First Soldier,"Come on; thou art granted space."
IV,I,Second Lord,"Go, tell the Count Rousillon, and my brother,"
IV,I,Second Lord,"We have caught the woodcock, and will keep him muffled"
IV,I,Second Lord,"Till we do hear from them."
IV,I,Second Soldier,"Captain, I will."
IV,I,Second Lord,"A' will betray us all unto ourselves:"
IV,I,Second Lord,"Inform on that."
IV,I,Second Soldier,"So I will, sir."
IV,I,Second Lord,"Till then I'll keep him dark and safely lock'd."
IV,II,BERTRAM,"They told me that your name was Fontibell."
IV,II,DIANA,"No, my good lord, Diana."
IV,II,BERTRAM,"Titled goddess;"
IV,II,BERTRAM,"And worth it, with addition! But, fair soul,"
IV,II,BERTRAM,"In your fine frame hath love no quality?"
IV,II,BERTRAM,"If quick fire of youth light not your mind,"
IV,II,BERTRAM,"You are no maiden, but a monument:"
IV,II,BERTRAM,"When you are dead, you should be such a one"
IV,II,BERTRAM,"As you are now, for you are cold and stem;"
IV,II,BERTRAM,"And now you should be as your mother was"
IV,II,BERTRAM,"When your sweet self was got."
IV,II,DIANA,"She then was honest."
IV,II,BERTRAM,"So should you be."
IV,II,DIANA,"No:"
IV,II,DIANA,"My mother did but duty; such, my lord,"
IV,II,DIANA,"As you owe to your wife."
IV,II,BERTRAM,"No more o' that;"
IV,II,BERTRAM,"I prithee, do not strive against my vows:"
IV,II,BERTRAM,"I was compell'd to her; but I love thee"
IV,II,BERTRAM,"By love's own sweet constraint, and will for ever"
IV,II,BERTRAM,"Do thee all rights of service."
IV,II,DIANA,"Ay, so you serve us"
IV,II,DIANA,"Till we serve you; but when you have our roses,"
IV,II,DIANA,"You barely leave our thorns to prick ourselves"
IV,II,DIANA,"And mock us with our bareness."
IV,II,BERTRAM,"How have I sworn!"
IV,II,DIANA,"'Tis not the many oaths that makes the truth,"
IV,II,DIANA,"But the plain single vow that is vow'd true."
IV,II,DIANA,"What is not holy, that we swear not by,"
IV,II,DIANA,"But take the High'st to witness: then, pray you, tell me,"
IV,II,DIANA,"If I should swear by God's great attributes,"
IV,II,DIANA,"I loved you dearly, would you believe my oaths,"
IV,II,DIANA,"When I did love you ill? This has no holding,"
IV,II,DIANA,"To swear by him whom I protest to love,"
IV,II,DIANA,"That I will work against him: therefore your oaths"
IV,II,DIANA,"Are words and poor conditions, but unseal'd,"
IV,II,DIANA,"At least in my opinion."
IV,II,BERTRAM,"Change it, change it;"
IV,II,BERTRAM,"Be not so holy-cruel: love is holy;"
IV,II,BERTRAM,"And my integrity ne'er knew the crafts"
IV,II,BERTRAM,"That you do charge men with. Stand no more off,"
IV,II,BERTRAM,"But give thyself unto my sick desires,"
IV,II,BERTRAM,"Who then recover: say thou art mine, and ever"
IV,II,BERTRAM,"My love as it begins shall so persever."
IV,II,DIANA,"I see that men make ropes in such a scarre"
IV,II,DIANA,"That we'll forsake ourselves. Give me that ring."
IV,II,BERTRAM,"I'll lend it thee, my dear; but have no power"
IV,II,BERTRAM,"To give it from me."
IV,II,DIANA,"Will you not, my lord?"
IV,II,BERTRAM,"It is an honour 'longing to our house,"
IV,II,BERTRAM,"Bequeathed down from many ancestors;"
IV,II,BERTRAM,"Which were the greatest obloquy i' the world"
IV,II,BERTRAM,"In me to lose."
IV,II,DIANA,"Mine honour's such a ring:"
IV,II,DIANA,"My chastity's the jewel of our house,"
IV,II,DIANA,"Bequeathed down from many ancestors;"
IV,II,DIANA,"Which were the greatest obloquy i' the world"
IV,II,DIANA,"In me to lose: thus your own proper wisdom"
IV,II,DIANA,"Brings in the champion Honour on my part,"
IV,II,DIANA,"Against your vain assault."
IV,II,BERTRAM,"Here, take my ring:"
IV,II,BERTRAM,"My house, mine honour, yea, my life, be thine,"
IV,II,BERTRAM,"And I'll be bid by thee."
IV,II,DIANA,"When midnight comes, knock at my chamber-window:"
IV,II,DIANA,"I'll order take my mother shall not hear."
IV,II,DIANA,"Now will I charge you in the band of truth,"
IV,II,DIANA,"When you have conquer'd my yet maiden bed,"
IV,II,DIANA,"Remain there but an hour, nor speak to me:"
IV,II,DIANA,"My reasons are most strong; and you shall know them"
IV,II,DIANA,"When back again this ring shall be deliver'd:"
IV,II,DIANA,"And on your finger in the night I'll put"
IV,II,DIANA,"Another ring, that what in time proceeds"
IV,II,DIANA,"May token to the future our past deeds."
IV,II,DIANA,"Adieu, till then; then, fail not. You have won"
IV,II,DIANA,"A wife of me, though there my hope be done."
IV,II,BERTRAM,"A heaven on earth I have won by wooing thee."
IV,II,DIANA,"For which live long to thank both heaven and me!"
IV,II,DIANA,"You may so in the end."
IV,II,DIANA,"My mother told me just how he would woo,"
IV,II,DIANA,"As if she sat in 's heart; she says all men"
IV,II,DIANA,"Have the like oaths: he had sworn to marry me"
IV,II,DIANA,"When his wife's dead; therefore I'll lie with him"
IV,II,DIANA,"When I am buried. Since Frenchmen are so braid,"
IV,II,DIANA,"Marry that will, I live and die a maid:"
IV,II,DIANA,"Only in this disguise I think't no sin"
IV,II,DIANA,"To cozen him that would unjustly win."
IV,III,First Lord,"You have not given him his mother's letter?"
IV,III,Second Lord,"I have delivered it an hour since: there is"
IV,III,Second Lord,"something in't that stings his nature; for on the"
IV,III,Second Lord,"reading it he changed almost into another man."
IV,III,First Lord,"He has much worthy blame laid upon him for shaking"
IV,III,First Lord,"off so good a wife and so sweet a lady."
IV,III,Second Lord,"Especially he hath incurred the everlasting"
IV,III,Second Lord,"displeasure of the king, who had even tuned his"
IV,III,Second Lord,"bounty to sing happiness to him. I will tell you a"
IV,III,Second Lord,"thing, but you shall let it dwell darkly with you."
IV,III,First Lord,"When you have spoken it, 'tis dead, and I am the"
IV,III,First Lord,"grave of it."
IV,III,Second Lord,"He hath perverted a young gentlewoman here in"
IV,III,Second Lord,"Florence, of a most chaste renown; and this night he"
IV,III,Second Lord,"fleshes his will in the spoil of her honour: he hath"
IV,III,Second Lord,"given her his monumental ring, and thinks himself"
IV,III,Second Lord,"made in the unchaste composition."
IV,III,First Lord,"Now, God delay our rebellion! as we are ourselves,"
IV,III,First Lord,"what things are we!"
IV,III,Second Lord,"Merely our own traitors. And as in the common course"
IV,III,Second Lord,"of all treasons, we still see them reveal"
IV,III,Second Lord,"themselves, till they attain to their abhorred ends,"
IV,III,Second Lord,"so he that in this action contrives against his own"
IV,III,Second Lord,"nobility, in his proper stream o'erflows himself."
IV,III,First Lord,"Is it not meant damnable in us, to be trumpeters of"
IV,III,First Lord,"our unlawful intents? We shall not then have his"
IV,III,First Lord,"company to-night?"
IV,III,Second Lord,"Not till after midnight; for he is dieted to his hour."
IV,III,First Lord,"That approaches apace; I would gladly have him see"
IV,III,First Lord,"his company anatomized, that he might take a measure"
IV,III,First Lord,"of his own judgments, wherein so curiously he had"
IV,III,First Lord,"set this counterfeit."
IV,III,Second Lord,"We will not meddle with him till he come; for his"
IV,III,Second Lord,"presence must be the whip of the other."
IV,III,First Lord,"In the mean time, what hear you of these wars?"
IV,III,Second Lord,"I hear there is an overture of peace."
IV,III,First Lord,"Nay, I assure you, a peace concluded."
IV,III,Second Lord,"What will Count Rousillon do then? will he travel"
IV,III,Second Lord,"higher, or return again into France?"
IV,III,First Lord,"I perceive, by this demand, you are not altogether"
IV,III,First Lord,"of his council."
IV,III,Second Lord,"Let it be forbid, sir; so should I be a great deal"
IV,III,Second Lord,"of his act."
IV,III,First Lord,"Sir, his wife some two months since fled from his"
IV,III,First Lord,"house: her pretence is a pilgrimage to Saint Jaques"
IV,III,First Lord,"le Grand; which holy undertaking with most austere"
IV,III,First Lord,"sanctimony she accomplished; and, there residing the"
IV,III,First Lord,"tenderness of her nature became as a prey to her"
IV,III,First Lord,"grief; in fine, made a groan of her last breath, and"
IV,III,First Lord,"now she sings in heaven."
IV,III,Second Lord,"How is this justified?"
IV,III,First Lord,"The stronger part of it by her own letters, which"
IV,III,First Lord,"makes her story true, even to the point of her"
IV,III,First Lord,"death: her death itself, which could not be her"
IV,III,First Lord,"office to say is come, was faithfully confirmed by"
IV,III,First Lord,"the rector of the place."
IV,III,Second Lord,"Hath the count all this intelligence?"
IV,III,First Lord,"Ay, and the particular confirmations, point from"
IV,III,First Lord,"point, so to the full arming of the verity."
IV,III,Second Lord,"I am heartily sorry that he'll be glad of this."
IV,III,First Lord,"How mightily sometimes we make us comforts of our losses!"
IV,III,Second Lord,"And how mightily some other times we drown our gain"
IV,III,Second Lord,"in tears! The great dignity that his valour hath"
IV,III,Second Lord,"here acquired for him shall at home be encountered"
IV,III,Second Lord,"with a shame as ample."
IV,III,First Lord,"The web of our life is of a mingled yarn, good and"
IV,III,First Lord,"ill together: our virtues would be proud, if our"
IV,III,First Lord,"faults whipped them not; and our crimes would"
IV,III,First Lord,"despair, if they were not cherished by our virtues."
IV,III,First Lord,"How now! where's your master?"
IV,III,Servant,"He met the duke in the street, sir, of whom he hath"
IV,III,Servant,"taken a solemn leave: his lordship will next"
IV,III,Servant,"morning for France. The duke hath offered him"
IV,III,Servant,"letters of commendations to the king."
IV,III,Second Lord,"They shall be no more than needful there, if they"
IV,III,Second Lord,"were more than they can commend."
IV,III,First Lord,"They cannot be too sweet for the king's tartness."
IV,III,First Lord,"Here's his lordship now."
IV,III,First Lord,"How now, my lord! is't not after midnight?"
IV,III,BERTRAM,"I have to-night dispatched sixteen businesses, a"
IV,III,BERTRAM,"month's length a-piece, by an abstract of success:"
IV,III,BERTRAM,"I have congied with the duke, done my adieu with his"
IV,III,BERTRAM,"nearest; buried a wife, mourned for her; writ to my"
IV,III,BERTRAM,"lady mother I am returning; entertained my convoy;"
IV,III,BERTRAM,"and between these main parcels of dispatch effected"
IV,III,BERTRAM,"many nicer needs; the last was the greatest, but"
IV,III,BERTRAM,"that I have not ended yet."
IV,III,Second Lord,"If the business be of any difficulty, and this"
IV,III,Second Lord,"morning your departure hence, it requires haste of"
IV,III,Second Lord,"your lordship."
IV,III,BERTRAM,"I mean, the business is not ended, as fearing to"
IV,III,BERTRAM,"hear of it hereafter. But shall we have this"
IV,III,BERTRAM,"dialogue between the fool and the soldier? Come,"
IV,III,BERTRAM,"bring forth this counterfeit module, he has deceived"
IV,III,BERTRAM,"me, like a double-meaning prophesier."
IV,III,Second Lord,"Bring him forth: has sat i' the stocks all night,"
IV,III,Second Lord,"poor gallant knave."
IV,III,BERTRAM,"No matter: his heels have deserved it, in usurping"
IV,III,BERTRAM,"his spurs so long. How does he carry himself?"
IV,III,Second Lord,"I have told your lordship already, the stocks carry"
IV,III,Second Lord,"him. But to answer you as you would be understood;"
IV,III,Second Lord,"he weeps like a wench that had shed her milk: he"
IV,III,Second Lord,"hath confessed himself to Morgan, whom he supposes"
IV,III,Second Lord,"to be a friar, from the time of his remembrance to"
IV,III,Second Lord,"this very instant disaster of his setting i' the"
IV,III,Second Lord,"stocks: and what think you he hath confessed?"
IV,III,BERTRAM,"Nothing of me, has a'?"
IV,III,Second Lord,"His confession is taken, and it shall be read to his"
IV,III,Second Lord,"face: if your lordship be in't, as I believe you"
IV,III,Second Lord,"are, you must have the patience to hear it."
IV,III,BERTRAM,"A plague upon him! muffled! he can say nothing of"
IV,III,BERTRAM,"me: hush, hush!"
IV,III,First Lord,"Hoodman comes! Portotartarosa"
IV,III,First Soldier,"He calls for the tortures: what will you say"
IV,III,First Soldier,"without 'em?"
IV,III,PAROLLES,"I will confess what I know without constraint: if"
IV,III,PAROLLES,"ye pinch me like a pasty, I can say no more."
IV,III,First Soldier,"Bosko chimurcho."
IV,III,First Lord,"Boblibindo chicurmurco."
IV,III,First Soldier,"You are a merciful general. Our general bids you"
IV,III,First Soldier,"answer to what I shall ask you out of a note."
IV,III,PAROLLES,"And truly, as I hope to live."
IV,III,First Soldier,"duke is strong.' What say you to that?"
IV,III,PAROLLES,"Five or six thousand; but very weak and"
IV,III,PAROLLES,"unserviceable: the troops are all scattered, and"
IV,III,PAROLLES,"the commanders very poor rogues, upon my reputation"
IV,III,PAROLLES,"and credit and as I hope to live."
IV,III,First Soldier,"Shall I set down your answer so?"
IV,III,PAROLLES,"Do: I'll take the sacrament on't, how and which way you will."
IV,III,BERTRAM,"All's one to him. What a past-saving slave is this!"
IV,III,First Lord,"You're deceived, my lord: this is Monsieur"
IV,III,First Lord,"Parolles, the gallant militarist,--that was his own"
IV,III,First Lord,"phrase,--that had the whole theoric of war in the"
IV,III,First Lord,"knot of his scarf, and the practise in the chape of"
IV,III,First Lord,"his dagger."
IV,III,Second Lord,"I will never trust a man again for keeping his sword"
IV,III,Second Lord,"clean. nor believe he can have every thing in him"
IV,III,Second Lord,"by wearing his apparel neatly."
IV,III,First Soldier,"Well, that's set down."
IV,III,PAROLLES,"Five or six thousand horse, I said,-- I will say"
IV,III,PAROLLES,"true,--or thereabouts, set down, for I'll speak truth."
IV,III,First Lord,"He's very near the truth in this."
IV,III,BERTRAM,"But I con him no thanks for't, in the nature he"
IV,III,BERTRAM,"delivers it."
IV,III,PAROLLES,"Poor rogues, I pray you, say."
IV,III,First Soldier,"Well, that's set down."
IV,III,PAROLLES,"I humbly thank you, sir: a truth's a truth, the"
IV,III,PAROLLES,"rogues are marvellous poor."
IV,III,First Soldier,"a-foot.' What say you to that?"
IV,III,PAROLLES,"By my troth, sir, if I were to live this present"
IV,III,PAROLLES,"hour, I will tell true. Let me see: Spurio, a"
IV,III,PAROLLES,"hundred and fifty; Sebastian, so many; Corambus, so"
IV,III,PAROLLES,"many; Jaques, so many; Guiltian, Cosmo, Lodowick,"
IV,III,PAROLLES,"and Gratii, two hundred and fifty each; mine own"
IV,III,PAROLLES,"company, Chitopher, Vaumond, Bentii, two hundred and"
IV,III,PAROLLES,"fifty each: so that the muster-file, rotten and"
IV,III,PAROLLES,"sound, upon my life, amounts not to fifteen thousand"
IV,III,PAROLLES,"poll; half of the which dare not shake snow from off"
IV,III,PAROLLES,"their cassocks, lest they shake themselves to pieces."
IV,III,BERTRAM,"What shall be done to him?"
IV,III,First Lord,"Nothing, but let him have thanks. Demand of him my"
IV,III,First Lord,"condition, and what credit I have with the duke."
IV,III,First Soldier,"Well, that's set down."
IV,III,First Soldier,"'You shall demand of him, whether one Captain Dumain"
IV,III,First Soldier,"be i' the camp, a Frenchman; what his reputation is"
IV,III,First Soldier,"with the duke; what his valour, honesty, and"
IV,III,First Soldier,"expertness in wars; or whether he thinks it were not"
IV,III,First Soldier,"possible, with well-weighing sums of gold, to"
IV,III,First Soldier,"corrupt him to revolt.' What say you to this? what"
IV,III,First Soldier,"do you know of it?"
IV,III,PAROLLES,"I beseech you, let me answer to the particular of"
IV,III,PAROLLES,"the inter'gatories: demand them singly."
IV,III,First Soldier,"Do you know this Captain Dumain?"
IV,III,PAROLLES,"I know him: a' was a botcher's 'prentice in Paris,"
IV,III,PAROLLES,"from whence he was whipped for getting the shrieve's"
IV,III,PAROLLES,"fool with child,--a dumb innocent, that could not"
IV,III,PAROLLES,"say him nay."
IV,III,BERTRAM,"Nay, by your leave, hold your hands; though I know"
IV,III,BERTRAM,"his brains are forfeit to the next tile that falls."
IV,III,First Soldier,"Well, is this captain in the duke of Florence's camp?"
IV,III,PAROLLES,"Upon my knowledge, he is, and lousy."
IV,III,First Lord,"Nay look not so upon me; we shall hear of your"
IV,III,First Lord,"lordship anon."
IV,III,First Soldier,"What is his reputation with the duke?"
IV,III,PAROLLES,"The duke knows him for no other but a poor officer"
IV,III,PAROLLES,"of mine; and writ to me this other day to turn him"
IV,III,PAROLLES,"out o' the band: I think I have his letter in my pocket."
IV,III,First Soldier,"Marry, we'll search."
IV,III,PAROLLES,"In good sadness, I do not know; either it is there,"
IV,III,PAROLLES,"or it is upon a file with the duke's other letters"
IV,III,PAROLLES,"in my tent."
IV,III,First Soldier,"Here 'tis; here's a paper: shall I read it to you?"
IV,III,PAROLLES,"I do not know if it be it or no."
IV,III,BERTRAM,"Our interpreter does it well."
IV,III,First Lord,"Excellently."
IV,III,PAROLLES,"That is not the duke's letter, sir; that is an"
IV,III,PAROLLES,"advertisement to a proper maid in Florence, one"
IV,III,PAROLLES,"Diana, to take heed of the allurement of one Count"
IV,III,PAROLLES,"Rousillon, a foolish idle boy, but for all that very"
IV,III,PAROLLES,"ruttish: I pray you, sir, put it up again."
IV,III,First Soldier,"Nay, I'll read it first, by your favour."
IV,III,PAROLLES,"My meaning in't, I protest, was very honest in the"
IV,III,PAROLLES,"behalf of the maid; for I knew the young count to be"
IV,III,PAROLLES,"a dangerous and lascivious boy, who is a whale to"
IV,III,PAROLLES,"virginity and devours up all the fry it finds."
IV,III,BERTRAM,"Damnable both-sides rogue!"
IV,III,First Soldier,"After he scores, he never pays the score:"
IV,III,First Soldier,"Half won is match well made; match, and well make it;"
IV,III,First Soldier,"He ne'er pays after-debts, take it before;"
IV,III,First Soldier,"And say a soldier, Dian, told thee this,"
IV,III,First Soldier,"Men are to mell with, boys are not to kiss:"
IV,III,First Soldier,"For count of this, the count's a fool, I know it,"
IV,III,First Soldier,"Who pays before, but not when he does owe it."
IV,III,First Soldier,"Thine, as he vowed to thee in thine ear,"
IV,III,First Soldier,"PAROLLES.'"
IV,III,BERTRAM,"He shall be whipped through the army with this rhyme"
IV,III,BERTRAM,"in's forehead."
IV,III,Second Lord,"This is your devoted friend, sir, the manifold"
IV,III,Second Lord,"linguist and the armipotent soldier."
IV,III,BERTRAM,"I could endure any thing before but a cat, and now"
IV,III,BERTRAM,"he's a cat to me."
IV,III,First Soldier,"I perceive, sir, by the general's looks, we shall be"
IV,III,First Soldier,"fain to hang you."
IV,III,PAROLLES,"My life, sir, in any case: not that I am afraid to"
IV,III,PAROLLES,"die; but that, my offences being many, I would"
IV,III,PAROLLES,"repent out the remainder of nature: let me live,"
IV,III,PAROLLES,"sir, in a dungeon, i' the stocks, or any where, so I may live."
IV,III,First Soldier,"We'll see what may be done, so you confess freely;"
IV,III,First Soldier,"therefore, once more to this Captain Dumain: you"
IV,III,First Soldier,"have answered to his reputation with the duke and to"
IV,III,First Soldier,"his valour: what is his honesty?"
IV,III,PAROLLES,"He will steal, sir, an egg out of a cloister: for"
IV,III,PAROLLES,"rapes and ravishments he parallels Nessus: he"
IV,III,PAROLLES,"professes not keeping of oaths; in breaking 'em he"
IV,III,PAROLLES,"is stronger than Hercules: he will lie, sir, with"
IV,III,PAROLLES,"such volubility, that you would think truth were a"
IV,III,PAROLLES,"fool: drunkenness is his best virtue, for he will"
IV,III,PAROLLES,"be swine-drunk; and in his sleep he does little"
IV,III,PAROLLES,"harm, save to his bed-clothes about him; but they"
IV,III,PAROLLES,"know his conditions and lay him in straw. I have but"
IV,III,PAROLLES,"little more to say, sir, of his honesty: he has"
IV,III,PAROLLES,"every thing that an honest man should not have; what"
IV,III,PAROLLES,"an honest man should have, he has nothing."
IV,III,First Lord,"I begin to love him for this."
IV,III,BERTRAM,"For this description of thine honesty? A pox upon"
IV,III,BERTRAM,"him for me, he's more and more a cat."
IV,III,First Soldier,"What say you to his expertness in war?"
IV,III,PAROLLES,"Faith, sir, he has led the drum before the English"
IV,III,PAROLLES,"tragedians; to belie him, I will not, and more of"
IV,III,PAROLLES,"his soldiership I know not; except, in that country"
IV,III,PAROLLES,"he had the honour to be the officer at a place there"
IV,III,PAROLLES,"called Mile-end, to instruct for the doubling of"
IV,III,PAROLLES,"files: I would do the man what honour I can, but of"
IV,III,PAROLLES,"this I am not certain."
IV,III,First Lord,"He hath out-villained villany so far, that the"
IV,III,First Lord,"rarity redeems him."
IV,III,BERTRAM,"A pox on him, he's a cat still."
IV,III,First Soldier,"His qualities being at this poor price, I need not"
IV,III,First Soldier,"to ask you if gold will corrupt him to revolt."
IV,III,PAROLLES,"Sir, for a quart d'ecu he will sell the fee-simple"
IV,III,PAROLLES,"of his salvation, the inheritance of it; and cut the"
IV,III,PAROLLES,"entail from all remainders, and a perpetual"
IV,III,PAROLLES,"succession for it perpetually."
IV,III,First Soldier,"What's his brother, the other Captain Dumain?"
IV,III,Second Lord,"Why does be ask him of me?"
IV,III,First Soldier,"What's he?"
IV,III,PAROLLES,"E'en a crow o' the same nest; not altogether so"
IV,III,PAROLLES,"great as the first in goodness, but greater a great"
IV,III,PAROLLES,"deal in evil: he excels his brother for a coward,"
IV,III,PAROLLES,"yet his brother is reputed one of the best that is:"
IV,III,PAROLLES,"in a retreat he outruns any lackey; marry, in coming"
IV,III,PAROLLES,"on he has the cramp."
IV,III,First Soldier,"If your life be saved, will you undertake to betray"
IV,III,First Soldier,"the Florentine?"
IV,III,PAROLLES,"Ay, and the captain of his horse, Count Rousillon."
IV,III,First Soldier,"I'll whisper with the general, and know his pleasure."
IV,III,PAROLLES,"drums! Only to seem to deserve well, and to"
IV,III,PAROLLES,"beguile the supposition of that lascivious young boy"
IV,III,PAROLLES,"the count, have I run into this danger. Yet who"
IV,III,PAROLLES,"would have suspected an ambush where I was taken?"
IV,III,First Soldier,"There is no remedy, sir, but you must die: the"
IV,III,First Soldier,"general says, you that have so traitorously"
IV,III,First Soldier,"discovered the secrets of your army and made such"
IV,III,First Soldier,"pestiferous reports of men very nobly held, can"
IV,III,First Soldier,"serve the world for no honest use; therefore you"
IV,III,First Soldier,"must die. Come, headsman, off with his head."
IV,III,PAROLLES,"O Lord, sir, let me live, or let me see my death!"
IV,III,First Lord,"That shall you, and take your leave of all your friends."
IV,III,First Lord,"So, look about you: know you any here?"
IV,III,BERTRAM,"Good morrow, noble captain."
IV,III,Second Lord,"God bless you, Captain Parolles."
IV,III,First Lord,"God save you, noble captain."
IV,III,Second Lord,"Captain, what greeting will you to my Lord Lafeu?"
IV,III,Second Lord,"I am for France."
IV,III,First Lord,"Good captain, will you give me a copy of the sonnet"
IV,III,First Lord,"you writ to Diana in behalf of the Count Rousillon?"
IV,III,First Lord,"an I were not a very coward, I'ld compel it of you:"
IV,III,First Lord,"but fare you well."
IV,III,First Soldier,"You are undone, captain, all but your scarf; that"
IV,III,First Soldier,"has a knot on't yet"
IV,III,PAROLLES,"Who cannot be crushed with a plot?"
IV,III,First Soldier,"If you could find out a country where but women were"
IV,III,First Soldier,"that had received so much shame, you might begin an"
IV,III,First Soldier,"impudent nation. Fare ye well, sir; I am for France"
IV,III,First Soldier,"too: we shall speak of you there."
IV,III,PAROLLES,"Yet am I thankful: if my heart were great,"
IV,III,PAROLLES,"'Twould burst at this. Captain I'll be no more;"
IV,III,PAROLLES,"But I will eat and drink, and sleep as soft"
