II,III,HELENA,"My wish receive,"
II,III,HELENA,"Which great Love grant! and so, I take my leave."
II,III,LAFEU,"Do all they deny her? An they were sons of mine,"
II,III,LAFEU,"I'd have them whipped; or I would send them to the"
II,III,LAFEU,"Turk, to make eunuchs of."
II,III,HELENA,"Be not afraid that I your hand should take;"
II,III,HELENA,"I'll never do you wrong for your own sake:"
II,III,HELENA,"Blessing upon your vows! and in your bed"
II,III,HELENA,"Find fairer fortune, if you ever wed!"
II,III,LAFEU,"These boys are boys of ice, they'll none have her:"
II,III,LAFEU,"sure, they are bastards to the English; the French"
II,III,LAFEU,"ne'er got 'em."
II,III,HELENA,"You are too young, too happy, and too good,"
II,III,HELENA,"To make yourself a son out of my blood."
II,III,Fourth Lord,"Fair one, I think not so."
II,III,LAFEU,"There's one grape yet; I am sure thy father drunk"
II,III,LAFEU,"wine: but if thou be'st not an ass, I am a youth"
II,III,LAFEU,"of fourteen; I have known thee already."
II,III,HELENA,"Me and my service, ever whilst I live,"
II,III,HELENA,"Into your guiding power. This is the man."
II,III,KING,"Why, then, young Bertram, take her; she's thy wife."
II,III,BERTRAM,"My wife, my liege! I shall beseech your highness,"
II,III,BERTRAM,"In such a business give me leave to use"
II,III,BERTRAM,"The help of mine own eyes."
II,III,KING,"Know'st thou not, Bertram,"
II,III,KING,"What she has done for me?"
II,III,BERTRAM,"Yes, my good lord;"
II,III,BERTRAM,"But never hope to know why I should marry her."
II,III,KING,"Thou know'st she has raised me from my sickly bed."
II,III,BERTRAM,"But follows it, my lord, to bring me down"
II,III,BERTRAM,"Must answer for your raising? I know her well:"
II,III,BERTRAM,"She had her breeding at my father's charge."
II,III,BERTRAM,"A poor physician's daughter my wife! Disdain"
II,III,BERTRAM,"Rather corrupt me ever!"
II,III,KING,"'Tis only title thou disdain'st in her, the which"
II,III,KING,"I can build up. Strange is it that our bloods,"
II,III,KING,"Of colour, weight, and heat, pour'd all together,"
II,III,KING,"Would quite confound distinction, yet stand off"
II,III,KING,"In differences so mighty. If she be"
II,III,KING,"All that is virtuous, save what thou dislikest,"
II,III,KING,"A poor physician's daughter, thou dislikest"
II,III,KING,"Of virtue for the name: but do not so:"
II,III,KING,"From lowest place when virtuous things proceed,"
II,III,KING,"The place is dignified by the doer's deed:"
II,III,KING,"Where great additions swell's, and virtue none,"
II,III,KING,"It is a dropsied honour. Good alone"
II,III,KING,"Is good without a name. Vileness is so:"
II,III,KING,"The property by what it is should go,"
II,III,KING,"Not by the title. She is young, wise, fair;"
II,III,KING,"In these to nature she's immediate heir,"
II,III,KING,"And these breed honour: that is honour's scorn,"
II,III,KING,"Which challenges itself as honour's born"
II,III,KING,"And is not like the sire: honours thrive,"
II,III,KING,"When rather from our acts we them derive"
II,III,KING,"Than our foregoers: the mere word's a slave"
II,III,KING,"Debosh'd on every tomb, on every grave"
II,III,KING,"A lying trophy, and as oft is dumb"
II,III,KING,"Where dust and damn'd oblivion is the tomb"
II,III,KING,"Of honour'd bones indeed. What should be said?"
II,III,KING,"If thou canst like this creature as a maid,"
II,III,KING,"I can create the rest: virtue and she"
II,III,KING,"Is her own dower; honour and wealth from me."
II,III,BERTRAM,"I cannot love her, nor will strive to do't."
II,III,KING,"Thou wrong'st thyself, if thou shouldst strive to choose."
II,III,HELENA,"That you are well restored, my lord, I'm glad:"
II,III,HELENA,"Let the rest go."
II,III,KING,"My honour's at the stake; which to defeat,"
II,III,KING,"I must produce my power. Here, take her hand,"
II,III,KING,"Proud scornful boy, unworthy this good gift;"
II,III,KING,"That dost in vile misprision shackle up"
II,III,KING,"My love and her desert; that canst not dream,"
II,III,KING,"We, poising us in her defective scale,"
II,III,KING,"Shall weigh thee to the beam; that wilt not know,"
II,III,KING,"It is in us to plant thine honour where"
II,III,KING,"We please to have it grow. Cheque thy contempt:"
II,III,KING,"Obey our will, which travails in thy good:"
II,III,KING,"Believe not thy disdain, but presently"
II,III,KING,"Do thine own fortunes that obedient right"
II,III,KING,"Which both thy duty owes and our power claims;"
II,III,KING,"Or I will throw thee from my care for ever"
II,III,KING,"Into the staggers and the careless lapse"
II,III,KING,"Of youth and ignorance; both my revenge and hate"
II,III,KING,"Loosing upon thee, in the name of justice,"
II,III,KING,"Without all terms of pity. Speak; thine answer."
II,III,BERTRAM,"Pardon, my gracious lord; for I submit"
II,III,BERTRAM,"My fancy to your eyes: when I consider"
II,III,BERTRAM,"What great creation and what dole of honour"
II,III,BERTRAM,"Flies where you bid it, I find that she, which late"
II,III,BERTRAM,"Was in my nobler thoughts most base, is now"
II,III,BERTRAM,"The praised of the king; who, so ennobled,"
II,III,BERTRAM,"Is as 'twere born so."
II,III,KING,"Take her by the hand,"
II,III,KING,"And tell her she is thine: to whom I promise"
II,III,KING,"A counterpoise, if not to thy estate"
II,III,KING,"A balance more replete."
II,III,BERTRAM,"I take her hand."
II,III,KING,"Good fortune and the favour of the king"
II,III,KING,"Smile upon this contract; whose ceremony"
II,III,KING,"Shall seem expedient on the now-born brief,"
II,III,KING,"And be perform'd to-night: the solemn feast"
II,III,KING,"Shall more attend upon the coming space,"
II,III,KING,"Expecting absent friends. As thou lovest her,"
II,III,KING,"Thy love's to me religious; else, does err."
II,III,PAROLLES,"Your pleasure, sir?"
II,III,LAFEU,"Your lord and master did well to make his"
II,III,LAFEU,"recantation."
II,III,PAROLLES,"Recantation! My lord! my master!"
II,III,LAFEU,"Ay; is it not a language I speak?"
II,III,PAROLLES,"A most harsh one, and not to be understood without"
II,III,PAROLLES,"bloody succeeding. My master!"
II,III,LAFEU,"Are you companion to the Count Rousillon?"
II,III,PAROLLES,"To any count, to all counts, to what is man."
II,III,LAFEU,"To what is count's man: count's master is of"
II,III,LAFEU,"another style."
II,III,PAROLLES,"You are too old, sir; let it satisfy you, you are too old."
II,III,LAFEU,"I must tell thee, sirrah, I write man; to which"
II,III,LAFEU,"title age cannot bring thee."
II,III,PAROLLES,"What I dare too well do, I dare not do."
II,III,LAFEU,"I did think thee, for two ordinaries, to be a pretty"
II,III,LAFEU,"wise fellow; thou didst make tolerable vent of thy"
II,III,LAFEU,"travel; it might pass: yet the scarfs and the"
II,III,LAFEU,"bannerets about thee did manifoldly dissuade me from"
II,III,LAFEU,"believing thee a vessel of too great a burthen. I"
II,III,LAFEU,"have now found thee; when I lose thee again, I care"
II,III,LAFEU,"not: yet art thou good for nothing but taking up; and"
II,III,LAFEU,"that thou't scarce worth."
II,III,PAROLLES,"Hadst thou not the privilege of antiquity upon thee,--"
II,III,LAFEU,"Do not plunge thyself too far in anger, lest thou"
II,III,LAFEU,"hasten thy trial; which if--Lord have mercy on thee"
II,III,LAFEU,"for a hen! So, my good window of lattice, fare thee"
II,III,LAFEU,"well: thy casement I need not open, for I look"
II,III,LAFEU,"through thee. Give me thy hand."
II,III,PAROLLES,"My lord, you give me most egregious indignity."
II,III,LAFEU,"Ay, with all my heart; and thou art worthy of it."
II,III,PAROLLES,"I have not, my lord, deserved it."
II,III,LAFEU,"Yes, good faith, every dram of it; and I will not"
II,III,LAFEU,"bate thee a scruple."
II,III,PAROLLES,"Well, I shall be wiser."
II,III,LAFEU,"Even as soon as thou canst, for thou hast to pull at"
II,III,LAFEU,"a smack o' the contrary. If ever thou be'st bound"
II,III,LAFEU,"in thy scarf and beaten, thou shalt find what it is"
II,III,LAFEU,"to be proud of thy bondage. I have a desire to hold"
II,III,LAFEU,"my acquaintance with thee, or rather my knowledge,"
II,III,LAFEU,"that I may say in the default, he is a man I know."
II,III,PAROLLES,"My lord, you do me most insupportable vexation."
II,III,LAFEU,"I would it were hell-pains for thy sake, and my poor"
II,III,LAFEU,"doing eternal: for doing I am past: as I will by"
II,III,LAFEU,"thee, in what motion age will give me leave."
II,III,PAROLLES,"Well, thou hast a son shall take this disgrace off"
II,III,PAROLLES,"me; scurvy, old, filthy, scurvy lord! Well, I must"
II,III,PAROLLES,"be patient; there is no fettering of authority."
II,III,PAROLLES,"I'll beat him, by my life, if I can meet him with"
II,III,PAROLLES,"any convenience, an he were double and double a"
II,III,PAROLLES,"lord. I'll have no more pity of his age than I"
II,III,PAROLLES,"would of--I'll beat him, an if I could but meet him again."
II,III,LAFEU,"Sirrah, your lord and master's married; there's news"
II,III,LAFEU,"for you: you have a new mistress."
II,III,PAROLLES,"I most unfeignedly beseech your lordship to make"
II,III,PAROLLES,"some reservation of your wrongs: he is my good"
II,III,PAROLLES,"lord: whom I serve above is my master."
II,III,LAFEU,"Who? God?"
II,III,PAROLLES,"Ay, sir."
II,III,LAFEU,"The devil it is that's thy master. Why dost thou"
II,III,LAFEU,"garter up thy arms o' this fashion? dost make hose of"
II,III,LAFEU,"sleeves? do other servants so? Thou wert best set"
II,III,LAFEU,"thy lower part where thy nose stands. By mine"
II,III,LAFEU,"honour, if I were but two hours younger, I'ld beat"
II,III,LAFEU,"thee: methinks, thou art a general offence, and"
II,III,LAFEU,"every man should beat thee: I think thou wast"
II,III,LAFEU,"created for men to breathe themselves upon thee."
II,III,PAROLLES,"This is hard and undeserved measure, my lord."
II,III,LAFEU,"Go to, sir; you were beaten in Italy for picking a"
II,III,LAFEU,"kernel out of a pomegranate; you are a vagabond and"
II,III,LAFEU,"no true traveller: you are more saucy with lords"
II,III,LAFEU,"and honourable personages than the commission of your"
II,III,LAFEU,"birth and virtue gives you heraldry. You are not"
II,III,LAFEU,"worth another word, else I'ld call you knave. I leave you."
II,III,PAROLLES,"Good, very good; it is so then: good, very good;"
II,III,PAROLLES,"let it be concealed awhile."
II,III,BERTRAM,"Undone, and forfeited to cares for ever!"
II,III,PAROLLES,"What's the matter, sweet-heart?"
II,III,BERTRAM,"Although before the solemn priest I have sworn,"
II,III,BERTRAM,"I will not bed her."
II,III,PAROLLES,"What, what, sweet-heart?"
II,III,BERTRAM,"O my Parolles, they have married me!"
II,III,BERTRAM,"I'll to the Tuscan wars, and never bed her."
II,III,PAROLLES,"France is a dog-hole, and it no more merits"
II,III,PAROLLES,"The tread of a man's foot: to the wars!"
II,III,BERTRAM,"There's letters from my mother: what the import is,"
II,III,BERTRAM,"I know not yet."
II,III,PAROLLES,"Ay, that would be known. To the wars, my boy, to the wars!"
II,III,PAROLLES,"He wears his honour in a box unseen,"
II,III,PAROLLES,"That hugs his kicky-wicky here at home,"
II,III,PAROLLES,"Spending his manly marrow in her arms,"
II,III,PAROLLES,"Which should sustain the bound and high curvet"
II,III,PAROLLES,"Of Mars's fiery steed. To other regions"
II,III,PAROLLES,"France is a stable; we that dwell in't jades;"
II,III,PAROLLES,"Therefore, to the war!"
II,III,BERTRAM,"It shall be so: I'll send her to my house,"
II,III,BERTRAM,"Acquaint my mother with my hate to her,"
II,III,BERTRAM,"And wherefore I am fled; write to the king"
II,III,BERTRAM,"That which I durst not speak; his present gift"
II,III,BERTRAM,"Shall furnish me to those Italian fields,"
II,III,BERTRAM,"Where noble fellows strike: war is no strife"
II,III,BERTRAM,"To the dark house and the detested wife."
II,III,PAROLLES,"Will this capriccio hold in thee? art sure?"
II,III,BERTRAM,"Go with me to my chamber, and advise me."
II,III,BERTRAM,"I'll send her straight away: to-morrow"
II,III,BERTRAM,"I'll to the wars, she to her single sorrow."
II,III,PAROLLES,"Why, these balls bound; there's noise in it. 'Tis hard:"
II,III,PAROLLES,"A young man married is a man that's marr'd:"
II,III,PAROLLES,"Therefore away, and leave her bravely; go:"
II,III,PAROLLES,"The king has done you wrong: but, hush, 'tis so."
II,IV,HELENA,"My mother greets me kindly; is she well?"
II,IV,Clown,"She is not well; but yet she has her health: she's"
II,IV,Clown,"very merry; but yet she is not well: but thanks be"
II,IV,Clown,"given, she's very well and wants nothing i', the"
II,IV,Clown,"world; but yet she is not well."
II,IV,HELENA,"If she be very well, what does she ail, that she's"
II,IV,HELENA,"not very well?"
II,IV,Clown,"Truly, she's very well indeed, but for two things."
II,IV,HELENA,"What two things?"
II,IV,Clown,"One, that she's not in heaven, whither God send her"
II,IV,Clown,"quickly! the other that she's in earth, from whence"
II,IV,Clown,"God send her quickly!"
II,IV,PAROLLES,"Bless you, my fortunate lady!"
II,IV,HELENA,"I hope, sir, I have your good will to have mine own"
II,IV,HELENA,"good fortunes."
II,IV,PAROLLES,"You had my prayers to lead them on; and to keep them"
II,IV,PAROLLES,"on, have them still. O, my knave, how does my old lady?"
II,IV,Clown,"So that you had her wrinkles and I her money,"
II,IV,Clown,"I would she did as you say."
II,IV,PAROLLES,"Why, I say nothing."
II,IV,Clown,"Marry, you are the wiser man; for many a man's"
II,IV,Clown,"tongue shakes out his master's undoing: to say"
II,IV,Clown,"nothing, to do nothing, to know nothing, and to have"
II,IV,Clown,"nothing, is to be a great part of your title; which"
II,IV,Clown,"is within a very little of nothing."
II,IV,PAROLLES,"Away! thou'rt a knave."
II,IV,Clown,"You should have said, sir, before a knave thou'rt a"
II,IV,Clown,"knave; that's, before me thou'rt a knave: this had"
II,IV,Clown,"been truth, sir."
II,IV,PAROLLES,"Go to, thou art a witty fool; I have found thee."
II,IV,Clown,"Did you find me in yourself, sir? or were you"
II,IV,Clown,"taught to find me? The search, sir, was profitable;"
II,IV,Clown,"and much fool may you find in you, even to the"
II,IV,Clown,"world's pleasure and the increase of laughter."
II,IV,PAROLLES,"A good knave, i' faith, and well fed."
II,IV,PAROLLES,"Madam, my lord will go away to-night;"
II,IV,PAROLLES,"A very serious business calls on him."
II,IV,PAROLLES,"The great prerogative and rite of love,"
II,IV,PAROLLES,"Which, as your due, time claims, he does acknowledge;"
II,IV,PAROLLES,"But puts it off to a compell'd restraint;"
II,IV,PAROLLES,"Whose want, and whose delay, is strew'd with sweets,"
II,IV,PAROLLES,"Which they distil now in the curbed time,"
II,IV,PAROLLES,"To make the coming hour o'erflow with joy"
II,IV,PAROLLES,"And pleasure drown the brim."
II,IV,HELENA,"What's his will else?"
II,IV,PAROLLES,"That you will take your instant leave o' the king"
II,IV,PAROLLES,"And make this haste as your own good proceeding,"
II,IV,PAROLLES,"Strengthen'd with what apology you think"
II,IV,PAROLLES,"May make it probable need."
II,IV,HELENA,"What more commands he?"
II,IV,PAROLLES,"That, having this obtain'd, you presently"
II,IV,PAROLLES,"Attend his further pleasure."
II,IV,HELENA,"In every thing I wait upon his will."
II,IV,PAROLLES,"I shall report it so."
II,IV,HELENA,"I pray you."
II,IV,HELENA,"Come, sirrah."
II,V,LAFEU,"But I hope your lordship thinks not him a soldier."
II,V,BERTRAM,"Yes, my lord, and of very valiant approof."
II,V,LAFEU,"You have it from his own deliverance."
II,V,BERTRAM,"And by other warranted testimony."
II,V,LAFEU,"Then my dial goes not true: I took this lark for a bunting."
II,V,BERTRAM,"I do assure you, my lord, he is very great in"
II,V,BERTRAM,"knowledge and accordingly valiant."
II,V,LAFEU,"I have then sinned against his experience and"
II,V,LAFEU,"transgressed against his valour; and my state that"
II,V,LAFEU,"way is dangerous, since I cannot yet find in my"
II,V,LAFEU,"heart to repent. Here he comes: I pray you, make"
II,V,LAFEU,"us friends; I will pursue the amity."
II,V,LAFEU,"Pray you, sir, who's his tailor?"
II,V,PAROLLES,"Sir?"
II,V,LAFEU,"O, I know him well, I, sir; he, sir, 's a good"
II,V,LAFEU,"workman, a very good tailor."
II,V,PAROLLES,"She is."
II,V,BERTRAM,"Will she away to-night?"
II,V,PAROLLES,"As you'll have her."
II,V,BERTRAM,"I have writ my letters, casketed my treasure,"
II,V,BERTRAM,"Given order for our horses; and to-night,"
II,V,BERTRAM,"When I should take possession of the bride,"
II,V,BERTRAM,"End ere I do begin."
II,V,LAFEU,"A good traveller is something at the latter end of a"
II,V,LAFEU,"dinner; but one that lies three thirds and uses a"
II,V,LAFEU,"known truth to pass a thousand nothings with, should"
II,V,LAFEU,"be once heard and thrice beaten. God save you, captain."
II,V,BERTRAM,"Is there any unkindness between my lord and you, monsieur?"
II,V,PAROLLES,"I know not how I have deserved to run into my lord's"
II,V,PAROLLES,"displeasure."
II,V,LAFEU,"You have made shift to run into 't, boots and spurs"
II,V,LAFEU,"and all, like him that leaped into the custard; and"
II,V,LAFEU,"out of it you'll run again, rather than suffer"
II,V,LAFEU,"question for your residence."
II,V,BERTRAM,"It may be you have mistaken him, my lord."
II,V,LAFEU,"And shall do so ever, though I took him at 's"
II,V,LAFEU,"prayers. Fare you well, my lord; and believe this"
II,V,LAFEU,"of me, there can be no kernel in this light nut; the"
II,V,LAFEU,"soul of this man is his clothes. Trust him not in"
II,V,LAFEU,"matter of heavy consequence; I have kept of them"
II,V,LAFEU,"tame, and know their natures. Farewell, monsieur:"
II,V,LAFEU,"I have spoken better of you than you have or will to"
II,V,LAFEU,"deserve at my hand; but we must do good against evil."
II,V,PAROLLES,"An idle lord. I swear."
II,V,BERTRAM,"I think so."
II,V,PAROLLES,"Why, do you not know him?"
II,V,BERTRAM,"Yes, I do know him well, and common speech"
II,V,BERTRAM,"Gives him a worthy pass. Here comes my clog."
II,V,HELENA,"I have, sir, as I was commanded from you,"
II,V,HELENA,"Spoke with the king and have procured his leave"
II,V,HELENA,"For present parting; only he desires"
II,V,HELENA,"Some private speech with you."
II,V,BERTRAM,"I shall obey his will."
II,V,BERTRAM,"You must not marvel, Helen, at my course,"
II,V,BERTRAM,"Which holds not colour with the time, nor does"
II,V,BERTRAM,"The ministration and required office"
II,V,BERTRAM,"On my particular. Prepared I was not"
II,V,BERTRAM,"For such a business; therefore am I found"
II,V,BERTRAM,"So much unsettled: this drives me to entreat you"
II,V,BERTRAM,"That presently you take our way for home;"
II,V,BERTRAM,"And rather muse than ask why I entreat you,"
II,V,BERTRAM,"For my respects are better than they seem"
II,V,BERTRAM,"And my appointments have in them a need"
II,V,BERTRAM,"Greater than shows itself at the first view"
II,V,BERTRAM,"To you that know them not. This to my mother:"
II,V,BERTRAM,"'Twill be two days ere I shall see you, so"
II,V,BERTRAM,"I leave you to your wisdom."
II,V,HELENA,"Sir, I can nothing say,"
II,V,HELENA,"But that I am your most obedient servant."
II,V,BERTRAM,"Come, come, no more of that."
II,V,HELENA,"And ever shall"
II,V,HELENA,"With true observance seek to eke out that"
II,V,HELENA,"Wherein toward me my homely stars have fail'd"
II,V,HELENA,"To equal my great fortune."
II,V,BERTRAM,"Let that go:"
II,V,BERTRAM,"My haste is very great: farewell; hie home."
II,V,HELENA,"Pray, sir, your pardon."
II,V,BERTRAM,"Well, what would you say?"
II,V,HELENA,"I am not worthy of the wealth I owe,"
II,V,HELENA,"Nor dare I say 'tis mine, and yet it is;"
II,V,HELENA,"But, like a timorous thief, most fain would steal"
II,V,HELENA,"What law does vouch mine own."
II,V,BERTRAM,"What would you have?"
II,V,HELENA,"Something; and scarce so much: nothing, indeed."
II,V,HELENA,"I would not tell you what I would, my lord:"
II,V,HELENA,"Faith yes;"
II,V,HELENA,"Strangers and foes do sunder, and not kiss."
II,V,BERTRAM,"I pray you, stay not, but in haste to horse."
II,V,HELENA,"I shall not break your bidding, good my lord."
II,V,BERTRAM,"Where are my other men, monsieur? Farewell."
II,V,BERTRAM,"Go thou toward home; where I will never come"
II,V,BERTRAM,"Whilst I can shake my sword or hear the drum."
II,V,BERTRAM,"Away, and for our flight."
II,V,PAROLLES,"Bravely, coragio!"
III,I,DUKE,"So that from point to point now have you heard"
III,I,DUKE,"The fundamental reasons of this war,"
III,I,DUKE,"Whose great decision hath much blood let forth"
III,I,DUKE,"And more thirsts after."
III,I,First Lord,"Holy seems the quarrel"
III,I,First Lord,"Upon your grace's part; black and fearful"
III,I,First Lord,"On the opposer."
III,I,DUKE,"Therefore we marvel much our cousin France"
III,I,DUKE,"Would in so just a business shut his bosom"
III,I,DUKE,"Against our borrowing prayers."
III,I,Second Lord,"Good my lord,"
III,I,Second Lord,"The reasons of our state I cannot yield,"
III,I,Second Lord,"But like a common and an outward man,"
III,I,Second Lord,"That the great figure of a council frames"
III,I,Second Lord,"By self-unable motion: therefore dare not"
III,I,Second Lord,"Say what I think of it, since I have found"
III,I,Second Lord,"Myself in my incertain grounds to fail"
III,I,Second Lord,"As often as I guess'd."
III,I,DUKE,"Be it his pleasure."
III,I,First Lord,"But I am sure the younger of our nature,"
III,I,First Lord,"That surfeit on their ease, will day by day"
III,I,First Lord,"Come here for physic."
III,I,DUKE,"Welcome shall they be;"
III,I,DUKE,"And all the honours that can fly from us"
III,I,DUKE,"Shall on them settle. You know your places well;"
III,I,DUKE,"When better fall, for your avails they fell:"
III,I,DUKE,"To-morrow to the field."
III,II,COUNTESS,"It hath happened all as I would have had it, save"
III,II,COUNTESS,"that he comes not along with her."
III,II,Clown,"By my troth, I take my young lord to be a very"
III,II,Clown,"melancholy man."
III,II,COUNTESS,"By what observance, I pray you?"
III,II,Clown,"Why, he will look upon his boot and sing; mend the"
III,II,Clown,"ruff and sing; ask questions and sing; pick his"
III,II,Clown,"teeth and sing. I know a man that had this trick of"
III,II,Clown,"melancholy sold a goodly manor for a song."
III,II,COUNTESS,"Let me see what he writes, and when he means to come."
III,II,Clown,"I have no mind to Isbel since I was at court: our"
III,II,Clown,"old ling and our Isbels o' the country are nothing"
III,II,Clown,"like your old ling and your Isbels o' the court:"
III,II,Clown,"the brains of my Cupid's knocked out, and I begin to"
III,II,Clown,"love, as an old man loves money, with no stomach."
III,II,COUNTESS,"What have we here?"
III,II,Clown,"E'en that you have there."
III,II,COUNTESS,"recovered the king, and undone me. I have wedded"
III,II,COUNTESS,"her, not bedded her; and sworn to make the 'not'"
III,II,COUNTESS,"eternal. You shall hear I am run away: know it"
III,II,COUNTESS,"before the report come. If there be breadth enough"
III,II,COUNTESS,"in the world, I will hold a long distance. My duty"
III,II,COUNTESS,"to you. Your unfortunate son,"
III,II,COUNTESS,"BERTRAM."
III,II,COUNTESS,"This is not well, rash and unbridled boy."
III,II,COUNTESS,"To fly the favours of so good a king;"
III,II,COUNTESS,"To pluck his indignation on thy head"
III,II,COUNTESS,"By the misprising of a maid too virtuous"
III,II,COUNTESS,"For the contempt of empire."
III,II,Clown,"O madam, yonder is heavy news within between two"
III,II,Clown,"soldiers and my young lady!"
III,II,COUNTESS,"What is the matter?"
III,II,Clown,"Nay, there is some comfort in the news, some"
III,II,Clown,"comfort; your son will not be killed so soon as I"
III,II,Clown,"thought he would."
III,II,COUNTESS,"Why should he be killed?"
III,II,Clown,"So say I, madam, if he run away, as I hear he does:"
III,II,Clown,"the danger is in standing to't; that's the loss of"
III,II,Clown,"men, though it be the getting of children. Here"
III,II,Clown,"they come will tell you more: for my part, I only"
III,II,Clown,"hear your son was run away."
III,II,First Gentleman,"Save you, good madam."
III,II,HELENA,"Madam, my lord is gone, for ever gone."
III,II,Second Gentleman,"Do not say so."
III,II,COUNTESS,"Think upon patience. Pray you, gentlemen,"
III,II,COUNTESS,"I have felt so many quirks of joy and grief,"
III,II,COUNTESS,"That the first face of neither, on the start,"
III,II,COUNTESS,"Can woman me unto't: where is my son, I pray you?"
III,II,Second Gentleman,"Madam, he's gone to serve the duke of Florence:"
III,II,Second Gentleman,"We met him thitherward; for thence we came,"
III,II,Second Gentleman,"And, after some dispatch in hand at court,"
III,II,Second Gentleman,"Thither we bend again."
III,II,HELENA,"Look on his letter, madam; here's my passport."
III,II,HELENA,"When thou canst get the ring upon my finger which"
III,II,HELENA,"never shall come off, and show me a child begotten"
III,II,HELENA,"of thy body that I am father to, then call me"
III,II,HELENA,"husband: but in such a 'then' I write a 'never.'"
III,II,HELENA,"This is a dreadful sentence."
III,II,COUNTESS,"Brought you this letter, gentlemen?"
III,II,First Gentleman,"Ay, madam;"
III,II,First Gentleman,"And for the contents' sake are sorry for our pain."
III,II,COUNTESS,"I prithee, lady, have a better cheer;"
III,II,COUNTESS,"If thou engrossest all the griefs are thine,"
III,II,COUNTESS,"Thou robb'st me of a moiety: he was my son;"
III,II,COUNTESS,"But I do wash his name out of my blood,"
III,II,COUNTESS,"And thou art all my child. Towards Florence is he?"
III,II,Second Gentleman,"Ay, madam."
III,II,COUNTESS,"And to be a soldier?"
III,II,Second Gentleman,"Such is his noble purpose; and believe 't,"
III,II,Second Gentleman,"The duke will lay upon him all the honour"
III,II,Second Gentleman,"That good convenience claims."
III,II,COUNTESS,"Return you thither?"
