III,II,First Gentleman,"Ay, madam, with the swiftest wing of speed."
III,II,HELENA,"'Tis bitter."
III,II,COUNTESS,"Find you that there?"
III,II,HELENA,"Ay, madam."
III,II,First Gentleman,"'Tis but the boldness of his hand, haply, which his"
III,II,First Gentleman,"heart was not consenting to."
III,II,COUNTESS,"Nothing in France, until he have no wife!"
III,II,COUNTESS,"There's nothing here that is too good for him"
III,II,COUNTESS,"But only she; and she deserves a lord"
III,II,COUNTESS,"That twenty such rude boys might tend upon"
III,II,COUNTESS,"And call her hourly mistress. Who was with him?"
III,II,First Gentleman,"A servant only, and a gentleman"
III,II,First Gentleman,"Which I have sometime known."
III,II,COUNTESS,"Parolles, was it not?"
III,II,First Gentleman,"Ay, my good lady, he."
III,II,COUNTESS,"A very tainted fellow, and full of wickedness."
III,II,COUNTESS,"My son corrupts a well-derived nature"
III,II,COUNTESS,"With his inducement."
III,II,First Gentleman,"Indeed, good lady,"
III,II,First Gentleman,"The fellow has a deal of that too much,"
III,II,First Gentleman,"Which holds him much to have."
III,II,COUNTESS,"You're welcome, gentlemen."
III,II,COUNTESS,"I will entreat you, when you see my son,"
III,II,COUNTESS,"To tell him that his sword can never win"
III,II,COUNTESS,"The honour that he loses: more I'll entreat you"
III,II,COUNTESS,"Written to bear along."
III,II,Second Gentleman,"We serve you, madam,"
III,II,Second Gentleman,"In that and all your worthiest affairs."
III,II,COUNTESS,"Not so, but as we change our courtesies."
III,II,COUNTESS,"Will you draw near!"
III,II,HELENA,"'Till I have no wife, I have nothing in France.'"
III,II,HELENA,"Nothing in France, until he has no wife!"
III,II,HELENA,"Thou shalt have none, Rousillon, none in France;"
III,II,HELENA,"Then hast thou all again. Poor lord! is't I"
III,II,HELENA,"That chase thee from thy country and expose"
III,II,HELENA,"Those tender limbs of thine to the event"
III,II,HELENA,"Of the none-sparing war? and is it I"
III,II,HELENA,"That drive thee from the sportive court, where thou"
III,II,HELENA,"Wast shot at with fair eyes, to be the mark"
III,II,HELENA,"Of smoky muskets? O you leaden messengers,"
III,II,HELENA,"That ride upon the violent speed of fire,"
III,II,HELENA,"Fly with false aim; move the still-peering air,"
III,II,HELENA,"That sings with piercing; do not touch my lord."
III,II,HELENA,"Whoever shoots at him, I set him there;"
III,II,HELENA,"Whoever charges on his forward breast,"
III,II,HELENA,"I am the caitiff that do hold him to't;"
III,II,HELENA,"And, though I kill him not, I am the cause"
III,II,HELENA,"His death was so effected: better 'twere"
III,II,HELENA,"I met the ravin lion when he roar'd"
III,II,HELENA,"With sharp constraint of hunger; better 'twere"
III,II,HELENA,"That all the miseries which nature owes"
III,II,HELENA,"Were mine at once. No, come thou home, Rousillon,"
III,II,HELENA,"Whence honour but of danger wins a scar,"
III,II,HELENA,"As oft it loses all: I will be gone;"
III,II,HELENA,"My being here it is that holds thee hence:"
III,II,HELENA,"Shall I stay here to do't?  no, no, although"
III,II,HELENA,"The air of paradise did fan the house"
III,II,HELENA,"And angels officed all: I will be gone,"
III,II,HELENA,"That pitiful rumour may report my flight,"
III,II,HELENA,"To consolate thine ear. Come, night; end, day!"
III,II,HELENA,"For with the dark, poor thief, I'll steal away."
III,III,DUKE,"The general of our horse thou art; and we,"
III,III,DUKE,"Great in our hope, lay our best love and credence"
III,III,DUKE,"Upon thy promising fortune."
III,III,BERTRAM,"Sir, it is"
III,III,BERTRAM,"A charge too heavy for my strength, but yet"
III,III,BERTRAM,"We'll strive to bear it for your worthy sake"
III,III,BERTRAM,"To the extreme edge of hazard."
III,III,DUKE,"Then go thou forth;"
III,III,DUKE,"And fortune play upon thy prosperous helm,"
III,III,DUKE,"As thy auspicious mistress!"
III,III,BERTRAM,"This very day,"
III,III,BERTRAM,"Great Mars, I put myself into thy file:"
III,III,BERTRAM,"Make me but like my thoughts, and I shall prove"
III,III,BERTRAM,"A lover of thy drum, hater of love."
III,IV,COUNTESS,"Alas! and would you take the letter of her?"
III,IV,COUNTESS,"Might you not know she would do as she has done,"
III,IV,COUNTESS,"By sending me a letter? Read it again."
III,IV,Steward,"I am Saint Jaques' pilgrim, thither gone:"
III,IV,Steward,"Ambitious love hath so in me offended,"
III,IV,Steward,"That barefoot plod I the cold ground upon,"
III,IV,Steward,"With sainted vow my faults to have amended."
III,IV,Steward,"Write, write, that from the bloody course of war"
III,IV,Steward,"My dearest master, your dear son, may hie:"
III,IV,Steward,"Bless him at home in peace, whilst I from far"
III,IV,Steward,"His name with zealous fervor sanctify:"
III,IV,Steward,"His taken labours bid him me forgive;"
III,IV,Steward,"I, his despiteful Juno, sent him forth"
III,IV,Steward,"From courtly friends, with camping foes to live,"
III,IV,Steward,"Where death and danger dogs the heels of worth:"
III,IV,Steward,"He is too good and fair for death and me:"
III,IV,Steward,"Whom I myself embrace, to set him free."
III,IV,COUNTESS,"Ah, what sharp stings are in her mildest words!"
III,IV,COUNTESS,"Rinaldo, you did never lack advice so much,"
III,IV,COUNTESS,"As letting her pass so: had I spoke with her,"
III,IV,COUNTESS,"I could have well diverted her intents,"
III,IV,COUNTESS,"Which thus she hath prevented."
III,IV,Steward,"Pardon me, madam:"
III,IV,Steward,"If I had given you this at over-night,"
III,IV,Steward,"She might have been o'erta'en; and yet she writes,"
III,IV,Steward,"Pursuit would be but vain."
III,IV,COUNTESS,"What angel shall"
III,IV,COUNTESS,"Bless this unworthy husband? he cannot thrive,"
III,IV,COUNTESS,"Unless her prayers, whom heaven delights to hear"
III,IV,COUNTESS,"And loves to grant, reprieve him from the wrath"
III,IV,COUNTESS,"Of greatest justice. Write, write, Rinaldo,"
III,IV,COUNTESS,"To this unworthy husband of his wife;"
III,IV,COUNTESS,"Let every word weigh heavy of her worth"
III,IV,COUNTESS,"That he does weigh too light: my greatest grief."
III,IV,COUNTESS,"Though little he do feel it, set down sharply."
III,IV,COUNTESS,"Dispatch the most convenient messenger:"
III,IV,COUNTESS,"When haply he shall hear that she is gone,"
III,IV,COUNTESS,"He will return; and hope I may that she,"
III,IV,COUNTESS,"Hearing so much, will speed her foot again,"
III,IV,COUNTESS,"Led hither by pure love: which of them both"
III,IV,COUNTESS,"Is dearest to me. I have no skill in sense"
III,IV,COUNTESS,"To make distinction: provide this messenger:"
III,IV,COUNTESS,"My heart is heavy and mine age is weak;"
III,IV,COUNTESS,"Grief would have tears, and sorrow bids me speak."
III,V,Widow,"Nay, come; for if they do approach the city, we"
III,V,Widow,"shall lose all the sight."
III,V,DIANA,"They say the French count has done most honourable service."
III,V,Widow,"It is reported that he has taken their greatest"
III,V,Widow,"commander; and that with his own hand he slew the"
III,V,Widow,"duke's brother."
III,V,Widow,"We have lost our labour; they are gone a contrary"
III,V,Widow,"way: hark! you may know by their trumpets."
III,V,MARIANA,"Come, let's return again, and suffice ourselves with"
III,V,MARIANA,"the report of it. Well, Diana, take heed of this"
III,V,MARIANA,"French earl: the honour of a maid is her name; and"
III,V,MARIANA,"no legacy is so rich as honesty."
III,V,Widow,"I have told my neighbour how you have been solicited"
III,V,Widow,"by a gentleman his companion."
III,V,MARIANA,"I know that knave; hang him! one Parolles: a"
III,V,MARIANA,"filthy officer he is in those suggestions for the"
III,V,MARIANA,"young earl. Beware of them, Diana; their promises,"
III,V,MARIANA,"enticements, oaths, tokens, and all these engines of"
III,V,MARIANA,"lust, are not the things they go under: many a maid"
III,V,MARIANA,"hath been seduced by them; and the misery is,"
III,V,MARIANA,"example, that so terrible shows in the wreck of"
III,V,MARIANA,"maidenhood, cannot for all that dissuade succession,"
III,V,MARIANA,"but that they are limed with the twigs that threaten"
III,V,MARIANA,"them. I hope I need not to advise you further; but"
III,V,MARIANA,"I hope your own grace will keep you where you are,"
III,V,MARIANA,"though there were no further danger known but the"
III,V,MARIANA,"modesty which is so lost."
III,V,DIANA,"You shall not need to fear me."
III,V,Widow,"I hope so."
III,V,Widow,"Look, here comes a pilgrim: I know she will lie at"
III,V,Widow,"my house; thither they send one another: I'll"
III,V,Widow,"question her. God save you, pilgrim! whither are you bound?"
III,V,HELENA,"To Saint Jaques le Grand."
III,V,HELENA,"Where do the palmers lodge, I do beseech you?"
III,V,Widow,"At the Saint Francis here beside the port."
III,V,HELENA,"Is this the way?"
III,V,Widow,"Ay, marry, is't."
III,V,Widow,"Hark you! they come this way."
III,V,Widow,"If you will tarry, holy pilgrim,"
III,V,Widow,"But till the troops come by,"
III,V,Widow,"I will conduct you where you shall be lodged;"
III,V,Widow,"The rather, for I think I know your hostess"
III,V,Widow,"As ample as myself."
III,V,HELENA,"Is it yourself?"
III,V,Widow,"If you shall please so, pilgrim."
III,V,HELENA,"I thank you, and will stay upon your leisure."
III,V,Widow,"You came, I think, from France?"
III,V,HELENA,"I did so."
III,V,Widow,"Here you shall see a countryman of yours"
III,V,Widow,"That has done worthy service."
III,V,HELENA,"His name, I pray you."
III,V,DIANA,"The Count Rousillon: know you such a one?"
III,V,HELENA,"But by the ear, that hears most nobly of him:"
III,V,HELENA,"His face I know not."
III,V,DIANA,"Whatsome'er he is,"
III,V,DIANA,"He's bravely taken here. He stole from France,"
III,V,DIANA,"As 'tis reported, for the king had married him"
III,V,DIANA,"Against his liking: think you it is so?"
III,V,HELENA,"Ay, surely, mere the truth: I know his lady."
III,V,DIANA,"There is a gentleman that serves the count"
III,V,DIANA,"Reports but coarsely of her."
III,V,HELENA,"What's his name?"
III,V,DIANA,"Monsieur Parolles."
III,V,HELENA,"O, I believe with him,"
III,V,HELENA,"In argument of praise, or to the worth"
III,V,HELENA,"Of the great count himself, she is too mean"
III,V,HELENA,"To have her name repeated: all her deserving"
III,V,HELENA,"Is a reserved honesty, and that"
III,V,HELENA,"I have not heard examined."
III,V,DIANA,"Alas, poor lady!"
III,V,DIANA,"'Tis a hard bondage to become the wife"
III,V,DIANA,"Of a detesting lord."
III,V,Widow,"I warrant, good creature, wheresoe'er she is,"
III,V,Widow,"Her heart weighs sadly: this young maid might do her"
III,V,Widow,"A shrewd turn, if she pleased."
III,V,HELENA,"How do you mean?"
III,V,HELENA,"May be the amorous count solicits her"
III,V,HELENA,"In the unlawful purpose."
III,V,Widow,"He does indeed;"
III,V,Widow,"And brokes with all that can in such a suit"
III,V,Widow,"Corrupt the tender honour of a maid:"
III,V,Widow,"But she is arm'd for him and keeps her guard"
III,V,Widow,"In honestest defence."
III,V,MARIANA,"The gods forbid else!"
III,V,Widow,"So, now they come:"
III,V,Widow,"That is Antonio, the duke's eldest son;"
III,V,Widow,"That, Escalus."
III,V,HELENA,"Which is the Frenchman?"
III,V,DIANA,"He;"
III,V,DIANA,"That with the plume: 'tis a most gallant fellow."
III,V,DIANA,"I would he loved his wife: if he were honester"
III,V,DIANA,"He were much goodlier: is't not a handsome gentleman?"
III,V,HELENA,"I like him well."
III,V,DIANA,"'Tis pity he is not honest: yond's that same knave"
III,V,DIANA,"That leads him to these places: were I his lady,"
III,V,DIANA,"I would Poison that vile rascal."
III,V,HELENA,"Which is he?"
III,V,DIANA,"That jack-an-apes with scarfs: why is he melancholy?"
III,V,HELENA,"Perchance he's hurt i' the battle."
III,V,PAROLLES,"Lose our drum! well."
III,V,MARIANA,"He's shrewdly vexed at something: look, he has spied us."
III,V,Widow,"Marry, hang you!"
III,V,MARIANA,"And your courtesy, for a ring-carrier!"
III,V,Widow,"The troop is past. Come, pilgrim, I will bring you"
III,V,Widow,"Where you shall host: of enjoin'd penitents"
III,V,Widow,"There's four or five, to great Saint Jaques bound,"
III,V,Widow,"Already at my house."
III,V,HELENA,"I humbly thank you:"
III,V,HELENA,"Please it this matron and this gentle maid"
III,V,HELENA,"To eat with us to-night, the charge and thanking"
III,V,HELENA,"Shall be for me; and, to requite you further,"
III,V,HELENA,"I will bestow some precepts of this virgin"
III,V,HELENA,"Worthy the note."
III,V,BOTH,"We'll take your offer kindly."
III,VI,Second Lord,"Nay, good my lord, put him to't; let him have his"
III,VI,Second Lord,"way."
III,VI,First Lord,"If your lordship find him not a hilding, hold me no"
III,VI,First Lord,"more in your respect."
III,VI,Second Lord,"On my life, my lord, a bubble."
III,VI,BERTRAM,"Do you think I am so far deceived in him?"
III,VI,Second Lord,"Believe it, my lord, in mine own direct knowledge,"
III,VI,Second Lord,"without any malice, but to speak of him as my"
III,VI,Second Lord,"kinsman, he's a most notable coward, an infinite and"
III,VI,Second Lord,"endless liar, an hourly promise-breaker, the owner"
III,VI,Second Lord,"of no one good quality worthy your lordship's"
III,VI,Second Lord,"entertainment."
III,VI,First Lord,"It were fit you knew him; lest, reposing too far in"
III,VI,First Lord,"his virtue, which he hath not, he might at some"
III,VI,First Lord,"great and trusty business in a main danger fail you."
III,VI,BERTRAM,"I would I knew in what particular action to try him."
III,VI,First Lord,"None better than to let him fetch off his drum,"
III,VI,First Lord,"which you hear him so confidently undertake to do."
III,VI,Second Lord,"I, with a troop of Florentines, will suddenly"
III,VI,Second Lord,"surprise him; such I will have, whom I am sure he"
III,VI,Second Lord,"knows not from the enemy: we will bind and hoodwink"
III,VI,Second Lord,"him so, that he shall suppose no other but that he"
III,VI,Second Lord,"is carried into the leaguer of the adversaries, when"
III,VI,Second Lord,"we bring him to our own tents. Be but your lordship"
III,VI,Second Lord,"present at his examination: if he do not, for the"
III,VI,Second Lord,"promise of his life and in the highest compulsion of"
III,VI,Second Lord,"base fear, offer to betray you and deliver all the"
III,VI,Second Lord,"intelligence in his power against you, and that with"
III,VI,Second Lord,"the divine forfeit of his soul upon oath, never"
III,VI,Second Lord,"trust my judgment in any thing."
III,VI,First Lord,"O, for the love of laughter, let him fetch his drum;"
III,VI,First Lord,"he says he has a stratagem for't: when your"
III,VI,First Lord,"lordship sees the bottom of his success in't, and to"
III,VI,First Lord,"what metal this counterfeit lump of ore will be"
III,VI,First Lord,"melted, if you give him not John Drum's"
III,VI,First Lord,"entertainment, your inclining cannot be removed."
III,VI,First Lord,"Here he comes."
III,VI,Second Lord,"hinder not the honour of his design: let him fetch"
III,VI,Second Lord,"off his drum in any hand."
III,VI,BERTRAM,"How now, monsieur! this drum sticks sorely in your"
III,VI,BERTRAM,"disposition."
III,VI,First Lord,"A pox on't, let it go; 'tis but a drum."
III,VI,PAROLLES,"'But a drum'! is't 'but a drum'? A drum so lost!"
III,VI,PAROLLES,"There was excellent command,--to charge in with our"
III,VI,PAROLLES,"horse upon our own wings, and to rend our own soldiers!"
III,VI,First Lord,"That was not to be blamed in the command of the"
III,VI,First Lord,"service: it was a disaster of war that Caesar"
III,VI,First Lord,"himself could not have prevented, if he had been"
III,VI,First Lord,"there to command."
III,VI,BERTRAM,"Well, we cannot greatly condemn our success: some"
III,VI,BERTRAM,"dishonour we had in the loss of that drum; but it is"
III,VI,BERTRAM,"not to be recovered."
III,VI,PAROLLES,"It might have been recovered."
III,VI,BERTRAM,"It might; but it is not now."
III,VI,PAROLLES,"It is to be recovered: but that the merit of"
III,VI,PAROLLES,"service is seldom attributed to the true and exact"
III,VI,PAROLLES,"performer, I would have that drum or another, or"
III,VI,PAROLLES,"'hic jacet.'"
III,VI,BERTRAM,"Why, if you have a stomach, to't, monsieur: if you"
III,VI,BERTRAM,"think your mystery in stratagem can bring this"
III,VI,BERTRAM,"instrument of honour again into his native quarter,"
III,VI,BERTRAM,"be magnanimous in the enterprise and go on; I will"
III,VI,BERTRAM,"grace the attempt for a worthy exploit: if you"
III,VI,BERTRAM,"speed well in it, the duke shall both speak of it."
III,VI,BERTRAM,"and extend to you what further becomes his"
III,VI,BERTRAM,"greatness, even to the utmost syllable of your"
III,VI,BERTRAM,"worthiness."
III,VI,PAROLLES,"By the hand of a soldier, I will undertake it."
III,VI,BERTRAM,"But you must not now slumber in it."
III,VI,PAROLLES,"I'll about it this evening: and I will presently"
III,VI,PAROLLES,"pen down my dilemmas, encourage myself in my"
III,VI,PAROLLES,"certainty, put myself into my mortal preparation;"
III,VI,PAROLLES,"and by midnight look to hear further from me."
III,VI,BERTRAM,"May I be bold to acquaint his grace you are gone about it?"
III,VI,PAROLLES,"I know not what the success will be, my lord; but"
III,VI,PAROLLES,"the attempt I vow."
III,VI,BERTRAM,"I know thou'rt valiant; and, to the possibility of"
III,VI,BERTRAM,"thy soldiership, will subscribe for thee. Farewell."
III,VI,PAROLLES,"I love not many words."
III,VI,Second Lord,"No more than a fish loves water. Is not this a"
III,VI,Second Lord,"strange fellow, my lord, that so confidently seems"
III,VI,Second Lord,"to undertake this business, which he knows is not to"
III,VI,Second Lord,"be done; damns himself to do and dares better be"
III,VI,Second Lord,"damned than to do't?"
III,VI,First Lord,"You do not know him, my lord, as we do: certain it"
III,VI,First Lord,"is that he will steal himself into a man's favour and"
III,VI,First Lord,"for a week escape a great deal of discoveries; but"
III,VI,First Lord,"when you find him out, you have him ever after."
III,VI,BERTRAM,"Why, do you think he will make no deed at all of"
III,VI,BERTRAM,"this that so seriously he does address himself unto?"
III,VI,Second Lord,"None in the world; but return with an invention and"
III,VI,Second Lord,"clap upon you two or three probable lies: but we"
III,VI,Second Lord,"have almost embossed him; you shall see his fall"
III,VI,Second Lord,"to-night; for indeed he is not for your lordship's respect."
III,VI,First Lord,"We'll make you some sport with the fox ere we case"
III,VI,First Lord,"him. He was first smoked by the old lord Lafeu:"
III,VI,First Lord,"when his disguise and he is parted, tell me what a"
III,VI,First Lord,"sprat you shall find him; which you shall see this"
III,VI,First Lord,"very night."
III,VI,Second Lord,"I must go look my twigs: he shall be caught."
III,VI,BERTRAM,"Your brother he shall go along with me."
III,VI,Second Lord,"As't please your lordship: I'll leave you."
III,VI,BERTRAM,"Now will I lead you to the house, and show you"
III,VI,BERTRAM,"The lass I spoke of."
III,VI,First Lord,"But you say she's honest."
III,VI,BERTRAM,"That's all the fault: I spoke with her but once"
III,VI,BERTRAM,"And found her wondrous cold; but I sent to her,"
III,VI,BERTRAM,"By this same coxcomb that we have i' the wind,"
III,VI,BERTRAM,"Tokens and letters which she did re-send;"
III,VI,BERTRAM,"And this is all I have done. She's a fair creature:"
III,VI,BERTRAM,"Will you go see her?"
III,VI,First Lord,"With all my heart, my lord."
III,VII,HELENA,"If you misdoubt me that I am not she,"
III,VII,HELENA,"I know not how I shall assure you further,"
III,VII,HELENA,"But I shall lose the grounds I work upon."
III,VII,Widow,"Though my estate be fallen, I was well born,"
III,VII,Widow,"Nothing acquainted with these businesses;"
III,VII,Widow,"And would not put my reputation now"
III,VII,Widow,"In any staining act."
III,VII,HELENA,"Nor would I wish you."
III,VII,HELENA,"First, give me trust, the count he is my husband,"
III,VII,HELENA,"And what to your sworn counsel I have spoken"
III,VII,HELENA,"Is so from word to word; and then you cannot,"
III,VII,HELENA,"By the good aid that I of you shall borrow,"
III,VII,HELENA,"Err in bestowing it."
III,VII,Widow,"I should believe you:"
III,VII,Widow,"For you have show'd me that which well approves"
III,VII,Widow,"You're great in fortune."
III,VII,HELENA,"Take this purse of gold,"
III,VII,HELENA,"And let me buy your friendly help thus far,"
III,VII,HELENA,"Which I will over-pay and pay again"
III,VII,HELENA,"When I have found it. The count he wooes your daughter,"
III,VII,HELENA,"Lays down his wanton siege before her beauty,"
III,VII,HELENA,"Resolved to carry her: let her in fine consent,"
III,VII,HELENA,"As we'll direct her how 'tis best to bear it."
III,VII,HELENA,"Now his important blood will nought deny"
III,VII,HELENA,"That she'll demand: a ring the county wears,"
III,VII,HELENA,"That downward hath succeeded in his house"
III,VII,HELENA,"From son to son, some four or five descents"
III,VII,HELENA,"Since the first father wore it: this ring he holds"
III,VII,HELENA,"In most rich choice; yet in his idle fire,"
III,VII,HELENA,"To buy his will, it would not seem too dear,"
III,VII,HELENA,"Howe'er repented after."
III,VII,Widow,"Now I see"
III,VII,Widow,"The bottom of your purpose."
III,VII,HELENA,"You see it lawful, then: it is no more,"
III,VII,HELENA,"But that your daughter, ere she seems as won,"
III,VII,HELENA,"Desires this ring; appoints him an encounter;"
III,VII,HELENA,"In fine, delivers me to fill the time,"
III,VII,HELENA,"Herself most chastely absent: after this,"
III,VII,HELENA,"To marry her, I'll add three thousand crowns"
III,VII,HELENA,"To what is passed already."
III,VII,Widow,"I have yielded:"
III,VII,Widow,"Instruct my daughter how she shall persever,"
III,VII,Widow,"That time and place with this deceit so lawful"
III,VII,Widow,"May prove coherent. Every night he comes"
III,VII,Widow,"With musics of all sorts and songs composed"
III,VII,Widow,"To her unworthiness: it nothing steads us"
III,VII,Widow,"To chide him from our eaves; for he persists"
III,VII,Widow,"As if his life lay on't."
III,VII,HELENA,"Why then to-night"
III,VII,HELENA,"Let us assay our plot; which, if it speed,"
III,VII,HELENA,"Is wicked meaning in a lawful deed"
III,VII,HELENA,"And lawful meaning in a lawful act,"
III,VII,HELENA,"Where both not sin, and yet a sinful fact:"
III,VII,HELENA,"But let's about it."
IV,I,Second Lord,"He can come no other way but by this hedge-corner."
IV,I,Second Lord,"When you sally upon him, speak what terrible"
IV,I,Second Lord,"language you will: though you understand it not"
IV,I,Second Lord,"yourselves, no matter; for we must not seem to"
IV,I,Second Lord,"understand him, unless some one among us whom we"
IV,I,Second Lord,"must produce for an interpreter."
IV,I,First Soldier,"Good captain, let me be the interpreter."
IV,I,Second Lord,"Art not acquainted with him? knows he not thy voice?"
IV,I,First Soldier,"No, sir, I warrant you."
IV,I,Second Lord,"But what linsey-woolsey hast thou to speak to us again?"
IV,I,First Soldier,"E'en such as you speak to me."
IV,I,Second Lord,"He must think us some band of strangers i' the"
IV,I,Second Lord,"adversary's entertainment. Now he hath a smack of"
IV,I,Second Lord,"all neighbouring languages; therefore we must every"
IV,I,Second Lord,"one be a man of his own fancy, not to know what we"
IV,I,Second Lord,"speak one to another; so we seem to know, is to"
IV,I,Second Lord,"know straight our purpose: choughs' language,"
IV,I,Second Lord,"gabble enough, and good enough. As for you,"
IV,I,Second Lord,"interpreter, you must seem very politic. But couch,"
IV,I,Second Lord,"ho! here he comes, to beguile two hours in a sleep,"
IV,I,Second Lord,"and then to return and swear the lies he forges."
IV,I,PAROLLES,"Ten o'clock: within these three hours 'twill be"
IV,I,PAROLLES,"time enough to go home. What shall I say I have"
IV,I,PAROLLES,"done? It must be a very plausive invention that"
IV,I,PAROLLES,"carries it: they begin to smoke me; and disgraces"
IV,I,PAROLLES,"have of late knocked too often at my door. I find"
IV,I,PAROLLES,"my tongue is too foolhardy; but my heart hath the"
IV,I,PAROLLES,"fear of Mars before it and of his creatures, not"
IV,I,PAROLLES,"daring the reports of my tongue."
IV,I,Second Lord,"This is the first truth that e'er thine own tongue"
IV,I,Second Lord,"was guilty of."
IV,I,PAROLLES,"What the devil should move me to undertake the"
IV,I,PAROLLES,"recovery of this drum, being not ignorant of the"
IV,I,PAROLLES,"impossibility, and knowing I had no such purpose? I"
IV,I,PAROLLES,"must give myself some hurts, and say I got them in"
IV,I,PAROLLES,"exploit: yet slight ones will not carry it; they"
IV,I,PAROLLES,"will say, 'Came you off with so little?' and great"
IV,I,PAROLLES,"ones I dare not give. Wherefore, what's the"
IV,I,PAROLLES,"instance? Tongue, I must put you into a"
IV,I,PAROLLES,"butter-woman's mouth and buy myself another of"
IV,I,PAROLLES,"Bajazet's mule, if you prattle me into these perils."
IV,I,Second Lord,"Is it possible he should know what he is, and be"
IV,I,Second Lord,"that he is?"
IV,I,PAROLLES,"I would the cutting of my garments would serve the"
IV,I,PAROLLES,"turn, or the breaking of my Spanish sword."
IV,I,Second Lord,"We cannot afford you so."
IV,I,PAROLLES,"Or the baring of my beard; and to say it was in"
IV,I,PAROLLES,"stratagem."
IV,I,Second Lord,"'Twould not do."
IV,I,PAROLLES,"Or to drown my clothes, and say I was stripped."
IV,I,Second Lord,"Hardly serve."
IV,I,PAROLLES,"Though I swore I leaped from the window of the citadel."
IV,I,Second Lord,"How deep?"
IV,I,PAROLLES,"Thirty fathom."
IV,I,Second Lord,"Three great oaths would scarce make that be believed."
IV,I,PAROLLES,"I would I had any drum of the enemy's: I would swear"
