III,V,SILVIUS,"A scatter'd smile, and that I'll live upon."
III,V,PHEBE,"Know'st now the youth that spoke to me erewhile?"
III,V,SILVIUS,"Not very well, but I have met him oft;"
III,V,SILVIUS,"And he hath bought the cottage and the bounds"
III,V,SILVIUS,"That the old carlot once was master of."
III,V,PHEBE,"Think not I love him, though I ask for him:"
III,V,PHEBE,"'Tis but a peevish boy; yet he talks well;"
III,V,PHEBE,"But what care I for words? yet words do well"
III,V,PHEBE,"When he that speaks them pleases those that hear."
III,V,PHEBE,"It is a pretty youth: not very pretty:"
III,V,PHEBE,"But, sure, he's proud, and yet his pride becomes him:"
III,V,PHEBE,"He'll make a proper man: the best thing in him"
III,V,PHEBE,"Is his complexion; and faster than his tongue"
III,V,PHEBE,"Did make offence his eye did heal it up."
III,V,PHEBE,"He is not very tall; yet for his years he's tall:"
III,V,PHEBE,"His leg is but so so; and yet 'tis well:"
III,V,PHEBE,"There was a pretty redness in his lip,"
III,V,PHEBE,"A little riper and more lusty red"
III,V,PHEBE,"Than that mix'd in his cheek; 'twas just the difference"
III,V,PHEBE,"Between the constant red and mingled damask."
III,V,PHEBE,"There be some women, Silvius, had they mark'd him"
III,V,PHEBE,"In parcels as I did, would have gone near"
III,V,PHEBE,"To fall in love with him; but, for my part,"
III,V,PHEBE,"I love him not nor hate him not; and yet"
III,V,PHEBE,"I have more cause to hate him than to love him:"
III,V,PHEBE,"For what had he to do to chide at me?"
III,V,PHEBE,"He said mine eyes were black and my hair black:"
III,V,PHEBE,"And, now I am remember'd, scorn'd at me:"
III,V,PHEBE,"I marvel why I answer'd not again:"
III,V,PHEBE,"But that's all one; omittance is no quittance."
III,V,PHEBE,"I'll write to him a very taunting letter,"
III,V,PHEBE,"And thou shalt bear it: wilt thou, Silvius?"
III,V,SILVIUS,"Phebe, with all my heart."
III,V,PHEBE,"I'll write it straight;"
III,V,PHEBE,"The matter's in my head and in my heart:"
III,V,PHEBE,"I will be bitter with him and passing short."
III,V,PHEBE,"Go with me, Silvius."
IV,I,JAQUES,"I prithee, pretty youth, let me be better acquainted"
IV,I,JAQUES,"with thee."
IV,I,ROSALIND,"They say you are a melancholy fellow."
IV,I,JAQUES,"I am so; I do love it better than laughing."
IV,I,ROSALIND,"Those that are in extremity of either are abominable"
IV,I,ROSALIND,"fellows and betray themselves to every modern"
IV,I,ROSALIND,"censure worse than drunkards."
IV,I,JAQUES,"Why, 'tis good to be sad and say nothing."
IV,I,ROSALIND,"Why then, 'tis good to be a post."
IV,I,JAQUES,"I have neither the scholar's melancholy, which is"
IV,I,JAQUES,"emulation, nor the musician's, which is fantastical,"
IV,I,JAQUES,"nor the courtier's, which is proud, nor the"
IV,I,JAQUES,"soldier's, which is ambitious, nor the lawyer's,"
IV,I,JAQUES,"which is politic, nor the lady's, which is nice, nor"
IV,I,JAQUES,"the lover's, which is all these: but it is a"
IV,I,JAQUES,"melancholy of mine own, compounded of many simples,"
IV,I,JAQUES,"extracted from many objects, and indeed the sundry's"
IV,I,JAQUES,"contemplation of my travels, in which my often"
IV,I,JAQUES,"rumination wraps me m a most humorous sadness."
IV,I,ROSALIND,"A traveller! By my faith, you have great reason to"
IV,I,ROSALIND,"be sad: I fear you have sold your own lands to see"
IV,I,ROSALIND,"other men's; then, to have seen much and to have"
IV,I,ROSALIND,"nothing, is to have rich eyes and poor hands."
IV,I,JAQUES,"Yes, I have gained my experience."
IV,I,ROSALIND,"And your experience makes you sad: I had rather have"
IV,I,ROSALIND,"a fool to make me merry than experience to make me"
IV,I,ROSALIND,"sad; and to travel for it too!"
IV,I,ORLANDO,"Good day and happiness, dear Rosalind!"
IV,I,JAQUES,"Nay, then, God be wi' you, an you talk in blank verse."
IV,I,ROSALIND,"Farewell, Monsieur Traveller: look you lisp and"
IV,I,ROSALIND,"wear strange suits, disable all the benefits of your"
IV,I,ROSALIND,"own country, be out of love with your nativity and"
IV,I,ROSALIND,"almost chide God for making you that countenance you"
IV,I,ROSALIND,"are, or I will scarce think you have swam in a"
IV,I,ROSALIND,"gondola. Why, how now, Orlando! where have you been"
IV,I,ROSALIND,"all this while? You a lover! An you serve me such"
IV,I,ROSALIND,"another trick, never come in my sight more."
IV,I,ORLANDO,"My fair Rosalind, I come within an hour of my promise."
IV,I,ROSALIND,"Break an hour's promise in love! He that will"
IV,I,ROSALIND,"divide a minute into a thousand parts and break but"
IV,I,ROSALIND,"a part of the thousandth part of a minute in the"
IV,I,ROSALIND,"affairs of love, it may be said of him that Cupid"
IV,I,ROSALIND,"hath clapped him o' the shoulder, but I'll warrant"
IV,I,ROSALIND,"him heart-whole."
IV,I,ORLANDO,"Pardon me, dear Rosalind."
IV,I,ROSALIND,"Nay, an you be so tardy, come no more in my sight: I"
IV,I,ROSALIND,"had as lief be wooed of a snail."
IV,I,ORLANDO,"Of a snail?"
IV,I,ROSALIND,"Ay, of a snail; for though he comes slowly, he"
IV,I,ROSALIND,"carries his house on his head; a better jointure,"
IV,I,ROSALIND,"I think, than you make a woman: besides he brings"
IV,I,ROSALIND,"his destiny with him."
IV,I,ORLANDO,"What's that?"
IV,I,ROSALIND,"Why, horns, which such as you are fain to be"
IV,I,ROSALIND,"beholding to your wives for: but he comes armed in"
IV,I,ROSALIND,"his fortune and prevents the slander of his wife."
IV,I,ORLANDO,"Virtue is no horn-maker; and my Rosalind is virtuous."
IV,I,ROSALIND,"And I am your Rosalind."
IV,I,CELIA,"It pleases him to call you so; but he hath a"
IV,I,CELIA,"Rosalind of a better leer than you."
IV,I,ROSALIND,"Come, woo me, woo me, for now I am in a holiday"
IV,I,ROSALIND,"humour and like enough to consent. What would you"
IV,I,ROSALIND,"say to me now, an I were your very very Rosalind?"
IV,I,ORLANDO,"I would kiss before I spoke."
IV,I,ROSALIND,"Nay, you were better speak first, and when you were"
IV,I,ROSALIND,"gravelled for lack of matter, you might take"
IV,I,ROSALIND,"occasion to kiss. Very good orators, when they are"
IV,I,ROSALIND,"out, they will spit; and for lovers lacking--God"
IV,I,ROSALIND,"warn us!--matter, the cleanliest shift is to kiss."
IV,I,ORLANDO,"How if the kiss be denied?"
IV,I,ROSALIND,"Then she puts you to entreaty, and there begins new matter."
IV,I,ORLANDO,"Who could be out, being before his beloved mistress?"
IV,I,ROSALIND,"Marry, that should you, if I were your mistress, or"
IV,I,ROSALIND,"I should think my honesty ranker than my wit."
IV,I,ORLANDO,"What, of my suit?"
IV,I,ROSALIND,"Not out of your apparel, and yet out of your suit."
IV,I,ROSALIND,"Am not I your Rosalind?"
IV,I,ORLANDO,"I take some joy to say you are, because I would be"
IV,I,ORLANDO,"talking of her."
IV,I,ROSALIND,"Well in her person I say I will not have you."
IV,I,ORLANDO,"Then in mine own person I die."
IV,I,ROSALIND,"No, faith, die by attorney. The poor world is"
IV,I,ROSALIND,"almost six thousand years old, and in all this time"
IV,I,ROSALIND,"there was not any man died in his own person,"
IV,I,ROSALIND,"videlicit, in a love-cause. Troilus had his brains"
IV,I,ROSALIND,"dashed out with a Grecian club; yet he did what he"
IV,I,ROSALIND,"could to die before, and he is one of the patterns"
IV,I,ROSALIND,"of love. Leander, he would have lived many a fair"
IV,I,ROSALIND,"year, though Hero had turned nun, if it had not been"
IV,I,ROSALIND,"for a hot midsummer night; for, good youth, he went"
IV,I,ROSALIND,"but forth to wash him in the Hellespont and being"
IV,I,ROSALIND,"taken with the cramp was drowned and the foolish"
IV,I,ROSALIND,"coroners of that age found it was 'Hero of Sestos.'"
IV,I,ROSALIND,"But these are all lies: men have died from time to"
IV,I,ROSALIND,"time and worms have eaten them, but not for love."
IV,I,ORLANDO,"I would not have my right Rosalind of this mind,"
IV,I,ORLANDO,"for, I protest, her frown might kill me."
IV,I,ROSALIND,"By this hand, it will not kill a fly. But come, now"
IV,I,ROSALIND,"I will be your Rosalind in a more coming-on"
IV,I,ROSALIND,"disposition, and ask me what you will. I will grant"
IV,I,ROSALIND,"it."
IV,I,ORLANDO,"Then love me, Rosalind."
IV,I,ROSALIND,"Yes, faith, will I, Fridays and Saturdays and all."
IV,I,ORLANDO,"And wilt thou have me?"
IV,I,ROSALIND,"Ay, and twenty such."
IV,I,ORLANDO,"What sayest thou?"
IV,I,ROSALIND,"Are you not good?"
IV,I,ORLANDO,"I hope so."
IV,I,ROSALIND,"Why then, can one desire too much of a good thing?"
IV,I,ROSALIND,"Come, sister, you shall be the priest and marry us."
IV,I,ROSALIND,"Give me your hand, Orlando. What do you say, sister?"
IV,I,ORLANDO,"Pray thee, marry us."
IV,I,CELIA,"I cannot say the words."
IV,I,ROSALIND,"You must begin, 'Will you, Orlando--'"
IV,I,CELIA,"Go to. Will you, Orlando, have to wife this Rosalind?"
IV,I,ORLANDO,"I will."
IV,I,ROSALIND,"Ay, but when?"
IV,I,ORLANDO,"Why now; as fast as she can marry us."
IV,I,ROSALIND,"Then you must say 'I take thee, Rosalind, for wife.'"
IV,I,ORLANDO,"I take thee, Rosalind, for wife."
IV,I,ROSALIND,"I might ask you for your commission; but I do take"
IV,I,ROSALIND,"thee, Orlando, for my husband: there's a girl goes"
IV,I,ROSALIND,"before the priest; and certainly a woman's thought"
IV,I,ROSALIND,"runs before her actions."
IV,I,ORLANDO,"So do all thoughts; they are winged."
IV,I,ROSALIND,"Now tell me how long you would have her after you"
IV,I,ROSALIND,"have possessed her."
IV,I,ORLANDO,"For ever and a day."
IV,I,ROSALIND,"Say 'a day,' without the 'ever.' No, no, Orlando;"
IV,I,ROSALIND,"men are April when they woo, December when they wed:"
IV,I,ROSALIND,"maids are May when they are maids, but the sky"
IV,I,ROSALIND,"changes when they are wives. I will be more jealous"
IV,I,ROSALIND,"of thee than a Barbary cock-pigeon over his hen,"
IV,I,ROSALIND,"more clamorous than a parrot against rain, more"
IV,I,ROSALIND,"new-fangled than an ape, more giddy in my desires"
IV,I,ROSALIND,"than a monkey: I will weep for nothing, like Diana"
IV,I,ROSALIND,"in the fountain, and I will do that when you are"
IV,I,ROSALIND,"disposed to be merry; I will laugh like a hyen, and"
IV,I,ROSALIND,"that when thou art inclined to sleep."
IV,I,ORLANDO,"But will my Rosalind do so?"
IV,I,ROSALIND,"By my life, she will do as I do."
IV,I,ORLANDO,"O, but she is wise."
IV,I,ROSALIND,"Or else she could not have the wit to do this: the"
IV,I,ROSALIND,"wiser, the waywarder: make the doors upon a woman's"
IV,I,ROSALIND,"wit and it will out at the casement; shut that and"
IV,I,ROSALIND,"'twill out at the key-hole; stop that, 'twill fly"
IV,I,ROSALIND,"with the smoke out at the chimney."
IV,I,ORLANDO,"A man that had a wife with such a wit, he might say"
IV,I,ORLANDO,"'Wit, whither wilt?'"
IV,I,ROSALIND,"Nay, you might keep that cheque for it till you met"
IV,I,ROSALIND,"your wife's wit going to your neighbour's bed."
IV,I,ORLANDO,"And what wit could wit have to excuse that?"
IV,I,ROSALIND,"Marry, to say she came to seek you there. You shall"
IV,I,ROSALIND,"never take her without her answer, unless you take"
IV,I,ROSALIND,"her without her tongue. O, that woman that cannot"
IV,I,ROSALIND,"make her fault her husband's occasion, let her"
IV,I,ROSALIND,"never nurse her child herself, for she will breed"
IV,I,ROSALIND,"it like a fool!"
IV,I,ORLANDO,"For these two hours, Rosalind, I will leave thee."
IV,I,ROSALIND,"Alas! dear love, I cannot lack thee two hours."
IV,I,ORLANDO,"I must attend the duke at dinner: by two o'clock I"
IV,I,ORLANDO,"will be with thee again."
IV,I,ROSALIND,"Ay, go your ways, go your ways; I knew what you"
IV,I,ROSALIND,"would prove: my friends told me as much, and I"
IV,I,ROSALIND,"thought no less: that flattering tongue of yours"
IV,I,ROSALIND,"won me: 'tis but one cast away, and so, come,"
IV,I,ROSALIND,"death! Two o'clock is your hour?"
IV,I,ORLANDO,"Ay, sweet Rosalind."
IV,I,ROSALIND,"By my troth, and in good earnest, and so God mend"
IV,I,ROSALIND,"me, and by all pretty oaths that are not dangerous,"
IV,I,ROSALIND,"if you break one jot of your promise or come one"
IV,I,ROSALIND,"minute behind your hour, I will think you the most"
IV,I,ROSALIND,"pathetical break-promise and the most hollow lover"
IV,I,ROSALIND,"and the most unworthy of her you call Rosalind that"
IV,I,ROSALIND,"may be chosen out of the gross band of the"
IV,I,ROSALIND,"unfaithful: therefore beware my censure and keep"
IV,I,ROSALIND,"your promise."
IV,I,ORLANDO,"With no less religion than if thou wert indeed my"
IV,I,ORLANDO,"Rosalind: so adieu."
IV,I,ROSALIND,"Well, Time is the old justice that examines all such"
IV,I,ROSALIND,"offenders, and let Time try: adieu."
IV,I,CELIA,"You have simply misused our sex in your love-prate:"
IV,I,CELIA,"we must have your doublet and hose plucked over your"
IV,I,CELIA,"head, and show the world what the bird hath done to"
IV,I,CELIA,"her own nest."
IV,I,ROSALIND,"O coz, coz, coz, my pretty little coz, that thou"
IV,I,ROSALIND,"didst know how many fathom deep I am in love! But"
IV,I,ROSALIND,"it cannot be sounded: my affection hath an unknown"
IV,I,ROSALIND,"bottom, like the bay of Portugal."
IV,I,CELIA,"Or rather, bottomless, that as fast as you pour"
IV,I,CELIA,"affection in, it runs out."
IV,I,ROSALIND,"No, that same wicked bastard of Venus that was begot"
IV,I,ROSALIND,"of thought, conceived of spleen and born of madness,"
IV,I,ROSALIND,"that blind rascally boy that abuses every one's eyes"
IV,I,ROSALIND,"because his own are out, let him be judge how deep I"
IV,I,ROSALIND,"am in love. I'll tell thee, Aliena, I cannot be out"
IV,I,ROSALIND,"of the sight of Orlando: I'll go find a shadow and"
IV,I,ROSALIND,"sigh till he come."
IV,I,CELIA,"And I'll sleep."
IV,II,JAQUES,"Which is he that killed the deer?"
IV,II,A Lord,"Sir, it was I."
IV,II,JAQUES,"Let's present him to the duke, like a Roman"
IV,II,JAQUES,"conqueror; and it would do well to set the deer's"
IV,II,JAQUES,"horns upon his head, for a branch of victory. Have"
IV,II,JAQUES,"you no song, forester, for this purpose?"
IV,II,Forester,"Yes, sir."
IV,II,JAQUES,"Sing it: 'tis no matter how it be in tune, so it"
IV,II,JAQUES,"make noise enough."
IV,II,Forester,"What shall he have that kill'd the deer?"
IV,II,Forester,"His leather skin and horns to wear."
IV,II,Forester,"Then sing him home;"
IV,II,Forester,"Take thou no scorn to wear the horn;"
IV,II,Forester,"It was a crest ere thou wast born:"
IV,II,Forester,"Thy father's father wore it,"
IV,II,Forester,"And thy father bore it:"
IV,II,Forester,"The horn, the horn, the lusty horn"
IV,II,Forester,"Is not a thing to laugh to scorn."
IV,III,ROSALIND,"How say you now? Is it not past two o'clock? and"
IV,III,ROSALIND,"here much Orlando!"
IV,III,CELIA,"I warrant you, with pure love and troubled brain, he"
IV,III,CELIA,"hath ta'en his bow and arrows and is gone forth to"
IV,III,CELIA,"sleep. Look, who comes here."
IV,III,SILVIUS,"My errand is to you, fair youth;"
IV,III,SILVIUS,"My gentle Phebe bid me give you this:"
IV,III,SILVIUS,"I know not the contents; but, as I guess"
IV,III,SILVIUS,"By the stern brow and waspish action"
IV,III,SILVIUS,"Which she did use as she was writing of it,"
IV,III,SILVIUS,"It bears an angry tenor: pardon me:"
IV,III,SILVIUS,"I am but as a guiltless messenger."
IV,III,ROSALIND,"Patience herself would startle at this letter"
IV,III,ROSALIND,"And play the swaggerer; bear this, bear all:"
IV,III,ROSALIND,"She says I am not fair, that I lack manners;"
IV,III,ROSALIND,"She calls me proud, and that she could not love me,"
IV,III,ROSALIND,"Were man as rare as phoenix. 'Od's my will!"
IV,III,ROSALIND,"Her love is not the hare that I do hunt:"
IV,III,ROSALIND,"Why writes she so to me? Well, shepherd, well,"
IV,III,ROSALIND,"This is a letter of your own device."
IV,III,SILVIUS,"No, I protest, I know not the contents:"
IV,III,SILVIUS,"Phebe did write it."
IV,III,ROSALIND,"Come, come, you are a fool"
IV,III,ROSALIND,"And turn'd into the extremity of love."
IV,III,ROSALIND,"I saw her hand: she has a leathern hand."
IV,III,ROSALIND,"A freestone-colour'd hand; I verily did think"
IV,III,ROSALIND,"That her old gloves were on, but 'twas her hands:"
IV,III,ROSALIND,"She has a huswife's hand; but that's no matter:"
IV,III,ROSALIND,"I say she never did invent this letter;"
IV,III,ROSALIND,"This is a man's invention and his hand."
IV,III,SILVIUS,"Sure, it is hers."
IV,III,ROSALIND,"Why, 'tis a boisterous and a cruel style."
IV,III,ROSALIND,"A style for-challengers; why, she defies me,"
IV,III,ROSALIND,"Like Turk to Christian: women's gentle brain"
IV,III,ROSALIND,"Could not drop forth such giant-rude invention"
IV,III,ROSALIND,"Such Ethiope words, blacker in their effect"
IV,III,ROSALIND,"Than in their countenance. Will you hear the letter?"
IV,III,SILVIUS,"So please you, for I never heard it yet;"
IV,III,SILVIUS,"Yet heard too much of Phebe's cruelty."
IV,III,ROSALIND,"She Phebes me: mark how the tyrant writes."
IV,III,ROSALIND,"Art thou god to shepherd turn'd,"
IV,III,ROSALIND,"That a maiden's heart hath burn'd?"
IV,III,ROSALIND,"Can a woman rail thus?"
IV,III,SILVIUS,"Call you this railing?"
IV,III,ROSALIND,"Why, thy godhead laid apart,"
IV,III,ROSALIND,"Warr'st thou with a woman's heart?"
IV,III,ROSALIND,"Did you ever hear such railing?"
IV,III,ROSALIND,"Whiles the eye of man did woo me,"
IV,III,ROSALIND,"That could do no vengeance to me."
IV,III,ROSALIND,"Meaning me a beast."
IV,III,ROSALIND,"If the scorn of your bright eyne"
IV,III,ROSALIND,"Have power to raise such love in mine,"
IV,III,ROSALIND,"Alack, in me what strange effect"
IV,III,ROSALIND,"Would they work in mild aspect!"
IV,III,ROSALIND,"Whiles you chid me, I did love;"
IV,III,ROSALIND,"How then might your prayers move!"
IV,III,ROSALIND,"He that brings this love to thee"
IV,III,ROSALIND,"Little knows this love in me:"
IV,III,ROSALIND,"And by him seal up thy mind;"
IV,III,ROSALIND,"Whether that thy youth and kind"
IV,III,ROSALIND,"Will the faithful offer take"
IV,III,ROSALIND,"Of me and all that I can make;"
IV,III,ROSALIND,"Or else by him my love deny,"
IV,III,ROSALIND,"And then I'll study how to die."
IV,III,SILVIUS,"Call you this chiding?"
IV,III,CELIA,"Alas, poor shepherd!"
IV,III,ROSALIND,"Do you pity him? no, he deserves no pity. Wilt"
IV,III,ROSALIND,"thou love such a woman? What, to make thee an"
IV,III,ROSALIND,"instrument and play false strains upon thee! not to"
IV,III,ROSALIND,"be endured! Well, go your way to her, for I see"
IV,III,ROSALIND,"love hath made thee a tame snake, and say this to"
IV,III,ROSALIND,"her: that if she love me, I charge her to love"
IV,III,ROSALIND,"thee; if she will not, I will never have her unless"
IV,III,ROSALIND,"thou entreat for her. If you be a true lover,"
IV,III,ROSALIND,"hence, and not a word; for here comes more company."
IV,III,OLIVER,"Good morrow, fair ones: pray you, if you know,"
IV,III,OLIVER,"Where in the purlieus of this forest stands"
IV,III,OLIVER,"A sheep-cote fenced about with olive trees?"
IV,III,CELIA,"West of this place, down in the neighbour bottom:"
IV,III,CELIA,"The rank of osiers by the murmuring stream"
IV,III,CELIA,"Left on your right hand brings you to the place."
IV,III,CELIA,"But at this hour the house doth keep itself;"
IV,III,CELIA,"There's none within."
IV,III,OLIVER,"If that an eye may profit by a tongue,"
IV,III,OLIVER,"Then should I know you by description;"
IV,III,OLIVER,"Such garments and such years: 'The boy is fair,"
IV,III,OLIVER,"Of female favour, and bestows himself"
IV,III,OLIVER,"Like a ripe sister: the woman low"
IV,III,OLIVER,"And browner than her brother.' Are not you"
IV,III,OLIVER,"The owner of the house I did inquire for?"
IV,III,CELIA,"It is no boast, being ask'd, to say we are."
IV,III,OLIVER,"Orlando doth commend him to you both,"
IV,III,OLIVER,"And to that youth he calls his Rosalind"
IV,III,OLIVER,"He sends this bloody napkin. Are you he?"
IV,III,ROSALIND,"I am: what must we understand by this?"
IV,III,OLIVER,"Some of my shame; if you will know of me"
IV,III,OLIVER,"What man I am, and how, and why, and where"
IV,III,OLIVER,"This handkercher was stain'd."
IV,III,CELIA,"I pray you, tell it."
IV,III,OLIVER,"When last the young Orlando parted from you"
IV,III,OLIVER,"He left a promise to return again"
IV,III,OLIVER,"Within an hour, and pacing through the forest,"
IV,III,OLIVER,"Chewing the food of sweet and bitter fancy,"
IV,III,OLIVER,"Lo, what befell! he threw his eye aside,"
IV,III,OLIVER,"And mark what object did present itself:"
IV,III,OLIVER,"Under an oak, whose boughs were moss'd with age"
IV,III,OLIVER,"And high top bald with dry antiquity,"
IV,III,OLIVER,"A wretched ragged man, o'ergrown with hair,"
IV,III,OLIVER,"Lay sleeping on his back: about his neck"
IV,III,OLIVER,"A green and gilded snake had wreathed itself,"
IV,III,OLIVER,"Who with her head nimble in threats approach'd"
IV,III,OLIVER,"The opening of his mouth; but suddenly,"
IV,III,OLIVER,"Seeing Orlando, it unlink'd itself,"
IV,III,OLIVER,"And with indented glides did slip away"
IV,III,OLIVER,"Into a bush: under which bush's shade"
IV,III,OLIVER,"A lioness, with udders all drawn dry,"
IV,III,OLIVER,"Lay couching, head on ground, with catlike watch,"
IV,III,OLIVER,"When that the sleeping man should stir; for 'tis"
IV,III,OLIVER,"The royal disposition of that beast"
IV,III,OLIVER,"To prey on nothing that doth seem as dead:"
IV,III,OLIVER,"This seen, Orlando did approach the man"
IV,III,OLIVER,"And found it was his brother, his elder brother."
IV,III,CELIA,"O, I have heard him speak of that same brother;"
IV,III,CELIA,"And he did render him the most unnatural"
IV,III,CELIA,"That lived amongst men."
IV,III,OLIVER,"And well he might so do,"
IV,III,OLIVER,"For well I know he was unnatural."
IV,III,ROSALIND,"But, to Orlando: did he leave him there,"
IV,III,ROSALIND,"Food to the suck'd and hungry lioness?"
IV,III,OLIVER,"Twice did he turn his back and purposed so;"
IV,III,OLIVER,"But kindness, nobler ever than revenge,"
IV,III,OLIVER,"And nature, stronger than his just occasion,"
IV,III,OLIVER,"Made him give battle to the lioness,"
IV,III,OLIVER,"Who quickly fell before him: in which hurtling"
IV,III,OLIVER,"From miserable slumber I awaked."
IV,III,CELIA,"Are you his brother?"
IV,III,ROSALIND,"Wast you he rescued?"
IV,III,CELIA,"Was't you that did so oft contrive to kill him?"
IV,III,OLIVER,"'Twas I; but 'tis not I I do not shame"
IV,III,OLIVER,"To tell you what I was, since my conversion"
IV,III,OLIVER,"So sweetly tastes, being the thing I am."
IV,III,ROSALIND,"But, for the bloody napkin?"
IV,III,OLIVER,"By and by."
IV,III,OLIVER,"When from the first to last betwixt us two"
IV,III,OLIVER,"Tears our recountments had most kindly bathed,"
IV,III,OLIVER,"As how I came into that desert place:--"
IV,III,OLIVER,"In brief, he led me to the gentle duke,"
IV,III,OLIVER,"Who gave me fresh array and entertainment,"
IV,III,OLIVER,"Committing me unto my brother's love;"
IV,III,OLIVER,"Who led me instantly unto his cave,"
IV,III,OLIVER,"There stripp'd himself, and here upon his arm"
IV,III,OLIVER,"The lioness had torn some flesh away,"
IV,III,OLIVER,"Which all this while had bled; and now he fainted"
IV,III,OLIVER,"And cried, in fainting, upon Rosalind."
IV,III,OLIVER,"Brief, I recover'd him, bound up his wound;"
IV,III,OLIVER,"And, after some small space, being strong at heart,"
IV,III,OLIVER,"He sent me hither, stranger as I am,"
IV,III,OLIVER,"To tell this story, that you might excuse"
IV,III,OLIVER,"His broken promise, and to give this napkin"
IV,III,OLIVER,"Dyed in his blood unto the shepherd youth"
IV,III,OLIVER,"That he in sport doth call his Rosalind."
IV,III,CELIA,"Why, how now, Ganymede! sweet Ganymede!"
IV,III,OLIVER,"Many will swoon when they do look on blood."
IV,III,CELIA,"There is more in it. Cousin Ganymede!"
IV,III,OLIVER,"Look, he recovers."
IV,III,ROSALIND,"I would I were at home."
IV,III,CELIA,"We'll lead you thither."
IV,III,CELIA,"I pray you, will you take him by the arm?"
IV,III,OLIVER,"Be of good cheer, youth: you a man! you lack a"
IV,III,OLIVER,"man's heart."
IV,III,ROSALIND,"I do so, I confess it. Ah, sirrah, a body would"
IV,III,ROSALIND,"think this was well counterfeited! I pray you, tell"
IV,III,ROSALIND,"your brother how well I counterfeited. Heigh-ho!"
IV,III,OLIVER,"This was not counterfeit: there is too great"
IV,III,OLIVER,"testimony in your complexion that it was a passion"
IV,III,OLIVER,"of earnest."
IV,III,ROSALIND,"Counterfeit, I assure you."
IV,III,OLIVER,"Well then, take a good heart and counterfeit to be a man."
IV,III,ROSALIND,"So I do: but, i' faith, I should have been a woman by right."
IV,III,CELIA,"Come, you look paler and paler: pray you, draw"
IV,III,CELIA,"homewards. Good sir, go with us."
IV,III,OLIVER,"That will I, for I must bear answer back"
IV,III,OLIVER,"How you excuse my brother, Rosalind."
IV,III,ROSALIND,"I shall devise something: but, I pray you, commend"
IV,III,ROSALIND,"my counterfeiting to him. Will you go?"
V,I,TOUCHSTONE,"We shall find a time, Audrey; patience, gentle Audrey."
V,I,AUDREY,"Faith, the priest was good enough, for all the old"
V,I,AUDREY,"gentleman's saying."
V,I,TOUCHSTONE,"A most wicked Sir Oliver, Audrey, a most vile"
V,I,TOUCHSTONE,"Martext. But, Audrey, there is a youth here in the"
V,I,TOUCHSTONE,"forest lays claim to you."
V,I,AUDREY,"Ay, I know who 'tis; he hath no interest in me in"
V,I,AUDREY,"the world: here comes the man you mean."
V,I,TOUCHSTONE,"It is meat and drink to me to see a clown: by my"
V,I,TOUCHSTONE,"troth, we that have good wits have much to answer"
V,I,TOUCHSTONE,"for; we shall be flouting; we cannot hold."
V,I,WILLIAM,"Good even, Audrey."
V,I,AUDREY,"God ye good even, William."
V,I,WILLIAM,"And good even to you, sir."
V,I,TOUCHSTONE,"Good even, gentle friend. Cover thy head, cover thy"
V,I,TOUCHSTONE,"head; nay, prithee, be covered. How old are you, friend?"
V,I,WILLIAM,"Five and twenty, sir."
V,I,TOUCHSTONE,"A ripe age. Is thy name William?"
V,I,WILLIAM,"William, sir."
V,I,TOUCHSTONE,"A fair name. Wast born i' the forest here?"
