IV,II,CAIUS LUCIUS,"My friends,"
IV,II,CAIUS LUCIUS,"The boy hath taught us manly duties: let us"
IV,II,CAIUS LUCIUS,"Find out the prettiest daisied plot we can,"
IV,II,CAIUS LUCIUS,"And make him with our pikes and partisans"
IV,II,CAIUS LUCIUS,"A grave: come, arm him. Boy, he is preferr'd"
IV,II,CAIUS LUCIUS,"By thee to us, and he shall be interr'd"
IV,II,CAIUS LUCIUS,"As soldiers can. Be cheerful; wipe thine eyes"
IV,II,CAIUS LUCIUS,"Some falls are means the happier to arise."
IV,III,CYMBELINE,"Again; and bring me word how 'tis with her."
IV,III,CYMBELINE,"A fever with the absence of her son,"
IV,III,CYMBELINE,"A madness, of which her life's in danger. Heavens,"
IV,III,CYMBELINE,"How deeply you at once do touch me! Imogen,"
IV,III,CYMBELINE,"The great part of my comfort, gone; my queen"
IV,III,CYMBELINE,"Upon a desperate bed, and in a time"
IV,III,CYMBELINE,"When fearful wars point at me; her son gone,"
IV,III,CYMBELINE,"So needful for this present: it strikes me, past"
IV,III,CYMBELINE,"The hope of comfort. But for thee, fellow,"
IV,III,CYMBELINE,"Who needs must know of her departure and"
IV,III,CYMBELINE,"Dost seem so ignorant, we'll enforce it from thee"
IV,III,CYMBELINE,"By a sharp torture."
IV,III,PISANIO,"Sir, my life is yours;"
IV,III,PISANIO,"I humbly set it at your will; but, for my mistress,"
IV,III,PISANIO,"I nothing know where she remains, why gone,"
IV,III,PISANIO,"Nor when she purposes return. Beseech your highness,"
IV,III,PISANIO,"Hold me your loyal servant."
IV,III,First Lord,"Good my liege,"
IV,III,First Lord,"The day that she was missing he was here:"
IV,III,First Lord,"I dare be bound he's true and shall perform"
IV,III,First Lord,"All parts of his subjection loyally. For Cloten,"
IV,III,First Lord,"There wants no diligence in seeking him,"
IV,III,First Lord,"And will, no doubt, be found."
IV,III,CYMBELINE,"The time is troublesome."
IV,III,CYMBELINE,"We'll slip you for a season; but our jealousy"
IV,III,CYMBELINE,"Does yet depend."
IV,III,First Lord,"So please your majesty,"
IV,III,First Lord,"The Roman legions, all from Gallia drawn,"
IV,III,First Lord,"Are landed on your coast, with a supply"
IV,III,First Lord,"Of Roman gentlemen, by the senate sent."
IV,III,CYMBELINE,"Now for the counsel of my son and queen!"
IV,III,CYMBELINE,"I am amazed with matter."
IV,III,First Lord,"Good my liege,"
IV,III,First Lord,"Your preparation can affront no less"
IV,III,First Lord,"Than what you hear of: come more, for more"
IV,III,First Lord,"you're ready:"
IV,III,First Lord,"The want is but to put those powers in motion"
IV,III,First Lord,"That long to move."
IV,III,CYMBELINE,"I thank you. Let's withdraw;"
IV,III,CYMBELINE,"And meet the time as it seeks us. We fear not"
IV,III,CYMBELINE,"What can from Italy annoy us; but"
IV,III,CYMBELINE,"We grieve at chances here. Away!"
IV,III,PISANIO,"I heard no letter from my master since"
IV,III,PISANIO,"I wrote him Imogen was slain: 'tis strange:"
IV,III,PISANIO,"Nor hear I from my mistress who did promise"
IV,III,PISANIO,"To yield me often tidings: neither know I"
IV,III,PISANIO,"What is betid to Cloten; but remain"
IV,III,PISANIO,"Perplex'd in all. The heavens still must work."
IV,III,PISANIO,"Wherein I am false I am honest; not true, to be true."
IV,III,PISANIO,"These present wars shall find I love my country,"
IV,III,PISANIO,"Even to the note o' the king, or I'll fall in them."
IV,III,PISANIO,"All other doubts, by time let them be clear'd:"
IV,III,PISANIO,"Fortune brings in some boats that are not steer'd."
IV,IV,GUIDERIUS,"The noise is round about us."
IV,IV,BELARIUS,"Let us from it."
IV,IV,ARVIRAGUS,"What pleasure, sir, find we in life, to lock it"
IV,IV,ARVIRAGUS,"From action and adventure?"
IV,IV,GUIDERIUS,"Nay, what hope"
IV,IV,GUIDERIUS,"Have we in hiding us? This way, the Romans"
IV,IV,GUIDERIUS,"Must or for Britons slay us, or receive us"
IV,IV,GUIDERIUS,"For barbarous and unnatural revolts"
IV,IV,GUIDERIUS,"During their use, and slay us after."
IV,IV,BELARIUS,"Sons,"
IV,IV,BELARIUS,"We'll higher to the mountains; there secure us."
IV,IV,BELARIUS,"To the king's party there's no going: newness"
IV,IV,BELARIUS,"Of Cloten's death--we being not known, not muster'd"
IV,IV,BELARIUS,"Among the bands--may drive us to a render"
IV,IV,BELARIUS,"Where we have lived, and so extort from's that"
IV,IV,BELARIUS,"Which we have done, whose answer would be death"
IV,IV,BELARIUS,"Drawn on with torture."
IV,IV,GUIDERIUS,"This is, sir, a doubt"
IV,IV,GUIDERIUS,"In such a time nothing becoming you,"
IV,IV,GUIDERIUS,"Nor satisfying us."
IV,IV,ARVIRAGUS,"It is not likely"
IV,IV,ARVIRAGUS,"That when they hear the Roman horses neigh,"
IV,IV,ARVIRAGUS,"Behold their quarter'd fires, have both their eyes"
IV,IV,ARVIRAGUS,"And ears so cloy'd importantly as now,"
IV,IV,ARVIRAGUS,"That they will waste their time upon our note,"
IV,IV,ARVIRAGUS,"To know from whence we are."
IV,IV,BELARIUS,"O, I am known"
IV,IV,BELARIUS,"Of many in the army: many years,"
IV,IV,BELARIUS,"Though Cloten then but young, you see, not wore him"
IV,IV,BELARIUS,"From my remembrance. And, besides, the king"
IV,IV,BELARIUS,"Hath not deserved my service nor your loves;"
IV,IV,BELARIUS,"Who find in my exile the want of breeding,"
IV,IV,BELARIUS,"The certainty of this hard life; aye hopeless"
IV,IV,BELARIUS,"To have the courtesy your cradle promised,"
IV,IV,BELARIUS,"But to be still hot summer's tamings and"
IV,IV,BELARIUS,"The shrinking slaves of winter."
IV,IV,GUIDERIUS,"Than be so"
IV,IV,GUIDERIUS,"Better to cease to be. Pray, sir, to the army:"
IV,IV,GUIDERIUS,"I and my brother are not known; yourself"
IV,IV,GUIDERIUS,"So out of thought, and thereto so o'ergrown,"
IV,IV,GUIDERIUS,"Cannot be question'd."
IV,IV,ARVIRAGUS,"By this sun that shines,"
IV,IV,ARVIRAGUS,"I'll thither: what thing is it that I never"
IV,IV,ARVIRAGUS,"Did see man die! scarce ever look'd on blood,"
IV,IV,ARVIRAGUS,"But that of coward hares, hot goats, and venison!"
IV,IV,ARVIRAGUS,"Never bestrid a horse, save one that had"
IV,IV,ARVIRAGUS,"A rider like myself, who ne'er wore rowel"
IV,IV,ARVIRAGUS,"Nor iron on his heel! I am ashamed"
IV,IV,ARVIRAGUS,"To look upon the holy sun, to have"
IV,IV,ARVIRAGUS,"The benefit of his blest beams, remaining"
IV,IV,ARVIRAGUS,"So long a poor unknown."
IV,IV,GUIDERIUS,"By heavens, I'll go:"
IV,IV,GUIDERIUS,"If you will bless me, sir, and give me leave,"
IV,IV,GUIDERIUS,"I'll take the better care, but if you will not,"
IV,IV,GUIDERIUS,"The hazard therefore due fall on me by"
IV,IV,GUIDERIUS,"The hands of Romans!"
IV,IV,ARVIRAGUS,"So say I amen."
IV,IV,BELARIUS,"No reason I, since of your lives you set"
IV,IV,BELARIUS,"So slight a valuation, should reserve"
IV,IV,BELARIUS,"My crack'd one to more care. Have with you, boys!"
IV,IV,BELARIUS,"If in your country wars you chance to die,"
IV,IV,BELARIUS,"That is my bed too, lads, an there I'll lie:"
IV,IV,BELARIUS,"Lead, lead."
IV,IV,BELARIUS,"The time seems long; their blood"
IV,IV,BELARIUS,"thinks scorn,"
IV,IV,BELARIUS,"Till it fly out and show them princes born."
V,I,POSTHUMUS LEONATUS,"Yea, bloody cloth, I'll keep thee, for I wish'd"
V,I,POSTHUMUS LEONATUS,"Thou shouldst be colour'd thus. You married ones,"
V,I,POSTHUMUS LEONATUS,"If each of you should take this course, how many"
V,I,POSTHUMUS LEONATUS,"Must murder wives much better than themselves"
V,I,POSTHUMUS LEONATUS,"For wrying but a little! O Pisanio!"
V,I,POSTHUMUS LEONATUS,"Every good servant does not all commands:"
V,I,POSTHUMUS LEONATUS,"No bond but to do just ones. Gods! if you"
V,I,POSTHUMUS LEONATUS,"Should have ta'en vengeance on my faults, I never"
V,I,POSTHUMUS LEONATUS,"Had lived to put on this: so had you saved"
V,I,POSTHUMUS LEONATUS,"The noble Imogen to repent, and struck"
V,I,POSTHUMUS LEONATUS,"Me, wretch more worth your vengeance. But, alack,"
V,I,POSTHUMUS LEONATUS,"You snatch some hence for little faults; that's love,"
V,I,POSTHUMUS LEONATUS,"To have them fall no more: you some permit"
V,I,POSTHUMUS LEONATUS,"To second ills with ills, each elder worse,"
V,I,POSTHUMUS LEONATUS,"And make them dread it, to the doers' thrift."
V,I,POSTHUMUS LEONATUS,"But Imogen is your own: do your best wills,"
V,I,POSTHUMUS LEONATUS,"And make me blest to obey! I am brought hither"
V,I,POSTHUMUS LEONATUS,"Among the Italian gentry, and to fight"
V,I,POSTHUMUS LEONATUS,"Against my lady's kingdom: 'tis enough"
V,I,POSTHUMUS LEONATUS,"That, Britain, I have kill'd thy mistress; peace!"
V,I,POSTHUMUS LEONATUS,"I'll give no wound to thee. Therefore, good heavens,"
V,I,POSTHUMUS LEONATUS,"Hear patiently my purpose: I'll disrobe me"
V,I,POSTHUMUS LEONATUS,"Of these Italian weeds and suit myself"
V,I,POSTHUMUS LEONATUS,"As does a Briton peasant: so I'll fight"
V,I,POSTHUMUS LEONATUS,"Against the part I come with; so I'll die"
V,I,POSTHUMUS LEONATUS,"For thee, O Imogen, even for whom my life"
V,I,POSTHUMUS LEONATUS,"Is every breath a death; and thus, unknown,"
V,I,POSTHUMUS LEONATUS,"Pitied nor hated, to the face of peril"
V,I,POSTHUMUS LEONATUS,"Myself I'll dedicate. Let me make men know"
V,I,POSTHUMUS LEONATUS,"More valour in me than my habits show."
V,I,POSTHUMUS LEONATUS,"Gods, put the strength o' the Leonati in me!"
V,I,POSTHUMUS LEONATUS,"To shame the guise o' the world, I will begin"
V,I,POSTHUMUS LEONATUS,"The fashion, less without and more within."
V,II,IACHIMO,"The heaviness and guilt within my bosom"
V,II,IACHIMO,"Takes off my manhood: I have belied a lady,"
V,II,IACHIMO,"The princess of this country, and the air on't"
V,II,IACHIMO,"Revengingly enfeebles me; or could this carl,"
V,II,IACHIMO,"A very drudge of nature's, have subdued me"
V,II,IACHIMO,"In my profession? Knighthoods and honours, borne"
V,II,IACHIMO,"As I wear mine, are titles but of scorn."
V,II,IACHIMO,"If that thy gentry, Britain, go before"
V,II,IACHIMO,"This lout as he exceeds our lords, the odds"
V,II,IACHIMO,"Is that we scarce are men and you are gods."
V,II,BELARIUS,"Stand, stand! We have the advantage of the ground;"
V,II,BELARIUS,"The lane is guarded: nothing routs us but"
V,II,BELARIUS,"The villany of our fears."
V,II,GUIDERIUS,"Stand, stand, and fight!"
V,II,CAIUS LUCIUS,"Away, boy, from the troops, and save thyself;"
V,II,CAIUS LUCIUS,"For friends kill friends, and the disorder's such"
V,II,CAIUS LUCIUS,"As war were hoodwink'd."
V,II,IACHIMO,"'Tis their fresh supplies."
V,II,CAIUS LUCIUS,"It is a day turn'd strangely: or betimes"
V,II,CAIUS LUCIUS,"Let's reinforce, or fly."
V,III,Lord,"Camest thou from where they made the stand?"
V,III,POSTHUMUS LEONATUS,"I did."
V,III,POSTHUMUS LEONATUS,"Though you, it seems, come from the fliers."
V,III,Lord,"I did."
V,III,POSTHUMUS LEONATUS,"No blame be to you, sir; for all was lost,"
V,III,POSTHUMUS LEONATUS,"But that the heavens fought: the king himself"
V,III,POSTHUMUS LEONATUS,"Of his wings destitute, the army broken,"
V,III,POSTHUMUS LEONATUS,"And but the backs of Britons seen, all flying"
V,III,POSTHUMUS LEONATUS,"Through a straight lane; the enemy full-hearted,"
V,III,POSTHUMUS LEONATUS,"Lolling the tongue with slaughtering, having work"
V,III,POSTHUMUS LEONATUS,"More plentiful than tools to do't, struck down"
V,III,POSTHUMUS LEONATUS,"Some mortally, some slightly touch'd, some falling"
V,III,POSTHUMUS LEONATUS,"Merely through fear; that the straight pass was damm'd"
V,III,POSTHUMUS LEONATUS,"With dead men hurt behind, and cowards living"
V,III,POSTHUMUS LEONATUS,"To die with lengthen'd shame."
V,III,Lord,"Where was this lane?"
V,III,POSTHUMUS LEONATUS,"Close by the battle, ditch'd, and wall'd with turf;"
V,III,POSTHUMUS LEONATUS,"Which gave advantage to an ancient soldier,"
V,III,POSTHUMUS LEONATUS,"An honest one, I warrant; who deserved"
V,III,POSTHUMUS LEONATUS,"So long a breeding as his white beard came to,"
V,III,POSTHUMUS LEONATUS,"In doing this for's country: athwart the lane,"
V,III,POSTHUMUS LEONATUS,"He, with two striplings-lads more like to run"
V,III,POSTHUMUS LEONATUS,"The country base than to commit such slaughter"
V,III,POSTHUMUS LEONATUS,"With faces fit for masks, or rather fairer"
V,III,POSTHUMUS LEONATUS,"Than those for preservation cased, or shame--"
V,III,POSTHUMUS LEONATUS,"Made good the passage; cried to those that fled,"
V,III,POSTHUMUS LEONATUS,"'Our Britain s harts die flying, not our men:"
V,III,POSTHUMUS LEONATUS,"To darkness fleet souls that fly backwards. Stand;"
V,III,POSTHUMUS LEONATUS,"Or we are Romans and will give you that"
V,III,POSTHUMUS LEONATUS,"Like beasts which you shun beastly, and may save,"
V,III,POSTHUMUS LEONATUS,"But to look back in frown: stand, stand.'"
V,III,POSTHUMUS LEONATUS,"These three,"
V,III,POSTHUMUS LEONATUS,"Three thousand confident, in act as many--"
V,III,POSTHUMUS LEONATUS,"For three performers are the file when all"
V,III,POSTHUMUS LEONATUS,"The rest do nothing--with this word 'Stand, stand,'"
V,III,POSTHUMUS LEONATUS,"Accommodated by the place, more charming"
V,III,POSTHUMUS LEONATUS,"With their own nobleness, which could have turn'd"
V,III,POSTHUMUS LEONATUS,"A distaff to a lance, gilded pale looks,"
V,III,POSTHUMUS LEONATUS,"Part shame, part spirit renew'd; that some,"
V,III,POSTHUMUS LEONATUS,"turn'd coward"
V,III,POSTHUMUS LEONATUS,"But by example--O, a sin in war,"
V,III,POSTHUMUS LEONATUS,"Damn'd in the first beginners!--gan to look"
V,III,POSTHUMUS LEONATUS,"The way that they did, and to grin like lions"
V,III,POSTHUMUS LEONATUS,"Upon the pikes o' the hunters. Then began"
V,III,POSTHUMUS LEONATUS,"A stop i' the chaser, a retire, anon"
V,III,POSTHUMUS LEONATUS,"A rout, confusion thick; forthwith they fly"
V,III,POSTHUMUS LEONATUS,"Chickens, the way which they stoop'd eagles; slaves,"
V,III,POSTHUMUS LEONATUS,"The strides they victors made: and now our cowards,"
V,III,POSTHUMUS LEONATUS,"Like fragments in hard voyages, became"
V,III,POSTHUMUS LEONATUS,"The life o' the need: having found the backdoor open"
V,III,POSTHUMUS LEONATUS,"Of the unguarded hearts, heavens, how they wound!"
V,III,POSTHUMUS LEONATUS,"Some slain before; some dying; some their friends"
V,III,POSTHUMUS LEONATUS,"O'er borne i' the former wave: ten, chased by one,"
V,III,POSTHUMUS LEONATUS,"Are now each one the slaughter-man of twenty:"
V,III,POSTHUMUS LEONATUS,"Those that would die or ere resist are grown"
V,III,POSTHUMUS LEONATUS,"The mortal bugs o' the field."
V,III,Lord,"This was strange chance"
V,III,Lord,"A narrow lane, an old man, and two boys."
V,III,POSTHUMUS LEONATUS,"Nay, do not wonder at it: you are made"
V,III,POSTHUMUS LEONATUS,"Rather to wonder at the things you hear"
V,III,POSTHUMUS LEONATUS,"Than to work any. Will you rhyme upon't,"
V,III,POSTHUMUS LEONATUS,"And vent it for a mockery? Here is one:"
V,III,POSTHUMUS LEONATUS,"'Two boys, an old man twice a boy, a lane,"
V,III,POSTHUMUS LEONATUS,"Preserved the Britons, was the Romans' bane.'"
V,III,Lord,"Nay, be not angry, sir."
V,III,POSTHUMUS LEONATUS,"'Lack, to what end?"
V,III,POSTHUMUS LEONATUS,"Who dares not stand his foe, I'll be his friend;"
V,III,POSTHUMUS LEONATUS,"For if he'll do as he is made to do,"
V,III,POSTHUMUS LEONATUS,"I know he'll quickly fly my friendship too."
V,III,POSTHUMUS LEONATUS,"You have put me into rhyme."
V,III,Lord,"Farewell; you're angry."
V,III,POSTHUMUS LEONATUS,"Still going?"
V,III,POSTHUMUS LEONATUS,"This is a lord! O noble misery,"
V,III,POSTHUMUS LEONATUS,"To be i' the field, and ask 'what news?' of me!"
V,III,POSTHUMUS LEONATUS,"To-day how many would have given their honours"
V,III,POSTHUMUS LEONATUS,"To have saved their carcasses! took heel to do't,"
V,III,POSTHUMUS LEONATUS,"And yet died too! I, in mine own woe charm'd,"
V,III,POSTHUMUS LEONATUS,"Could not find death where I did hear him groan,"
V,III,POSTHUMUS LEONATUS,"Nor feel him where he struck: being an ugly monster,"
V,III,POSTHUMUS LEONATUS,"'Tis strange he hides him in fresh cups, soft beds,"
V,III,POSTHUMUS LEONATUS,"Sweet words; or hath more ministers than we"
V,III,POSTHUMUS LEONATUS,"That draw his knives i' the war. Well, I will find him"
V,III,POSTHUMUS LEONATUS,"For being now a favourer to the Briton,"
V,III,POSTHUMUS LEONATUS,"No more a Briton, I have resumed again"
V,III,POSTHUMUS LEONATUS,"The part I came in: fight I will no more,"
V,III,POSTHUMUS LEONATUS,"But yield me to the veriest hind that shall"
V,III,POSTHUMUS LEONATUS,"Once touch my shoulder. Great the slaughter is"
V,III,POSTHUMUS LEONATUS,"Here made by the Roman; great the answer be"
V,III,POSTHUMUS LEONATUS,"Britons must take. For me, my ransom's death;"
V,III,POSTHUMUS LEONATUS,"On either side I come to spend my breath;"
V,III,POSTHUMUS LEONATUS,"Which neither here I'll keep nor bear again,"
V,III,POSTHUMUS LEONATUS,"But end it by some means for Imogen."
V,III,First Captain,"Great Jupiter be praised! Lucius is taken."
V,III,First Captain,"'Tis thought the old man and his sons were angels."
V,III,Second Captain,"There was a fourth man, in a silly habit,"
V,III,Second Captain,"That gave the affront with them."
V,III,First Captain,"So 'tis reported:"
V,III,First Captain,"But none of 'em can be found. Stand! who's there?"
V,III,POSTHUMUS LEONATUS,"A Roman,"
V,III,POSTHUMUS LEONATUS,"Who had not now been drooping here, if seconds"
V,III,POSTHUMUS LEONATUS,"Had answer'd him."
V,III,Second Captain,"Lay hands on him; a dog!"
V,III,Second Captain,"A leg of Rome shall not return to tell"
V,III,Second Captain,"What crows have peck'd them here. He brags"
V,III,Second Captain,"his service"
V,III,Second Captain,"As if he were of note: bring him to the king."
V,IV,First Gaoler,"You shall not now be stol'n, you have locks upon you;"
V,IV,First Gaoler,"So graze as you find pasture."
V,IV,Second Gaoler,"Ay, or a stomach."
V,IV,POSTHUMUS LEONATUS,"Most welcome, bondage! for thou art away,"
V,IV,POSTHUMUS LEONATUS,"think, to liberty: yet am I better"
V,IV,POSTHUMUS LEONATUS,"Than one that's sick o' the gout; since he had rather"
V,IV,POSTHUMUS LEONATUS,"Groan so in perpetuity than be cured"
V,IV,POSTHUMUS LEONATUS,"By the sure physician, death, who is the key"
V,IV,POSTHUMUS LEONATUS,"To unbar these locks. My conscience, thou art fetter'd"
V,IV,POSTHUMUS LEONATUS,"More than my shanks and wrists: you good gods, give me"
V,IV,POSTHUMUS LEONATUS,"The penitent instrument to pick that bolt,"
V,IV,POSTHUMUS LEONATUS,"Then, free for ever! Is't enough I am sorry?"
V,IV,POSTHUMUS LEONATUS,"So children temporal fathers do appease;"
V,IV,POSTHUMUS LEONATUS,"Gods are more full of mercy. Must I repent?"
V,IV,POSTHUMUS LEONATUS,"I cannot do it better than in gyves,"
V,IV,POSTHUMUS LEONATUS,"Desired more than constrain'd: to satisfy,"
V,IV,POSTHUMUS LEONATUS,"If of my freedom 'tis the main part, take"
V,IV,POSTHUMUS LEONATUS,"No stricter render of me than my all."
V,IV,POSTHUMUS LEONATUS,"I know you are more clement than vile men,"
V,IV,POSTHUMUS LEONATUS,"Who of their broken debtors take a third,"
V,IV,POSTHUMUS LEONATUS,"A sixth, a tenth, letting them thrive again"
V,IV,POSTHUMUS LEONATUS,"On their abatement: that's not my desire:"
V,IV,POSTHUMUS LEONATUS,"For Imogen's dear life take mine; and though"
V,IV,POSTHUMUS LEONATUS,"'Tis not so dear, yet 'tis a life; you coin'd it:"
V,IV,POSTHUMUS LEONATUS,"'Tween man and man they weigh not every stamp;"
V,IV,POSTHUMUS LEONATUS,"Though light, take pieces for the figure's sake:"
V,IV,POSTHUMUS LEONATUS,"You rather mine, being yours: and so, great powers,"
V,IV,POSTHUMUS LEONATUS,"If you will take this audit, take this life,"
V,IV,POSTHUMUS LEONATUS,"And cancel these cold bonds. O Imogen!"
V,IV,POSTHUMUS LEONATUS,"I'll speak to thee in silence."
V,IV,Sicilius Leonatus,"No more, thou thunder-master, show"
V,IV,Sicilius Leonatus,"Thy spite on mortal flies:"
V,IV,Sicilius Leonatus,"With Mars fall out, with Juno chide,"
V,IV,Sicilius Leonatus,"That thy adulteries"
V,IV,Sicilius Leonatus,"Rates and revenges."
V,IV,Sicilius Leonatus,"Hath my poor boy done aught but well,"
V,IV,Sicilius Leonatus,"Whose face I never saw?"
V,IV,Sicilius Leonatus,"I died whilst in the womb he stay'd"
V,IV,Sicilius Leonatus,"Attending nature's law:"
V,IV,Sicilius Leonatus,"Whose father then, as men report"
V,IV,Sicilius Leonatus,"Thou orphans' father art,"
V,IV,Sicilius Leonatus,"Thou shouldst have been, and shielded him"
V,IV,Sicilius Leonatus,"From this earth-vexing smart."
V,IV,Mother,"Lucina lent not me her aid,"
V,IV,Mother,"But took me in my throes;"
V,IV,Mother,"That from me was Posthumus ript,"
V,IV,Mother,"Came crying 'mongst his foes,"
V,IV,Mother,"A thing of pity!"
V,IV,Sicilius Leonatus,"Great nature, like his ancestry,"
V,IV,Sicilius Leonatus,"Moulded the stuff so fair,"
V,IV,Sicilius Leonatus,"That he deserved the praise o' the world,"
V,IV,Sicilius Leonatus,"As great Sicilius' heir."
V,IV,First Brother,"When once he was mature for man,"
V,IV,First Brother,"In Britain where was he"
V,IV,First Brother,"That could stand up his parallel;"
V,IV,First Brother,"Or fruitful object be"
V,IV,First Brother,"In eye of Imogen, that best"
V,IV,First Brother,"Could deem his dignity?"
V,IV,Mother,"With marriage wherefore was he mock'd,"
V,IV,Mother,"To be exiled, and thrown"
V,IV,Mother,"From Leonati seat, and cast"
V,IV,Mother,"From her his dearest one,"
V,IV,Mother,"Sweet Imogen?"
V,IV,Sicilius Leonatus,"Why did you suffer Iachimo,"
V,IV,Sicilius Leonatus,"Slight thing of Italy,"
V,IV,Sicilius Leonatus,"To taint his nobler heart and brain"
V,IV,Sicilius Leonatus,"With needless jealosy;"
V,IV,Sicilius Leonatus,"And to become the geck and scorn"
V,IV,Sicilius Leonatus,"O' th' other's villany?"
V,IV,Second Brother,"For this from stiller seats we came,"
V,IV,Second Brother,"Our parents and us twain,"
V,IV,Second Brother,"That striking in our country's cause"
V,IV,Second Brother,"Fell bravely and were slain,"
V,IV,Second Brother,"Our fealty and Tenantius' right"
V,IV,Second Brother,"With honour to maintain."
V,IV,First Brother,"Like hardiment Posthumus hath"
V,IV,First Brother,"To Cymbeline perform'd:"
V,IV,First Brother,"Then, Jupiter, thou king of gods,"
V,IV,First Brother,"Why hast thou thus adjourn'd"
V,IV,First Brother,"The graces for his merits due,"
V,IV,First Brother,"Being all to dolours turn'd?"
V,IV,Sicilius Leonatus,"Thy crystal window ope; look out;"
V,IV,Sicilius Leonatus,"No longer exercise"
V,IV,Sicilius Leonatus,"Upon a valiant race thy harsh"
V,IV,Sicilius Leonatus,"And potent injuries."
V,IV,Mother,"Since, Jupiter, our son is good,"
V,IV,Mother,"Take off his miseries."
V,IV,Sicilius Leonatus,"Peep through thy marble mansion; help;"
V,IV,Sicilius Leonatus,"Or we poor ghosts will cry"
V,IV,Sicilius Leonatus,"To the shining synod of the rest"
V,IV,Sicilius Leonatus,"Against thy deity."
V,IV,First Brother,"Help, Jupiter; or we appeal,"
V,IV,First Brother,"And from thy justice fly."
V,IV,Jupiter,"No more, you petty spirits of region low,"
V,IV,Jupiter,"Offend our hearing; hush! How dare you ghosts"
V,IV,Jupiter,"Accuse the thunderer, whose bolt, you know,"
V,IV,Jupiter,"Sky-planted batters all rebelling coasts?"
V,IV,Jupiter,"Poor shadows of Elysium, hence, and rest"
V,IV,Jupiter,"Upon your never-withering banks of flowers:"
V,IV,Jupiter,"Be not with mortal accidents opprest;"
V,IV,Jupiter,"No care of yours it is; you know 'tis ours."
V,IV,Jupiter,"Whom best I love I cross; to make my gift,"
V,IV,Jupiter,"The more delay'd, delighted. Be content;"
V,IV,Jupiter,"Your low-laid son our godhead will uplift:"
V,IV,Jupiter,"His comforts thrive, his trials well are spent."
V,IV,Jupiter,"Our Jovial star reign'd at his birth, and in"
V,IV,Jupiter,"Our temple was he married. Rise, and fade."
V,IV,Jupiter,"He shall be lord of lady Imogen,"
V,IV,Jupiter,"And happier much by his affliction made."
V,IV,Jupiter,"This tablet lay upon his breast, wherein"
V,IV,Jupiter,"Our pleasure his full fortune doth confine:"
V,IV,Jupiter,"and so, away: no further with your din"
V,IV,Jupiter,"Express impatience, lest you stir up mine."
V,IV,Jupiter,"Mount, eagle, to my palace crystalline."
V,IV,Sicilius Leonatus,"He came in thunder; his celestial breath"
V,IV,Sicilius Leonatus,"Was sulphurous to smell: the holy eagle"
V,IV,Sicilius Leonatus,"Stoop'd as to foot us: his ascension is"
V,IV,Sicilius Leonatus,"More sweet than our blest fields: his royal bird"
V,IV,Sicilius Leonatus,"Prunes the immortal wing and cloys his beak,"
V,IV,Sicilius Leonatus,"As when his god is pleased."
V,IV,All,"Thanks, Jupiter!"
V,IV,Sicilius Leonatus,"The marble pavement closes, he is enter'd"
V,IV,Sicilius Leonatus,"His radiant root. Away! and, to be blest,"
V,IV,Sicilius Leonatus,"Let us with care perform his great behest."
V,IV,Posthumus Leonatus,"A father to me; and thou hast created"
V,IV,Posthumus Leonatus,"A mother and two brothers: but, O scorn!"
V,IV,Posthumus Leonatus,"Gone! they went hence so soon as they were born:"
V,IV,Posthumus Leonatus,"And so I am awake. Poor wretches that depend"
V,IV,Posthumus Leonatus,"On greatness' favour dream as I have done,"
V,IV,Posthumus Leonatus,"Wake and find nothing. But, alas, I swerve:"
V,IV,Posthumus Leonatus,"Many dream not to find, neither deserve,"
V,IV,Posthumus Leonatus,"And yet are steep'd in favours: so am I,"
V,IV,Posthumus Leonatus,"That have this golden chance and know not why."
V,IV,Posthumus Leonatus,"What fairies haunt this ground? A book? O rare one!"
V,IV,Posthumus Leonatus,"Be not, as is our fangled world, a garment"
V,IV,Posthumus Leonatus,"Nobler than that it covers: let thy effects"
V,IV,Posthumus Leonatus,"So follow, to be most unlike our courtiers,"
V,IV,Posthumus Leonatus,"As good as promise."
V,IV,Posthumus Leonatus,"'When as a lion's whelp shall, to himself unknown,"
V,IV,Posthumus Leonatus,"without seeking find, and be embraced by a piece of"
V,IV,Posthumus Leonatus,"tender air; and when from a stately cedar shall be"
V,IV,Posthumus Leonatus,"lopped branches, which, being dead many years,"
V,IV,Posthumus Leonatus,"shall after revive, be jointed to the old stock and"
V,IV,Posthumus Leonatus,"freshly grow; then shall Posthumus end his miseries,"
