III,IV,IMOGEN,"Thou mayst be valiant in a better cause;"
III,IV,IMOGEN,"But now thou seem'st a coward."
III,IV,PISANIO,"Hence, vile instrument!"
III,IV,PISANIO,"Thou shalt not damn my hand."
III,IV,IMOGEN,"Why, I must die;"
III,IV,IMOGEN,"And if I do not by thy hand, thou art"
III,IV,IMOGEN,"No servant of thy master's. Against self-slaughter"
III,IV,IMOGEN,"There is a prohibition so divine"
III,IV,IMOGEN,"That cravens my weak hand. Come, here's my heart."
III,IV,IMOGEN,"Something's afore't. Soft, soft! we'll no defence;"
III,IV,IMOGEN,"Obedient as the scabbard. What is here?"
III,IV,IMOGEN,"The scriptures of the loyal Leonatus,"
III,IV,IMOGEN,"All turn'd to heresy? Away, away,"
III,IV,IMOGEN,"Corrupters of my faith! you shall no more"
III,IV,IMOGEN,"Be stomachers to my heart. Thus may poor fools"
III,IV,IMOGEN,"Believe false teachers: though those that"
III,IV,IMOGEN,"are betray'd"
III,IV,IMOGEN,"Do feel the treason sharply, yet the traitor"
III,IV,IMOGEN,"Stands in worse case of woe."
III,IV,IMOGEN,"And thou, Posthumus, thou that didst set up"
III,IV,IMOGEN,"My disobedience 'gainst the king my father"
III,IV,IMOGEN,"And make me put into contempt the suits"
III,IV,IMOGEN,"Of princely fellows, shalt hereafter find"
III,IV,IMOGEN,"It is no act of common passage, but"
III,IV,IMOGEN,"A strain of rareness: and I grieve myself"
III,IV,IMOGEN,"To think, when thou shalt be disedged by her"
III,IV,IMOGEN,"That now thou tirest on, how thy memory"
III,IV,IMOGEN,"Will then be pang'd by me. Prithee, dispatch:"
III,IV,IMOGEN,"The lamb entreats the butcher: where's thy knife?"
III,IV,IMOGEN,"Thou art too slow to do thy master's bidding,"
III,IV,IMOGEN,"When I desire it too."
III,IV,PISANIO,"O gracious lady,"
III,IV,PISANIO,"Since I received command to do this business"
III,IV,PISANIO,"I have not slept one wink."
III,IV,IMOGEN,"Do't, and to bed then."
III,IV,PISANIO,"I'll wake mine eye-balls blind first."
III,IV,IMOGEN,"Wherefore then"
III,IV,IMOGEN,"Didst undertake it? Why hast thou abused"
III,IV,IMOGEN,"So many miles with a pretence? this place?"
III,IV,IMOGEN,"Mine action and thine own? our horses' labour?"
III,IV,IMOGEN,"The time inviting thee? the perturb'd court,"
III,IV,IMOGEN,"For my being absent? whereunto I never"
III,IV,IMOGEN,"Purpose return. Why hast thou gone so far,"
III,IV,IMOGEN,"To be unbent when thou hast ta'en thy stand,"
III,IV,IMOGEN,"The elected deer before thee?"
III,IV,PISANIO,"But to win time"
III,IV,PISANIO,"To lose so bad employment; in the which"
III,IV,PISANIO,"I have consider'd of a course. Good lady,"
III,IV,PISANIO,"Hear me with patience."
III,IV,IMOGEN,"Talk thy tongue weary; speak"
III,IV,IMOGEN,"I have heard I am a strumpet; and mine ear"
III,IV,IMOGEN,"Therein false struck, can take no greater wound,"
III,IV,IMOGEN,"Nor tent to bottom that. But speak."
III,IV,PISANIO,"Then, madam,"
III,IV,PISANIO,"I thought you would not back again."
III,IV,IMOGEN,"Most like;"
III,IV,IMOGEN,"Bringing me here to kill me."
III,IV,PISANIO,"Not so, neither:"
III,IV,PISANIO,"But if I were as wise as honest, then"
III,IV,PISANIO,"My purpose would prove well. It cannot be"
III,IV,PISANIO,"But that my master is abused:"
III,IV,PISANIO,"Some villain, ay, and singular in his art."
III,IV,PISANIO,"Hath done you both this cursed injury."
III,IV,IMOGEN,"Some Roman courtezan."
III,IV,PISANIO,"No, on my life."
III,IV,PISANIO,"I'll give but notice you are dead and send him"
III,IV,PISANIO,"Some bloody sign of it; for 'tis commanded"
III,IV,PISANIO,"I should do so: you shall be miss'd at court,"
III,IV,PISANIO,"And that will well confirm it."
III,IV,IMOGEN,"Why good fellow,"
III,IV,IMOGEN,"What shall I do the where? where bide? how live?"
III,IV,IMOGEN,"Or in my life what comfort, when I am"
III,IV,IMOGEN,"Dead to my husband?"
III,IV,PISANIO,"If you'll back to the court--"
III,IV,IMOGEN,"No court, no father; nor no more ado"
III,IV,IMOGEN,"With that harsh, noble, simple nothing,"
III,IV,IMOGEN,"That Cloten, whose love-suit hath been to me"
III,IV,IMOGEN,"As fearful as a siege."
III,IV,PISANIO,"If not at court,"
III,IV,PISANIO,"Then not in Britain must you bide."
III,IV,IMOGEN,"Where then"
III,IV,IMOGEN,"Hath Britain all the sun that shines? Day, night,"
III,IV,IMOGEN,"Are they not but in Britain? I' the world's volume"
III,IV,IMOGEN,"Our Britain seems as of it, but not in 't;"
III,IV,IMOGEN,"In a great pool a swan's nest: prithee, think"
III,IV,IMOGEN,"There's livers out of Britain."
III,IV,PISANIO,"I am most glad"
III,IV,PISANIO,"You think of other place. The ambassador,"
III,IV,PISANIO,"Lucius the Roman, comes to Milford-Haven"
III,IV,PISANIO,"To-morrow: now, if you could wear a mind"
III,IV,PISANIO,"Dark as your fortune is, and but disguise"
III,IV,PISANIO,"That which, to appear itself, must not yet be"
III,IV,PISANIO,"But by self-danger, you should tread a course"
III,IV,PISANIO,"Pretty and full of view; yea, haply, near"
III,IV,PISANIO,"The residence of Posthumus; so nigh at least"
III,IV,PISANIO,"That though his actions were not visible, yet"
III,IV,PISANIO,"Report should render him hourly to your ear"
III,IV,PISANIO,"As truly as he moves."
III,IV,IMOGEN,"O, for such means!"
III,IV,IMOGEN,"Though peril to my modesty, not death on't,"
III,IV,IMOGEN,"I would adventure."
III,IV,PISANIO,"Well, then, here's the point:"
III,IV,PISANIO,"You must forget to be a woman; change"
III,IV,PISANIO,"Command into obedience: fear and niceness--"
III,IV,PISANIO,"The handmaids of all women, or, more truly,"
III,IV,PISANIO,"Woman its pretty self--into a waggish courage:"
III,IV,PISANIO,"Ready in gibes, quick-answer'd, saucy and"
III,IV,PISANIO,"As quarrelous as the weasel; nay, you must"
III,IV,PISANIO,"Forget that rarest treasure of your cheek,"
III,IV,PISANIO,"Exposing it--but, O, the harder heart!"
III,IV,PISANIO,"Alack, no remedy!--to the greedy touch"
III,IV,PISANIO,"Of common-kissing Titan, and forget"
III,IV,PISANIO,"Your laboursome and dainty trims, wherein"
III,IV,PISANIO,"You made great Juno angry."
III,IV,IMOGEN,"Nay, be brief"
III,IV,IMOGEN,"I see into thy end, and am almost"
III,IV,IMOGEN,"A man already."
III,IV,PISANIO,"First, make yourself but like one."
III,IV,PISANIO,"Fore-thinking this, I have already fit--"
III,IV,PISANIO,"'Tis in my cloak-bag--doublet, hat, hose, all"
III,IV,PISANIO,"That answer to them: would you in their serving,"
III,IV,PISANIO,"And with what imitation you can borrow"
III,IV,PISANIO,"From youth of such a season, 'fore noble Lucius"
III,IV,PISANIO,"Present yourself, desire his service, tell him"
III,IV,PISANIO,"wherein you're happy,--which you'll make him know,"
III,IV,PISANIO,"If that his head have ear in music,--doubtless"
III,IV,PISANIO,"With joy he will embrace you, for he's honourable"
III,IV,PISANIO,"And doubling that, most holy. Your means abroad,"
III,IV,PISANIO,"You have me, rich; and I will never fail"
III,IV,PISANIO,"Beginning nor supplyment."
III,IV,IMOGEN,"Thou art all the comfort"
III,IV,IMOGEN,"The gods will diet me with. Prithee, away:"
III,IV,IMOGEN,"There's more to be consider'd; but we'll even"
III,IV,IMOGEN,"All that good time will give us: this attempt"
III,IV,IMOGEN,"I am soldier to, and will abide it with"
III,IV,IMOGEN,"A prince's courage. Away, I prithee."
III,IV,PISANIO,"Well, madam, we must take a short farewell,"
III,IV,PISANIO,"Lest, being miss'd, I be suspected of"
III,IV,PISANIO,"Your carriage from the court. My noble mistress,"
III,IV,PISANIO,"Here is a box; I had it from the queen:"
III,IV,PISANIO,"What's in't is precious; if you are sick at sea,"
III,IV,PISANIO,"Or stomach-qualm'd at land, a dram of this"
III,IV,PISANIO,"Will drive away distemper. To some shade,"
III,IV,PISANIO,"And fit you to your manhood. May the gods"
III,IV,PISANIO,"Direct you to the best!"
III,IV,IMOGEN,"Amen: I thank thee."
III,V,CYMBELINE,"Thus far; and so farewell."
III,V,CAIUS LUCIUS,"Thanks, royal sir."
III,V,CAIUS LUCIUS,"My emperor hath wrote, I must from hence;"
III,V,CAIUS LUCIUS,"And am right sorry that I must report ye"
III,V,CAIUS LUCIUS,"My master's enemy."
III,V,CYMBELINE,"Our subjects, sir,"
III,V,CYMBELINE,"Will not endure his yoke; and for ourself"
III,V,CYMBELINE,"To show less sovereignty than they, must needs"
III,V,CYMBELINE,"Appear unkinglike."
III,V,CAIUS LUCIUS,"So, sir: I desire of you"
III,V,CAIUS LUCIUS,"A conduct over-land to Milford-Haven."
III,V,CAIUS LUCIUS,"Madam, all joy befal your grace!"
III,V,QUEEN,"And you!"
III,V,CYMBELINE,"My lords, you are appointed for that office;"
III,V,CYMBELINE,"The due of honour in no point omit."
III,V,CYMBELINE,"So farewell, noble Lucius."
III,V,CAIUS LUCIUS,"Your hand, my lord."
III,V,CLOTEN,"Receive it friendly; but from this time forth"
III,V,CLOTEN,"I wear it as your enemy."
III,V,CAIUS LUCIUS,"Sir, the event"
III,V,CAIUS LUCIUS,"Is yet to name the winner: fare you well."
III,V,CYMBELINE,"Leave not the worthy Lucius, good my lords,"
III,V,CYMBELINE,"Till he have cross'd the Severn. Happiness!"
III,V,QUEEN,"He goes hence frowning: but it honours us"
III,V,QUEEN,"That we have given him cause."
III,V,CLOTEN,"'Tis all the better;"
III,V,CLOTEN,"Your valiant Britons have their wishes in it."
III,V,CYMBELINE,"Lucius hath wrote already to the emperor"
III,V,CYMBELINE,"How it goes here. It fits us therefore ripely"
III,V,CYMBELINE,"Our chariots and our horsemen be in readiness:"
III,V,CYMBELINE,"The powers that he already hath in Gallia"
III,V,CYMBELINE,"Will soon be drawn to head, from whence he moves"
III,V,CYMBELINE,"His war for Britain."
III,V,QUEEN,"'Tis not sleepy business;"
III,V,QUEEN,"But must be look'd to speedily and strongly."
III,V,CYMBELINE,"Our expectation that it would be thus"
III,V,CYMBELINE,"Hath made us forward. But, my gentle queen,"
III,V,CYMBELINE,"Where is our daughter? She hath not appear'd"
III,V,CYMBELINE,"Before the Roman, nor to us hath tender'd"
III,V,CYMBELINE,"The duty of the day: she looks us like"
III,V,CYMBELINE,"A thing more made of malice than of duty:"
III,V,CYMBELINE,"We have noted it. Call her before us; for"
III,V,CYMBELINE,"We have been too slight in sufferance."
III,V,QUEEN,"Royal sir,"
III,V,QUEEN,"Since the exile of Posthumus, most retired"
III,V,QUEEN,"Hath her life been; the cure whereof, my lord,"
III,V,QUEEN,"'Tis time must do. Beseech your majesty,"
III,V,QUEEN,"Forbear sharp speeches to her: she's a lady"
III,V,QUEEN,"So tender of rebukes that words are strokes"
III,V,QUEEN,"And strokes death to her."
III,V,CYMBELINE,"Where is she, sir? How"
III,V,CYMBELINE,"Can her contempt be answer'd?"
III,V,Attendant,"Please you, sir,"
III,V,Attendant,"Her chambers are all lock'd; and there's no answer"
III,V,Attendant,"That will be given to the loudest noise we make."
III,V,QUEEN,"My lord, when last I went to visit her,"
III,V,QUEEN,"She pray'd me to excuse her keeping close,"
III,V,QUEEN,"Whereto constrain'd by her infirmity,"
III,V,QUEEN,"She should that duty leave unpaid to you,"
III,V,QUEEN,"Which daily she was bound to proffer: this"
III,V,QUEEN,"She wish'd me to make known; but our great court"
III,V,QUEEN,"Made me to blame in memory."
III,V,CYMBELINE,"Her doors lock'd?"
III,V,CYMBELINE,"Not seen of late? Grant, heavens, that which I fear"
III,V,CYMBELINE,"Prove false!"
III,V,QUEEN,"Son, I say, follow the king."
III,V,CLOTEN,"That man of hers, Pisanio, her old servant,"
III,V,CLOTEN,"have not seen these two days."
III,V,QUEEN,"Go, look after."
III,V,QUEEN,"Pisanio, thou that stand'st so for Posthumus!"
III,V,QUEEN,"He hath a drug of mine; I pray his absence"
III,V,QUEEN,"Proceed by swallowing that, for he believes"
III,V,QUEEN,"It is a thing most precious. But for her,"
III,V,QUEEN,"Where is she gone? Haply, despair hath seized her,"
III,V,QUEEN,"Or, wing'd with fervor of her love, she's flown"
III,V,QUEEN,"To her desired Posthumus: gone she is"
III,V,QUEEN,"To death or to dishonour; and my end"
III,V,QUEEN,"Can make good use of either: she being down,"
III,V,QUEEN,"I have the placing of the British crown."
III,V,QUEEN,"How now, my son!"
III,V,CLOTEN,"'Tis certain she is fled."
III,V,CLOTEN,"Go in and cheer the king: he rages; none"
III,V,CLOTEN,"Dare come about him."
III,V,QUEEN,"This night forestall him of the coming day!"
III,V,CLOTEN,"I love and hate her: for she's fair and royal,"
III,V,CLOTEN,"And that she hath all courtly parts more exquisite"
III,V,CLOTEN,"Than lady, ladies, woman; from every one"
III,V,CLOTEN,"The best she hath, and she, of all compounded,"
III,V,CLOTEN,"Outsells them all; I love her therefore: but"
III,V,CLOTEN,"Disdaining me and throwing favours on"
III,V,CLOTEN,"The low Posthumus slanders so her judgment"
III,V,CLOTEN,"That what's else rare is choked; and in that point"
III,V,CLOTEN,"I will conclude to hate her, nay, indeed,"
III,V,CLOTEN,"To be revenged upon her. For when fools Shall--"
III,V,CLOTEN,"Who is here? What, are you packing, sirrah?"
III,V,CLOTEN,"Come hither: ah, you precious pander! Villain,"
III,V,CLOTEN,"Where is thy lady? In a word; or else"
III,V,CLOTEN,"Thou art straightway with the fiends."
III,V,PISANIO,"O, good my lord!"
III,V,CLOTEN,"Where is thy lady? Or, by Jupiter,--"
III,V,CLOTEN,"I will not ask again. Close villain,"
III,V,CLOTEN,"I'll have this secret from thy heart, or rip"
III,V,CLOTEN,"Thy heart to find it. Is she with Posthumus?"
III,V,CLOTEN,"From whose so many weights of baseness cannot"
III,V,CLOTEN,"A dram of worth be drawn."
III,V,PISANIO,"Alas, my lord,"
III,V,PISANIO,"How can she be with him? When was she missed?"
III,V,PISANIO,"He is in Rome."
III,V,CLOTEN,"Where is she, sir? Come nearer;"
III,V,CLOTEN,"No further halting: satisfy me home"
III,V,CLOTEN,"What is become of her."
III,V,PISANIO,"O, my all-worthy lord!"
III,V,CLOTEN,"All-worthy villain!"
III,V,CLOTEN,"Discover where thy mistress is at once,"
III,V,CLOTEN,"At the next word: no more of 'worthy lord!'"
III,V,CLOTEN,"Speak, or thy silence on the instant is"
III,V,CLOTEN,"Thy condemnation and thy death."
III,V,PISANIO,"Then, sir,"
III,V,PISANIO,"This paper is the history of my knowledge"
III,V,PISANIO,"Touching her flight."
III,V,CLOTEN,"Let's see't. I will pursue her"
III,V,CLOTEN,"Even to Augustus' throne."
III,V,PISANIO,"She's far enough; and what he learns by this"
III,V,PISANIO,"May prove his travel, not her danger."
III,V,CLOTEN,"Hum!"
III,V,PISANIO,"Safe mayst thou wander, safe return again!"
III,V,CLOTEN,"Sirrah, is this letter true?"
III,V,PISANIO,"Sir, as I think."
III,V,CLOTEN,"It is Posthumus' hand; I know't. Sirrah, if thou"
III,V,CLOTEN,"wouldst not be a villain, but do me true service,"
III,V,CLOTEN,"undergo those employments wherein I should have"
III,V,CLOTEN,"cause to use thee with a serious industry, that is,"
III,V,CLOTEN,"what villany soe'er I bid thee do, to perform it"
III,V,CLOTEN,"directly and truly, I would think thee an honest"
III,V,CLOTEN,"man: thou shouldst neither want my means for thy"
III,V,CLOTEN,"relief nor my voice for thy preferment."
III,V,PISANIO,"Well, my good lord."
III,V,CLOTEN,"Wilt thou serve me? for since patiently and"
III,V,CLOTEN,"constantly thou hast stuck to the bare fortune of"
III,V,CLOTEN,"that beggar Posthumus, thou canst not, in the"
III,V,CLOTEN,"course of gratitude, but be a diligent follower of"
III,V,CLOTEN,"mine: wilt thou serve me?"
III,V,PISANIO,"Sir, I will."
III,V,CLOTEN,"Give me thy hand; here's my purse. Hast any of thy"
III,V,CLOTEN,"late master's garments in thy possession?"
III,V,PISANIO,"I have, my lord, at my lodging, the same suit he"
III,V,PISANIO,"wore when he took leave of my lady and mistress."
III,V,CLOTEN,"The first service thou dost me, fetch that suit"
III,V,CLOTEN,"hither: let it be thy lint service; go."
III,V,PISANIO,"I shall, my lord."
III,V,CLOTEN,"Meet thee at Milford-Haven!--I forgot to ask him one"
III,V,CLOTEN,"thing; I'll remember't anon:--even there, thou"
III,V,CLOTEN,"villain Posthumus, will I kill thee. I would these"
III,V,CLOTEN,"garments were come. She said upon a time--the"
III,V,CLOTEN,"bitterness of it I now belch from my heart--that she"
III,V,CLOTEN,"held the very garment of Posthumus in more respect"
III,V,CLOTEN,"than my noble and natural person together with the"
III,V,CLOTEN,"adornment of my qualities. With that suit upon my"
III,V,CLOTEN,"back, will I ravish her: first kill him, and in her"
III,V,CLOTEN,"eyes; there shall she see my valour, which will then"
III,V,CLOTEN,"be a torment to her contempt. He on the ground, my"
III,V,CLOTEN,"speech of insultment ended on his dead body, and"
III,V,CLOTEN,"when my lust hath dined,--which, as I say, to vex"
III,V,CLOTEN,"her I will execute in the clothes that she so"
III,V,CLOTEN,"praised,--to the court I'll knock her back, foot"
III,V,CLOTEN,"her home again. She hath despised me rejoicingly,"
III,V,CLOTEN,"and I'll be merry in my revenge."
III,V,CLOTEN,"Be those the garments?"
III,V,PISANIO,"Ay, my noble lord."
III,V,CLOTEN,"How long is't since she went to Milford-Haven?"
III,V,PISANIO,"She can scarce be there yet."
III,V,CLOTEN,"Bring this apparel to my chamber; that is the second"
III,V,CLOTEN,"thing that I have commanded thee: the third is,"
III,V,CLOTEN,"that thou wilt be a voluntary mute to my design. Be"
III,V,CLOTEN,"but duteous, and true preferment shall tender itself"
III,V,CLOTEN,"to thee. My revenge is now at Milford: would I had"
III,V,CLOTEN,"wings to follow it! Come, and be true."
III,V,PISANIO,"Thou bid'st me to my loss: for true to thee"
III,V,PISANIO,"Were to prove false, which I will never be,"
III,V,PISANIO,"To him that is most true. To Milford go,"
III,V,PISANIO,"And find not her whom thou pursuest. Flow, flow,"
III,V,PISANIO,"You heavenly blessings, on her! This fool's speed"
III,V,PISANIO,"Be cross'd with slowness; labour be his meed!"
III,VI,IMOGEN,"I see a man's life is a tedious one:"
III,VI,IMOGEN,"I have tired myself, and for two nights together"
III,VI,IMOGEN,"Have made the ground my bed. I should be sick,"
III,VI,IMOGEN,"But that my resolution helps me. Milford,"
III,VI,IMOGEN,"When from the mountain-top Pisanio show'd thee,"
III,VI,IMOGEN,"Thou wast within a ken: O Jove! I think"
III,VI,IMOGEN,"Foundations fly the wretched; such, I mean,"
III,VI,IMOGEN,"Where they should be relieved. Two beggars told me"
III,VI,IMOGEN,"I could not miss my way: will poor folks lie,"
III,VI,IMOGEN,"That have afflictions on them, knowing 'tis"
III,VI,IMOGEN,"A punishment or trial? Yes; no wonder,"
III,VI,IMOGEN,"When rich ones scarce tell true. To lapse in fulness"
III,VI,IMOGEN,"Is sorer than to lie for need, and falsehood"
III,VI,IMOGEN,"Is worse in kings than beggars. My dear lord!"
III,VI,IMOGEN,"Thou art one o' the false ones. Now I think on thee,"
III,VI,IMOGEN,"My hunger's gone; but even before, I was"
III,VI,IMOGEN,"At point to sink for food. But what is this?"
III,VI,IMOGEN,"Here is a path to't: 'tis some savage hold:"
III,VI,IMOGEN,"I were best not to call; I dare not call:"
III,VI,IMOGEN,"yet famine,"
III,VI,IMOGEN,"Ere clean it o'erthrow nature, makes it valiant,"
III,VI,IMOGEN,"Plenty and peace breeds cowards: hardness ever"
III,VI,IMOGEN,"Of hardiness is mother. Ho! who's here?"
III,VI,IMOGEN,"If any thing that's civil, speak; if savage,"
III,VI,IMOGEN,"Take or lend. Ho! No answer? Then I'll enter."
III,VI,IMOGEN,"Best draw my sword: and if mine enemy"
III,VI,IMOGEN,"But fear the sword like me, he'll scarcely look on't."
III,VI,IMOGEN,"Such a foe, good heavens!"
III,VI,BELARIUS,"You, Polydote, have proved best woodman and"
III,VI,BELARIUS,"Are master of the feast: Cadwal and I"
III,VI,BELARIUS,"Will play the cook and servant; 'tis our match:"
III,VI,BELARIUS,"The sweat of industry would dry and die,"
III,VI,BELARIUS,"But for the end it works to. Come; our stomachs"
III,VI,BELARIUS,"Will make what's homely savoury: weariness"
III,VI,BELARIUS,"Can snore upon the flint, when resty sloth"
III,VI,BELARIUS,"Finds the down pillow hard. Now peace be here,"
III,VI,BELARIUS,"Poor house, that keep'st thyself!"
III,VI,GUIDERIUS,"I am thoroughly weary."
III,VI,ARVIRAGUS,"I am weak with toil, yet strong in appetite."
III,VI,GUIDERIUS,"There is cold meat i' the cave; we'll browse on that,"
III,VI,GUIDERIUS,"Whilst what we have kill'd be cook'd."
III,VI,BELARIUS,"Stay; come not in."
III,VI,BELARIUS,"But that it eats our victuals, I should think"
III,VI,BELARIUS,"Here were a fairy."
III,VI,GUIDERIUS,"What's the matter, sir?"
III,VI,BELARIUS,"By Jupiter, an angel! or, if not,"
III,VI,BELARIUS,"An earthly paragon! Behold divineness"
III,VI,BELARIUS,"No elder than a boy!"
III,VI,IMOGEN,"Good masters, harm me not:"
III,VI,IMOGEN,"Before I enter'd here, I call'd; and thought"
III,VI,IMOGEN,"To have begg'd or bought what I have took:"
III,VI,IMOGEN,"good troth,"
III,VI,IMOGEN,"I have stol'n nought, nor would not, though I had found"
III,VI,IMOGEN,"Gold strew'd i' the floor. Here's money for my meat:"
III,VI,IMOGEN,"I would have left it on the board so soon"
III,VI,IMOGEN,"As I had made my meal, and parted"
III,VI,IMOGEN,"With prayers for the provider."
III,VI,GUIDERIUS,"Money, youth?"
III,VI,ARVIRAGUS,"All gold and silver rather turn to dirt!"
III,VI,ARVIRAGUS,"As 'tis no better reckon'd, but of those"
III,VI,ARVIRAGUS,"Who worship dirty gods."
III,VI,IMOGEN,"I see you're angry:"
III,VI,IMOGEN,"Know, if you kill me for my fault, I should"
III,VI,IMOGEN,"Have died had I not made it."
III,VI,BELARIUS,"Whither bound?"
III,VI,IMOGEN,"To Milford-Haven."
III,VI,BELARIUS,"What's your name?"
III,VI,IMOGEN,"Fidele, sir. I have a kinsman who"
III,VI,IMOGEN,"Is bound for Italy; he embark'd at Milford;"
III,VI,IMOGEN,"To whom being going, almost spent with hunger,"
III,VI,IMOGEN,"I am fall'n in this offence."
III,VI,BELARIUS,"Prithee, fair youth,"
III,VI,BELARIUS,"Think us no churls, nor measure our good minds"
III,VI,BELARIUS,"By this rude place we live in. Well encounter'd!"
III,VI,BELARIUS,"'Tis almost night: you shall have better cheer"
III,VI,BELARIUS,"Ere you depart: and thanks to stay and eat it."
III,VI,BELARIUS,"Boys, bid him welcome."
III,VI,GUIDERIUS,"Were you a woman, youth,"
III,VI,GUIDERIUS,"I should woo hard but be your groom. In honesty,"
III,VI,GUIDERIUS,"I bid for you as I'd buy."
III,VI,ARVIRAGUS,"I'll make't my comfort"
III,VI,ARVIRAGUS,"He is a man; I'll love him as my brother:"
III,VI,ARVIRAGUS,"And such a welcome as I'd give to him"
III,VI,ARVIRAGUS,"After long absence, such is yours: most welcome!"
III,VI,ARVIRAGUS,"Be sprightly, for you fall 'mongst friends."
III,VI,IMOGEN,"'Mongst friends,"
III,VI,IMOGEN,"If brothers."
III,VI,IMOGEN,"Would it had been so, that they"
III,VI,IMOGEN,"Had been my father's sons! then had my prize"
III,VI,IMOGEN,"Been less, and so more equal ballasting"
III,VI,IMOGEN,"To thee, Posthumus."
III,VI,BELARIUS,"He wrings at some distress."
III,VI,GUIDERIUS,"Would I could free't!"
III,VI,ARVIRAGUS,"Or I, whate'er it be,"
III,VI,ARVIRAGUS,"What pain it cost, what danger. God's!"
III,VI,BELARIUS,"Hark, boys."
III,VI,IMOGEN,"Great men,"
III,VI,IMOGEN,"That had a court no bigger than this cave,"
III,VI,IMOGEN,"That did attend themselves and had the virtue"
III,VI,IMOGEN,"Which their own conscience seal'd them--laying by"
III,VI,IMOGEN,"That nothing-gift of differing multitudes--"
III,VI,IMOGEN,"Could not out-peer these twain. Pardon me, gods!"
III,VI,IMOGEN,"I'd change my sex to be companion with them,"
III,VI,IMOGEN,"Since Leonatus's false."
III,VI,BELARIUS,"It shall be so."
III,VI,BELARIUS,"Boys, we'll go dress our hunt. Fair youth, come in:"
III,VI,BELARIUS,"Discourse is heavy, fasting; when we have supp'd,"
III,VI,BELARIUS,"We'll mannerly demand thee of thy story,"
III,VI,BELARIUS,"So far as thou wilt speak it."
III,VI,GUIDERIUS,"Pray, draw near."
III,VI,ARVIRAGUS,"The night to the owl and morn to the lark"
III,VI,ARVIRAGUS,"less welcome."
III,VI,IMOGEN,"Thanks, sir."
III,VI,ARVIRAGUS,"I pray, draw near."
III,VII,First Senator,"This is the tenor of the emperor's writ:"
III,VII,First Senator,"That since the common men are now in action"
III,VII,First Senator,"'Gainst the Pannonians and Dalmatians,"
III,VII,First Senator,"And that the legions now in Gallia are"
III,VII,First Senator,"Full weak to undertake our wars against"
III,VII,First Senator,"The fall'n-off Britons, that we do incite"
III,VII,First Senator,"The gentry to this business. He creates"
III,VII,First Senator,"Lucius preconsul: and to you the tribunes,"
III,VII,First Senator,"For this immediate levy, he commends"
III,VII,First Senator,"His absolute commission. Long live Caesar!"
III,VII,First Tribune,"Is Lucius general of the forces?"
III,VII,Second Senator,"Ay."
III,VII,First Tribune,"Remaining now in Gallia?"
III,VII,First Senator,"With those legions"
III,VII,First Senator,"Which I have spoke of, whereunto your levy"
III,VII,First Senator,"Must be supplyant: the words of your commission"
III,VII,First Senator,"Will tie you to the numbers and the time"
III,VII,First Senator,"Of their dispatch."
III,VII,First Tribune,"We will discharge our duty."
IV,I,CLOTEN,"I am near to the place where they should meet, if"
IV,I,CLOTEN,"Pisanio have mapped it truly. How fit his garments"
IV,I,CLOTEN,"serve me! Why should his mistress, who was made by"
IV,I,CLOTEN,"him that made the tailor, not be fit too? the"
IV,I,CLOTEN,"rather--saving reverence of the word--for 'tis said"
IV,I,CLOTEN,"a woman's fitness comes by fits. Therein I must"
IV,I,CLOTEN,"play the workman. I dare speak it to myself--for it"
IV,I,CLOTEN,"is not vain-glory for a man and his glass to confer"
IV,I,CLOTEN,"in his own chamber--I mean, the lines of my body are"
IV,I,CLOTEN,"as well drawn as his; no less young, more strong,"
IV,I,CLOTEN,"not beneath him in fortunes, beyond him in the"
IV,I,CLOTEN,"advantage of the time, above him in birth, alike"
IV,I,CLOTEN,"conversant in general services, and more remarkable"
IV,I,CLOTEN,"in single oppositions: yet this imperceiverant"
IV,I,CLOTEN,"thing loves him in my despite. What mortality is!"
IV,I,CLOTEN,"Posthumus, thy head, which now is growing upon thy"
