IV,III,BRUTUS,"Let me tell you, Cassius, you yourself"
IV,III,BRUTUS,"Are much condemn'd to have an itching palm;"
IV,III,BRUTUS,"To sell and mart your offices for gold"
IV,III,BRUTUS,"To undeservers."
IV,III,CASSIUS,"I an itching palm!"
IV,III,CASSIUS,"You know that you are Brutus that speak this,"
IV,III,CASSIUS,"Or, by the gods, this speech were else your last."
IV,III,BRUTUS,"The name of Cassius honours this corruption,"
IV,III,BRUTUS,"And chastisement doth therefore hide his head."
IV,III,CASSIUS,"Chastisement!"
IV,III,BRUTUS,"Remember March, the ides of March remember:"
IV,III,BRUTUS,"Did not great Julius bleed for justice' sake?"
IV,III,BRUTUS,"What villain touch'd his body, that did stab,"
IV,III,BRUTUS,"And not for justice? What, shall one of us"
IV,III,BRUTUS,"That struck the foremost man of all this world"
IV,III,BRUTUS,"But for supporting robbers, shall we now"
IV,III,BRUTUS,"Contaminate our fingers with base bribes,"
IV,III,BRUTUS,"And sell the mighty space of our large honours"
IV,III,BRUTUS,"For so much trash as may be grasped thus?"
IV,III,BRUTUS,"I had rather be a dog, and bay the moon,"
IV,III,BRUTUS,"Than such a Roman."
IV,III,CASSIUS,"Brutus, bay not me;"
IV,III,CASSIUS,"I'll not endure it: you forget yourself,"
IV,III,CASSIUS,"To hedge me in; I am a soldier, I,"
IV,III,CASSIUS,"Older in practise, abler than yourself"
IV,III,CASSIUS,"To make conditions."
IV,III,BRUTUS,"Go to; you are not, Cassius."
IV,III,CASSIUS,"I am."
IV,III,BRUTUS,"I say you are not."
IV,III,CASSIUS,"Urge me no more, I shall forget myself;"
IV,III,CASSIUS,"Have mind upon your health, tempt me no further."
IV,III,BRUTUS,"Away, slight man!"
IV,III,CASSIUS,"Is't possible?"
IV,III,BRUTUS,"Hear me, for I will speak."
IV,III,BRUTUS,"Must I give way and room to your rash choler?"
IV,III,BRUTUS,"Shall I be frighted when a madman stares?"
IV,III,CASSIUS,"O ye gods, ye gods! must I endure all this?"
IV,III,BRUTUS,"All this! ay, more: fret till your proud heart break;"
IV,III,BRUTUS,"Go show your slaves how choleric you are,"
IV,III,BRUTUS,"And make your bondmen tremble. Must I budge?"
IV,III,BRUTUS,"Must I observe you? must I stand and crouch"
IV,III,BRUTUS,"Under your testy humour? By the gods"
IV,III,BRUTUS,"You shall digest the venom of your spleen,"
IV,III,BRUTUS,"Though it do split you; for, from this day forth,"
IV,III,BRUTUS,"I'll use you for my mirth, yea, for my laughter,"
IV,III,BRUTUS,"When you are waspish."
IV,III,CASSIUS,"Is it come to this?"
IV,III,BRUTUS,"You say you are a better soldier:"
IV,III,BRUTUS,"Let it appear so; make your vaunting true,"
IV,III,BRUTUS,"And it shall please me well: for mine own part,"
IV,III,BRUTUS,"I shall be glad to learn of noble men."
IV,III,CASSIUS,"You wrong me every way; you wrong me, Brutus;"
IV,III,CASSIUS,"I said, an elder soldier, not a better:"
IV,III,CASSIUS,"Did I say 'better'?"
IV,III,BRUTUS,"If you did, I care not."
IV,III,CASSIUS,"When Caesar lived, he durst not thus have moved me."
IV,III,BRUTUS,"Peace, peace! you durst not so have tempted him."
IV,III,CASSIUS,"I durst not!"
IV,III,BRUTUS,"No."
IV,III,CASSIUS,"What, durst not tempt him!"
IV,III,BRUTUS,"For your life you durst not!"
IV,III,CASSIUS,"Do not presume too much upon my love;"
IV,III,CASSIUS,"I may do that I shall be sorry for."
IV,III,BRUTUS,"You have done that you should be sorry for."
IV,III,BRUTUS,"There is no terror, Cassius, in your threats,"
IV,III,BRUTUS,"For I am arm'd so strong in honesty"
IV,III,BRUTUS,"That they pass by me as the idle wind,"
IV,III,BRUTUS,"Which I respect not. I did send to you"
IV,III,BRUTUS,"For certain sums of gold, which you denied me:"
IV,III,BRUTUS,"For I can raise no money by vile means:"
IV,III,BRUTUS,"By heaven, I had rather coin my heart,"
IV,III,BRUTUS,"And drop my blood for drachmas, than to wring"
IV,III,BRUTUS,"From the hard hands of peasants their vile trash"
IV,III,BRUTUS,"By any indirection: I did send"
IV,III,BRUTUS,"To you for gold to pay my legions,"
IV,III,BRUTUS,"Which you denied me: was that done like Cassius?"
IV,III,BRUTUS,"Should I have answer'd Caius Cassius so?"
IV,III,BRUTUS,"When Marcus Brutus grows so covetous,"
IV,III,BRUTUS,"To lock such rascal counters from his friends,"
IV,III,BRUTUS,"Be ready, gods, with all your thunderbolts;"
IV,III,BRUTUS,"Dash him to pieces!"
IV,III,CASSIUS,"I denied you not."
IV,III,BRUTUS,"You did."
IV,III,CASSIUS,"I did not: he was but a fool that brought"
IV,III,CASSIUS,"My answer back. Brutus hath rived my heart:"
IV,III,CASSIUS,"A friend should bear his friend's infirmities,"
IV,III,CASSIUS,"But Brutus makes mine greater than they are."
IV,III,BRUTUS,"I do not, till you practise them on me."
IV,III,CASSIUS,"You love me not."
IV,III,BRUTUS,"I do not like your faults."
IV,III,CASSIUS,"A friendly eye could never see such faults."
IV,III,BRUTUS,"A flatterer's would not, though they do appear"
IV,III,BRUTUS,"As huge as high Olympus."
IV,III,CASSIUS,"Come, Antony, and young Octavius, come,"
IV,III,CASSIUS,"Revenge yourselves alone on Cassius,"
IV,III,CASSIUS,"For Cassius is aweary of the world;"
IV,III,CASSIUS,"Hated by one he loves; braved by his brother;"
IV,III,CASSIUS,"Cheque'd like a bondman; all his faults observed,"
IV,III,CASSIUS,"Set in a note-book, learn'd, and conn'd by rote,"
IV,III,CASSIUS,"To cast into my teeth. O, I could weep"
IV,III,CASSIUS,"My spirit from mine eyes! There is my dagger,"
IV,III,CASSIUS,"And here my naked breast; within, a heart"
IV,III,CASSIUS,"Dearer than Plutus' mine, richer than gold:"
IV,III,CASSIUS,"If that thou be'st a Roman, take it forth;"
IV,III,CASSIUS,"I, that denied thee gold, will give my heart:"
IV,III,CASSIUS,"Strike, as thou didst at Caesar; for, I know,"
IV,III,CASSIUS,"When thou didst hate him worst, thou lovedst him better"
IV,III,CASSIUS,"Than ever thou lovedst Cassius."
IV,III,BRUTUS,"Sheathe your dagger:"
IV,III,BRUTUS,"Be angry when you will, it shall have scope;"
IV,III,BRUTUS,"Do what you will, dishonour shall be humour."
IV,III,BRUTUS,"O Cassius, you are yoked with a lamb"
IV,III,BRUTUS,"That carries anger as the flint bears fire;"
IV,III,BRUTUS,"Who, much enforced, shows a hasty spark,"
IV,III,BRUTUS,"And straight is cold again."
IV,III,CASSIUS,"Hath Cassius lived"
IV,III,CASSIUS,"To be but mirth and laughter to his Brutus,"
IV,III,CASSIUS,"When grief, and blood ill-temper'd, vexeth him?"
IV,III,BRUTUS,"When I spoke that, I was ill-temper'd too."
IV,III,CASSIUS,"Do you confess so much? Give me your hand."
IV,III,BRUTUS,"And my heart too."
IV,III,CASSIUS,"O Brutus!"
IV,III,BRUTUS,"What's the matter?"
IV,III,CASSIUS,"Have not you love enough to bear with me,"
IV,III,CASSIUS,"When that rash humour which my mother gave me"
IV,III,CASSIUS,"Makes me forgetful?"
IV,III,BRUTUS,"Yes, Cassius; and, from henceforth,"
IV,III,BRUTUS,"When you are over-earnest with your Brutus,"
IV,III,BRUTUS,"He'll think your mother chides, and leave you so."
IV,III,Poet,"There is some grudge between 'em, 'tis not meet"
IV,III,Poet,"They be alone."
IV,III,CASSIUS,"How now! what's the matter?"
IV,III,Poet,"For shame, you generals! what do you mean?"
IV,III,Poet,"Love, and be friends, as two such men should be;"
IV,III,Poet,"For I have seen more years, I'm sure, than ye."
IV,III,CASSIUS,"Ha, ha! how vilely doth this cynic rhyme!"
IV,III,BRUTUS,"Get you hence, sirrah; saucy fellow, hence!"
IV,III,CASSIUS,"Bear with him, Brutus; 'tis his fashion."
IV,III,BRUTUS,"I'll know his humour, when he knows his time:"
IV,III,BRUTUS,"What should the wars do with these jigging fools?"
IV,III,BRUTUS,"Companion, hence!"
IV,III,CASSIUS,"Away, away, be gone."
IV,III,BRUTUS,"Lucilius and Titinius, bid the commanders"
IV,III,BRUTUS,"Prepare to lodge their companies to-night."
IV,III,CASSIUS,"And come yourselves, and bring Messala with you"
IV,III,CASSIUS,"Immediately to us."
IV,III,BRUTUS,"Lucius, a bowl of wine!"
IV,III,CASSIUS,"I did not think you could have been so angry."
IV,III,BRUTUS,"O Cassius, I am sick of many griefs."
IV,III,CASSIUS,"Of your philosophy you make no use,"
IV,III,CASSIUS,"If you give place to accidental evils."
IV,III,BRUTUS,"No man bears sorrow better. Portia is dead."
IV,III,CASSIUS,"Ha! Portia!"
IV,III,BRUTUS,"She is dead."
IV,III,CASSIUS,"How 'scaped I killing when I cross'd you so?"
IV,III,CASSIUS,"O insupportable and touching loss!"
IV,III,CASSIUS,"Upon what sickness?"
IV,III,BRUTUS,"Impatient of my absence,"
IV,III,BRUTUS,"And grief that young Octavius with Mark Antony"
IV,III,BRUTUS,"Have made themselves so strong:--for with her death"
IV,III,BRUTUS,"That tidings came;--with this she fell distract,"
IV,III,BRUTUS,"And, her attendants absent, swallow'd fire."
IV,III,CASSIUS,"And died so?"
IV,III,BRUTUS,"Even so."
IV,III,CASSIUS,"O ye immortal gods!"
IV,III,BRUTUS,"Speak no more of her. Give me a bowl of wine."
IV,III,BRUTUS,"In this I bury all unkindness, Cassius."
IV,III,CASSIUS,"My heart is thirsty for that noble pledge."
IV,III,CASSIUS,"Fill, Lucius, till the wine o'erswell the cup;"
IV,III,CASSIUS,"I cannot drink too much of Brutus' love."
IV,III,BRUTUS,"Come in, Titinius!"
IV,III,BRUTUS,"Welcome, good Messala."
IV,III,BRUTUS,"Now sit we close about this taper here,"
IV,III,BRUTUS,"And call in question our necessities."
IV,III,CASSIUS,"Portia, art thou gone?"
IV,III,BRUTUS,"No more, I pray you."
IV,III,BRUTUS,"Messala, I have here received letters,"
IV,III,BRUTUS,"That young Octavius and Mark Antony"
IV,III,BRUTUS,"Come down upon us with a mighty power,"
IV,III,BRUTUS,"Bending their expedition toward Philippi."
IV,III,MESSALA,"Myself have letters of the selfsame tenor."
IV,III,BRUTUS,"With what addition?"
IV,III,MESSALA,"That by proscription and bills of outlawry,"
IV,III,MESSALA,"Octavius, Antony, and Lepidus,"
IV,III,MESSALA,"Have put to death an hundred senators."
IV,III,BRUTUS,"Therein our letters do not well agree;"
IV,III,BRUTUS,"Mine speak of seventy senators that died"
IV,III,BRUTUS,"By their proscriptions, Cicero being one."
IV,III,CASSIUS,"Cicero one!"
IV,III,MESSALA,"Cicero is dead,"
IV,III,MESSALA,"And by that order of proscription."
IV,III,MESSALA,"Had you your letters from your wife, my lord?"
IV,III,BRUTUS,"No, Messala."
IV,III,MESSALA,"Nor nothing in your letters writ of her?"
IV,III,BRUTUS,"Nothing, Messala."
IV,III,MESSALA,"That, methinks, is strange."
IV,III,BRUTUS,"Why ask you? hear you aught of her in yours?"
IV,III,MESSALA,"No, my lord."
IV,III,BRUTUS,"Now, as you are a Roman, tell me true."
IV,III,MESSALA,"Then like a Roman bear the truth I tell:"
IV,III,MESSALA,"For certain she is dead, and by strange manner."
IV,III,BRUTUS,"Why, farewell, Portia. We must die, Messala:"
IV,III,BRUTUS,"With meditating that she must die once,"
IV,III,BRUTUS,"I have the patience to endure it now."
IV,III,MESSALA,"Even so great men great losses should endure."
IV,III,CASSIUS,"I have as much of this in art as you,"
IV,III,CASSIUS,"But yet my nature could not bear it so."
IV,III,BRUTUS,"Well, to our work alive. What do you think"
IV,III,BRUTUS,"Of marching to Philippi presently?"
IV,III,CASSIUS,"I do not think it good."
IV,III,BRUTUS,"Your reason?"
IV,III,CASSIUS,"This it is:"
IV,III,CASSIUS,"'Tis better that the enemy seek us:"
IV,III,CASSIUS,"So shall he waste his means, weary his soldiers,"
IV,III,CASSIUS,"Doing himself offence; whilst we, lying still,"
IV,III,CASSIUS,"Are full of rest, defense, and nimbleness."
IV,III,BRUTUS,"Good reasons must, of force, give place to better."
IV,III,BRUTUS,"The people 'twixt Philippi and this ground"
IV,III,BRUTUS,"Do stand but in a forced affection;"
IV,III,BRUTUS,"For they have grudged us contribution:"
IV,III,BRUTUS,"The enemy, marching along by them,"
IV,III,BRUTUS,"By them shall make a fuller number up,"
IV,III,BRUTUS,"Come on refresh'd, new-added, and encouraged;"
IV,III,BRUTUS,"From which advantage shall we cut him off,"
IV,III,BRUTUS,"If at Philippi we do face him there,"
IV,III,BRUTUS,"These people at our back."
IV,III,CASSIUS,"Hear me, good brother."
IV,III,BRUTUS,"Under your pardon. You must note beside,"
IV,III,BRUTUS,"That we have tried the utmost of our friends,"
IV,III,BRUTUS,"Our legions are brim-full, our cause is ripe:"
IV,III,BRUTUS,"The enemy increaseth every day;"
IV,III,BRUTUS,"We, at the height, are ready to decline."
IV,III,BRUTUS,"There is a tide in the affairs of men,"
IV,III,BRUTUS,"Which, taken at the flood, leads on to fortune;"
IV,III,BRUTUS,"Omitted, all the voyage of their life"
IV,III,BRUTUS,"Is bound in shallows and in miseries."
IV,III,BRUTUS,"On such a full sea are we now afloat;"
IV,III,BRUTUS,"And we must take the current when it serves,"
IV,III,BRUTUS,"Or lose our ventures."
IV,III,CASSIUS,"Then, with your will, go on;"
IV,III,CASSIUS,"We'll along ourselves, and meet them at Philippi."
IV,III,BRUTUS,"The deep of night is crept upon our talk,"
IV,III,BRUTUS,"And nature must obey necessity;"
IV,III,BRUTUS,"Which we will niggard with a little rest."
IV,III,BRUTUS,"There is no more to say?"
IV,III,CASSIUS,"No more. Good night:"
IV,III,CASSIUS,"Early to-morrow will we rise, and hence."
IV,III,BRUTUS,"Lucius!"
IV,III,BRUTUS,"My gown."
IV,III,BRUTUS,"Farewell, good Messala:"
IV,III,BRUTUS,"Good night, Titinius. Noble, noble Cassius,"
IV,III,BRUTUS,"Good night, and good repose."
IV,III,CASSIUS,"O my dear brother!"
IV,III,CASSIUS,"This was an ill beginning of the night:"
IV,III,CASSIUS,"Never come such division 'tween our souls!"
IV,III,CASSIUS,"Let it not, Brutus."
IV,III,BRUTUS,"Every thing is well."
IV,III,CASSIUS,"Good night, my lord."
IV,III,BRUTUS,"Good night, good brother."
IV,III,TITINIUS,"Good night, Lord Brutus."
IV,III,BRUTUS,"Farewell, every one."
IV,III,BRUTUS,"Give me the gown. Where is thy instrument?"
IV,III,LUCIUS,"Here in the tent."
IV,III,BRUTUS,"What, thou speak'st drowsily?"
IV,III,BRUTUS,"Poor knave, I blame thee not; thou art o'er-watch'd."
IV,III,BRUTUS,"Call Claudius and some other of my men:"
IV,III,BRUTUS,"I'll have them sleep on cushions in my tent."
IV,III,LUCIUS,"Varro and Claudius!"
IV,III,VARRO,"Calls my lord?"
IV,III,BRUTUS,"I pray you, sirs, lie in my tent and sleep;"
IV,III,BRUTUS,"It may be I shall raise you by and by"
IV,III,BRUTUS,"On business to my brother Cassius."
IV,III,VARRO,"So please you, we will stand and watch your pleasure."
IV,III,BRUTUS,"I will not have it so: lie down, good sirs;"
IV,III,BRUTUS,"It may be I shall otherwise bethink me."
IV,III,BRUTUS,"Look, Lucius, here's the book I sought for so;"
IV,III,BRUTUS,"I put it in the pocket of my gown."
IV,III,LUCIUS,"I was sure your lordship did not give it me."
IV,III,BRUTUS,"Bear with me, good boy, I am much forgetful."
IV,III,BRUTUS,"Canst thou hold up thy heavy eyes awhile,"
IV,III,BRUTUS,"And touch thy instrument a strain or two?"
IV,III,LUCIUS,"Ay, my lord, an't please you."
IV,III,BRUTUS,"It does, my boy:"
IV,III,BRUTUS,"I trouble thee too much, but thou art willing."
IV,III,LUCIUS,"It is my duty, sir."
IV,III,BRUTUS,"I should not urge thy duty past thy might;"
IV,III,BRUTUS,"I know young bloods look for a time of rest."
IV,III,LUCIUS,"I have slept, my lord, already."
IV,III,BRUTUS,"It was well done; and thou shalt sleep again;"
IV,III,BRUTUS,"I will not hold thee long: if I do live,"
IV,III,BRUTUS,"I will be good to thee."
IV,III,BRUTUS,"This is a sleepy tune. O murderous slumber,"
IV,III,BRUTUS,"Lay'st thou thy leaden mace upon my boy,"
IV,III,BRUTUS,"That plays thee music? Gentle knave, good night;"
IV,III,BRUTUS,"I will not do thee so much wrong to wake thee:"
IV,III,BRUTUS,"If thou dost nod, thou break'st thy instrument;"
IV,III,BRUTUS,"I'll take it from thee; and, good boy, good night."
IV,III,BRUTUS,"Let me see, let me see; is not the leaf turn'd down"
IV,III,BRUTUS,"Where I left reading? Here it is, I think."
IV,III,BRUTUS,"How ill this taper burns! Ha! who comes here?"
IV,III,BRUTUS,"I think it is the weakness of mine eyes"
IV,III,BRUTUS,"That shapes this monstrous apparition."
IV,III,BRUTUS,"It comes upon me. Art thou any thing?"
IV,III,BRUTUS,"Art thou some god, some angel, or some devil,"
IV,III,BRUTUS,"That makest my blood cold and my hair to stare?"
IV,III,BRUTUS,"Speak to me what thou art."
IV,III,GHOST,"Thy evil spirit, Brutus."
IV,III,BRUTUS,"Why comest thou?"
IV,III,GHOST,"To tell thee thou shalt see me at Philippi."
IV,III,BRUTUS,"Well; then I shall see thee again?"
IV,III,GHOST,"Ay, at Philippi."
IV,III,BRUTUS,"Why, I will see thee at Philippi, then."
IV,III,BRUTUS,"Now I have taken heart thou vanishest:"
IV,III,BRUTUS,"Ill spirit, I would hold more talk with thee."
IV,III,BRUTUS,"Boy, Lucius! Varro! Claudius! Sirs, awake! Claudius!"
IV,III,LUCIUS,"The strings, my lord, are false."
IV,III,BRUTUS,"He thinks he still is at his instrument."
IV,III,BRUTUS,"Lucius, awake!"
IV,III,LUCIUS,"My lord?"
IV,III,BRUTUS,"Didst thou dream, Lucius, that thou so criedst out?"
IV,III,LUCIUS,"My lord, I do not know that I did cry."
IV,III,BRUTUS,"Yes, that thou didst: didst thou see any thing?"
IV,III,LUCIUS,"Nothing, my lord."
IV,III,BRUTUS,"Sleep again, Lucius. Sirrah Claudius!"
IV,III,BRUTUS,"Fellow thou, awake!"
IV,III,VARRO,"My lord?"
IV,III,CLAUDIUS,"My lord?"
IV,III,BRUTUS,"Why did you so cry out, sirs, in your sleep?"
IV,III,VARRO,"Did we, my lord?"
IV,III,BRUTUS,"Ay: saw you any thing?"
IV,III,VARRO,"No, my lord, I saw nothing."
IV,III,CLAUDIUS,"Nor I, my lord."
IV,III,BRUTUS,"Go and commend me to my brother Cassius;"
IV,III,BRUTUS,"Bid him set on his powers betimes before,"
IV,III,BRUTUS,"And we will follow."
IV,III,VARRO,"It shall be done, my lord."
V,I,OCTAVIUS,"Now, Antony, our hopes are answered:"
V,I,OCTAVIUS,"You said the enemy would not come down,"
V,I,OCTAVIUS,"But keep the hills and upper regions;"
V,I,OCTAVIUS,"It proves not so: their battles are at hand;"
V,I,OCTAVIUS,"They mean to warn us at Philippi here,"
V,I,OCTAVIUS,"Answering before we do demand of them."
V,I,ANTONY,"Tut, I am in their bosoms, and I know"
V,I,ANTONY,"Wherefore they do it: they could be content"
V,I,ANTONY,"To visit other places; and come down"
V,I,ANTONY,"With fearful bravery, thinking by this face"
V,I,ANTONY,"To fasten in our thoughts that they have courage;"
V,I,ANTONY,"But 'tis not so."
V,I,Messenger,"Prepare you, generals:"
V,I,Messenger,"The enemy comes on in gallant show;"
V,I,Messenger,"Their bloody sign of battle is hung out,"
V,I,Messenger,"And something to be done immediately."
V,I,ANTONY,"Octavius, lead your battle softly on,"
V,I,ANTONY,"Upon the left hand of the even field."
V,I,OCTAVIUS,"Upon the right hand I; keep thou the left."
V,I,ANTONY,"Why do you cross me in this exigent?"
V,I,OCTAVIUS,"I do not cross you; but I will do so."
V,I,BRUTUS,"They stand, and would have parley."
V,I,CASSIUS,"Stand fast, Titinius: we must out and talk."
V,I,OCTAVIUS,"Mark Antony, shall we give sign of battle?"
V,I,ANTONY,"No, Caesar, we will answer on their charge."
V,I,ANTONY,"Make forth; the generals would have some words."
V,I,OCTAVIUS,"Stir not until the signal."
V,I,BRUTUS,"Words before blows: is it so, countrymen?"
V,I,OCTAVIUS,"Not that we love words better, as you do."
V,I,BRUTUS,"Good words are better than bad strokes, Octavius."
V,I,ANTONY,"In your bad strokes, Brutus, you give good words:"
V,I,ANTONY,"Witness the hole you made in Caesar's heart,"
V,I,ANTONY,"Crying 'Long live! hail, Caesar!'"
V,I,CASSIUS,"Antony,"
V,I,CASSIUS,"The posture of your blows are yet unknown;"
V,I,CASSIUS,"But for your words, they rob the Hybla bees,"
V,I,CASSIUS,"And leave them honeyless."
V,I,ANTONY,"Not stingless too."
V,I,BRUTUS,"O, yes, and soundless too;"
V,I,BRUTUS,"For you have stol'n their buzzing, Antony,"
V,I,BRUTUS,"And very wisely threat before you sting."
V,I,ANTONY,"Villains, you did not so, when your vile daggers"
V,I,ANTONY,"Hack'd one another in the sides of Caesar:"
V,I,ANTONY,"You show'd your teeth like apes, and fawn'd like hounds,"
V,I,ANTONY,"And bow'd like bondmen, kissing Caesar's feet;"
V,I,ANTONY,"Whilst damned Casca, like a cur, behind"
V,I,ANTONY,"Struck Caesar on the neck. O you flatterers!"
V,I,CASSIUS,"Flatterers! Now, Brutus, thank yourself:"
V,I,CASSIUS,"This tongue had not offended so to-day,"
V,I,CASSIUS,"If Cassius might have ruled."
V,I,OCTAVIUS,"Come, come, the cause: if arguing make us sweat,"
V,I,OCTAVIUS,"The proof of it will turn to redder drops. Look;"
V,I,OCTAVIUS,"I draw a sword against conspirators;"
V,I,OCTAVIUS,"When think you that the sword goes up again?"
V,I,OCTAVIUS,"Never, till Caesar's three and thirty wounds"
V,I,OCTAVIUS,"Be well avenged; or till another Caesar"
V,I,OCTAVIUS,"Have added slaughter to the sword of traitors."
V,I,BRUTUS,"Caesar, thou canst not die by traitors' hands,"
V,I,BRUTUS,"Unless thou bring'st them with thee."
V,I,OCTAVIUS,"So I hope;"
V,I,OCTAVIUS,"I was not born to die on Brutus' sword."
V,I,BRUTUS,"O, if thou wert the noblest of thy strain,"
V,I,BRUTUS,"Young man, thou couldst not die more honourable."
V,I,CASSIUS,"A peevish schoolboy, worthless of such honour,"
V,I,CASSIUS,"Join'd with a masker and a reveller!"
V,I,ANTONY,"Old Cassius still!"
V,I,OCTAVIUS,"Come, Antony, away!"
V,I,OCTAVIUS,"Defiance, traitors, hurl we in your teeth:"
V,I,OCTAVIUS,"If you dare fight to-day, come to the field;"
V,I,OCTAVIUS,"If not, when you have stomachs."
V,I,CASSIUS,"Why, now, blow wind, swell billow and swim bark!"
V,I,CASSIUS,"The storm is up, and all is on the hazard."
V,I,BRUTUS,"Ho, Lucilius! hark, a word with you."
V,I,CASSIUS,"Messala!"
V,I,CASSIUS,"Messala,"
V,I,CASSIUS,"This is my birth-day; as this very day"
V,I,CASSIUS,"Was Cassius born. Give me thy hand, Messala:"
V,I,CASSIUS,"Be thou my witness that against my will,"
V,I,CASSIUS,"As Pompey was, am I compell'd to set"
V,I,CASSIUS,"Upon one battle all our liberties."
V,I,CASSIUS,"You know that I held Epicurus strong"
V,I,CASSIUS,"And his opinion: now I change my mind,"
V,I,CASSIUS,"And partly credit things that do presage."
V,I,CASSIUS,"Coming from Sardis, on our former ensign"
V,I,CASSIUS,"Two mighty eagles fell, and there they perch'd,"
V,I,CASSIUS,"Gorging and feeding from our soldiers' hands;"
V,I,CASSIUS,"Who to Philippi here consorted us:"
V,I,CASSIUS,"This morning are they fled away and gone;"
V,I,CASSIUS,"And in their steads do ravens, crows and kites,"
V,I,CASSIUS,"Fly o'er our heads and downward look on us,"
V,I,CASSIUS,"As we were sickly prey: their shadows seem"
V,I,CASSIUS,"A canopy most fatal, under which"
V,I,CASSIUS,"Our army lies, ready to give up the ghost."
V,I,MESSALA,"Believe not so."
V,I,CASSIUS,"I but believe it partly;"
V,I,CASSIUS,"For I am fresh of spirit and resolved"
V,I,CASSIUS,"To meet all perils very constantly."
V,I,BRUTUS,"Even so, Lucilius."
V,I,CASSIUS,"Now, most noble Brutus,"
V,I,CASSIUS,"The gods to-day stand friendly, that we may,"
V,I,CASSIUS,"Lovers in peace, lead on our days to age!"
V,I,CASSIUS,"But since the affairs of men rest still incertain,"
V,I,CASSIUS,"Let's reason with the worst that may befall."
V,I,CASSIUS,"If we do lose this battle, then is this"
V,I,CASSIUS,"The very last time we shall speak together:"
V,I,CASSIUS,"What are you then determined to do?"
V,I,BRUTUS,"Even by the rule of that philosophy"
V,I,BRUTUS,"By which I did blame Cato for the death"
V,I,BRUTUS,"Which he did give himself, I know not how,"
V,I,BRUTUS,"But I do find it cowardly and vile,"
V,I,BRUTUS,"For fear of what might fall, so to prevent"
V,I,BRUTUS,"The time of life: arming myself with patience"
V,I,BRUTUS,"To stay the providence of some high powers"
V,I,BRUTUS,"That govern us below."
V,I,CASSIUS,"Then, if we lose this battle,"
V,I,CASSIUS,"You are contented to be led in triumph"
V,I,CASSIUS,"Thorough the streets of Rome?"
V,I,BRUTUS,"No, Cassius, no: think not, thou noble Roman,"
V,I,BRUTUS,"That ever Brutus will go bound to Rome;"
V,I,BRUTUS,"He bears too great a mind. But this same day"
V,I,BRUTUS,"Must end that work the ides of March begun;"
V,I,BRUTUS,"And whether we shall meet again I know not."
V,I,BRUTUS,"Therefore our everlasting farewell take:"
V,I,BRUTUS,"For ever, and for ever, farewell, Cassius!"
V,I,BRUTUS,"If we do meet again, why, we shall smile;"
V,I,BRUTUS,"If not, why then, this parting was well made."
V,I,CASSIUS,"For ever, and for ever, farewell, Brutus!"
V,I,CASSIUS,"If we do meet again, we'll smile indeed;"
V,I,CASSIUS,"If not, 'tis true this parting was well made."
V,I,BRUTUS,"Why, then, lead on. O, that a man might know"
V,I,BRUTUS,"The end of this day's business ere it come!"
V,I,BRUTUS,"But it sufficeth that the day will end,"
V,I,BRUTUS,"And then the end is known. Come, ho! away!"
V,II,BRUTUS,"Ride, ride, Messala, ride, and give these bills"
V,II,BRUTUS,"Unto the legions on the other side."
V,II,BRUTUS,"Let them set on at once; for I perceive"
V,II,BRUTUS,"But cold demeanor in Octavius' wing,"
V,II,BRUTUS,"And sudden push gives them the overthrow."
V,II,BRUTUS,"Ride, ride, Messala: let them all come down."
V,III,CASSIUS,"O, look, Titinius, look, the villains fly!"
V,III,CASSIUS,"Myself have to mine own turn'd enemy:"
V,III,CASSIUS,"This ensign here of mine was turning back;"
V,III,CASSIUS,"I slew the coward, and did take it from him."
V,III,TITINIUS,"O Cassius, Brutus gave the word too early;"
V,III,TITINIUS,"Who, having some advantage on Octavius,"
V,III,TITINIUS,"Took it too eagerly: his soldiers fell to spoil,"
V,III,TITINIUS,"Whilst we by Antony are all enclosed."
V,III,PINDARUS,"Fly further off, my lord, fly further off;"
V,III,PINDARUS,"Mark Antony is in your tents, my lord"
V,III,PINDARUS,"Fly, therefore, noble Cassius, fly far off."
V,III,CASSIUS,"This hill is far enough. Look, look, Titinius;"
V,III,CASSIUS,"Are those my tents where I perceive the fire?"
V,III,TITINIUS,"They are, my lord."
V,III,CASSIUS,"Titinius, if thou lovest me,"
V,III,CASSIUS,"Mount thou my horse, and hide thy spurs in him,"
V,III,CASSIUS,"Till he have brought thee up to yonder troops,"
V,III,CASSIUS,"And here again; that I may rest assured"
V,III,CASSIUS,"Whether yond troops are friend or enemy."
V,III,TITINIUS,"I will be here again, even with a thought."
