IV,II,GONERIL,"I must change arms at home, and give the distaff"
IV,II,GONERIL,"Into my husband's hands. This trusty servant"
IV,II,GONERIL,"Shall pass between us: ere long you are like to hear,"
IV,II,GONERIL,"If you dare venture in your own behalf,"
IV,II,GONERIL,"A mistress's command. Wear this; spare speech;"
IV,II,GONERIL,"Decline your head: this kiss, if it durst speak,"
IV,II,GONERIL,"Would stretch thy spirits up into the air:"
IV,II,GONERIL,"Conceive, and fare thee well."
IV,II,EDMUND,"Yours in the ranks of death."
IV,II,GONERIL,"My most dear Gloucester!"
IV,II,GONERIL,"O, the difference of man and man!"
IV,II,GONERIL,"To thee a woman's services are due:"
IV,II,GONERIL,"My fool usurps my body."
IV,II,OSWALD,"Madam, here comes my lord."
IV,II,GONERIL,"I have been worth the whistle."
IV,II,ALBANY,"O Goneril!"
IV,II,ALBANY,"You are not worth the dust which the rude wind"
IV,II,ALBANY,"Blows in your face. I fear your disposition:"
IV,II,ALBANY,"That nature, which contemns its origin,"
IV,II,ALBANY,"Cannot be border'd certain in itself;"
IV,II,ALBANY,"She that herself will sliver and disbranch"
IV,II,ALBANY,"From her material sap, perforce must wither"
IV,II,ALBANY,"And come to deadly use."
IV,II,GONERIL,"No more; the text is foolish."
IV,II,ALBANY,"Wisdom and goodness to the vile seem vile:"
IV,II,ALBANY,"Filths savour but themselves. What have you done?"
IV,II,ALBANY,"Tigers, not daughters, what have you perform'd?"
IV,II,ALBANY,"A father, and a gracious aged man,"
IV,II,ALBANY,"Whose reverence even the head-lugg'd bear would lick,"
IV,II,ALBANY,"Most barbarous, most degenerate! have you madded."
IV,II,ALBANY,"Could my good brother suffer you to do it?"
IV,II,ALBANY,"A man, a prince, by him so benefited!"
IV,II,ALBANY,"If that the heavens do not their visible spirits"
IV,II,ALBANY,"Send quickly down to tame these vile offences,"
IV,II,ALBANY,"It will come,"
IV,II,ALBANY,"Humanity must perforce prey on itself,"
IV,II,ALBANY,"Like monsters of the deep."
IV,II,GONERIL,"Milk-liver'd man!"
IV,II,GONERIL,"That bear'st a cheek for blows, a head for wrongs;"
IV,II,GONERIL,"Who hast not in thy brows an eye discerning"
IV,II,GONERIL,"Thine honour from thy suffering; that not know'st"
IV,II,GONERIL,"Fools do those villains pity who are punish'd"
IV,II,GONERIL,"Ere they have done their mischief. Where's thy drum?"
IV,II,GONERIL,"France spreads his banners in our noiseless land;"
IV,II,GONERIL,"With plumed helm thy slayer begins threats;"
IV,II,GONERIL,"Whiles thou, a moral fool, sit'st still, and criest"
IV,II,GONERIL,"'Alack, why does he so?'"
IV,II,ALBANY,"See thyself, devil!"
IV,II,ALBANY,"Proper deformity seems not in the fiend"
IV,II,ALBANY,"So horrid as in woman."
IV,II,GONERIL,"O vain fool!"
IV,II,ALBANY,"Thou changed and self-cover'd thing, for shame,"
IV,II,ALBANY,"Be-monster not thy feature. Were't my fitness"
IV,II,ALBANY,"To let these hands obey my blood,"
IV,II,ALBANY,"They are apt enough to dislocate and tear"
IV,II,ALBANY,"Thy flesh and bones: howe'er thou art a fiend,"
IV,II,ALBANY,"A woman's shape doth shield thee."
IV,II,GONERIL,"Marry, your manhood now--"
IV,II,ALBANY,"What news?"
IV,II,Messenger,"O, my good lord, the Duke of Cornwall's dead:"
IV,II,Messenger,"Slain by his servant, going to put out"
IV,II,Messenger,"The other eye of Gloucester."
IV,II,ALBANY,"Gloucester's eye!"
IV,II,Messenger,"A servant that he bred, thrill'd with remorse,"
IV,II,Messenger,"Opposed against the act, bending his sword"
IV,II,Messenger,"To his great master; who, thereat enraged,"
IV,II,Messenger,"Flew on him, and amongst them fell'd him dead;"
IV,II,Messenger,"But not without that harmful stroke, which since"
IV,II,Messenger,"Hath pluck'd him after."
IV,II,ALBANY,"This shows you are above,"
IV,II,ALBANY,"You justicers, that these our nether crimes"
IV,II,ALBANY,"So speedily can venge! But, O poor Gloucester!"
IV,II,ALBANY,"Lost he his other eye?"
IV,II,Messenger,"Both, both, my lord."
IV,II,Messenger,"This letter, madam, craves a speedy answer;"
IV,II,Messenger,"'Tis from your sister."
IV,II,GONERIL,"But being widow, and my Gloucester with her,"
IV,II,GONERIL,"May all the building in my fancy pluck"
IV,II,GONERIL,"Upon my hateful life: another way,"
IV,II,GONERIL,"The news is not so tart.--I'll read, and answer."
IV,II,ALBANY,"Where was his son when they did take his eyes?"
IV,II,Messenger,"Come with my lady hither."
IV,II,ALBANY,"He is not here."
IV,II,Messenger,"No, my good lord; I met him back again."
IV,II,ALBANY,"Knows he the wickedness?"
IV,II,Messenger,"Ay, my good lord; 'twas he inform'd against him;"
IV,II,Messenger,"And quit the house on purpose, that their punishment"
IV,II,Messenger,"Might have the freer course."
IV,II,ALBANY,"Gloucester, I live"
IV,II,ALBANY,"To thank thee for the love thou show'dst the king,"
IV,II,ALBANY,"And to revenge thine eyes. Come hither, friend:"
IV,II,ALBANY,"Tell me what more thou know'st."
IV,III,KENT,"Why the King of France is so suddenly gone back"
IV,III,KENT,"know you the reason?"
IV,III,Gentleman,"Something he left imperfect in the"
IV,III,Gentleman,"state, which since his coming forth is thought"
IV,III,Gentleman,"of; which imports to the kingdom so much"
IV,III,Gentleman,"fear and danger, that his personal return was"
IV,III,Gentleman,"most required and necessary."
IV,III,KENT,"Who hath he left behind him general?"
IV,III,Gentleman,"The Marshal of France, Monsieur La Far."
IV,III,KENT,"Did your letters pierce the queen to any"
IV,III,KENT,"demonstration of grief?"
IV,III,Gentleman,"Ay, sir; she took them, read them in my presence;"
IV,III,Gentleman,"And now and then an ample tear trill'd down"
IV,III,Gentleman,"Her delicate cheek: it seem'd she was a queen"
IV,III,Gentleman,"Over her passion; who, most rebel-like,"
IV,III,Gentleman,"Sought to be king o'er her."
IV,III,KENT,"O, then it moved her."
IV,III,Gentleman,"Not to a rage: patience and sorrow strove"
IV,III,Gentleman,"Who should express her goodliest. You have seen"
IV,III,Gentleman,"Sunshine and rain at once: her smiles and tears"
IV,III,Gentleman,"Were like a better way: those happy smilets,"
IV,III,Gentleman,"That play'd on her ripe lip, seem'd not to know"
IV,III,Gentleman,"What guests were in her eyes; which parted thence,"
IV,III,Gentleman,"As pearls from diamonds dropp'd. In brief,"
IV,III,Gentleman,"Sorrow would be a rarity most beloved,"
IV,III,Gentleman,"If all could so become it."
IV,III,KENT,"Made she no verbal question?"
IV,III,Gentleman,"'Faith, once or twice she heaved the name of 'father'"
IV,III,Gentleman,"Pantingly forth, as if it press'd her heart:"
IV,III,Gentleman,"Cried 'Sisters! sisters! Shame of ladies! sisters!"
IV,III,Gentleman,"Kent! father! sisters! What, i' the storm? i' the night?"
IV,III,Gentleman,"Let pity not be believed!' There she shook"
IV,III,Gentleman,"The holy water from her heavenly eyes,"
IV,III,Gentleman,"And clamour moisten'd: then away she started"
IV,III,Gentleman,"To deal with grief alone."
IV,III,KENT,"It is the stars,"
IV,III,KENT,"The stars above us, govern our conditions;"
IV,III,KENT,"Else one self mate and mate could not beget"
IV,III,KENT,"Such different issues. You spoke not with her since?"
IV,III,Gentleman,"No."
IV,III,KENT,"Was this before the king return'd?"
IV,III,Gentleman,"No, since."
IV,III,KENT,"Well, sir, the poor distressed Lear's i' the town;"
IV,III,KENT,"Who sometime, in his better tune, remembers"
IV,III,KENT,"What we are come about, and by no means"
IV,III,KENT,"Will yield to see his daughter."
IV,III,Gentleman,"Why, good sir?"
IV,III,KENT,"A sovereign shame so elbows him: his own unkindness,"
IV,III,KENT,"That stripp'd her from his benediction, turn'd her"
IV,III,KENT,"To foreign casualties, gave her dear rights"
IV,III,KENT,"To his dog-hearted daughters, these things sting"
IV,III,KENT,"His mind so venomously, that burning shame"
IV,III,KENT,"Detains him from Cordelia."
IV,III,Gentleman,"Alack, poor gentleman!"
IV,III,KENT,"Of Albany's and Cornwall's powers you heard not?"
IV,III,Gentleman,"'Tis so, they are afoot."
IV,III,KENT,"Well, sir, I'll bring you to our master Lear,"
IV,III,KENT,"And leave you to attend him: some dear cause"
IV,III,KENT,"Will in concealment wrap me up awhile;"
IV,III,KENT,"When I am known aright, you shall not grieve"
IV,III,KENT,"Lending me this acquaintance. I pray you, go"
IV,III,KENT,"Along with me."
IV,IV,CORDELIA,"Alack, 'tis he: why, he was met even now"
IV,IV,CORDELIA,"As mad as the vex'd sea; singing aloud;"
IV,IV,CORDELIA,"Crown'd with rank fumiter and furrow-weeds,"
IV,IV,CORDELIA,"With bur-docks, hemlock, nettles, cuckoo-flowers,"
IV,IV,CORDELIA,"Darnel, and all the idle weeds that grow"
IV,IV,CORDELIA,"In our sustaining corn. A century send forth;"
IV,IV,CORDELIA,"Search every acre in the high-grown field,"
IV,IV,CORDELIA,"And bring him to our eye."
IV,IV,CORDELIA,"What can man's wisdom"
IV,IV,CORDELIA,"In the restoring his bereaved sense?"
IV,IV,CORDELIA,"He that helps him take all my outward worth."
IV,IV,Doctor,"There is means, madam:"
IV,IV,Doctor,"Our foster-nurse of nature is repose,"
IV,IV,Doctor,"The which he lacks; that to provoke in him,"
IV,IV,Doctor,"Are many simples operative, whose power"
IV,IV,Doctor,"Will close the eye of anguish."
IV,IV,CORDELIA,"All blest secrets,"
IV,IV,CORDELIA,"All you unpublish'd virtues of the earth,"
IV,IV,CORDELIA,"Spring with my tears! be aidant and remediate"
IV,IV,CORDELIA,"In the good man's distress! Seek, seek for him;"
IV,IV,CORDELIA,"Lest his ungovern'd rage dissolve the life"
IV,IV,CORDELIA,"That wants the means to lead it."
IV,IV,Messenger,"News, madam;"
IV,IV,Messenger,"The British powers are marching hitherward."
IV,IV,CORDELIA,"'Tis known before; our preparation stands"
IV,IV,CORDELIA,"In expectation of them. O dear father,"
IV,IV,CORDELIA,"It is thy business that I go about;"
IV,IV,CORDELIA,"Therefore great France"
IV,IV,CORDELIA,"My mourning and important tears hath pitied."
IV,IV,CORDELIA,"No blown ambition doth our arms incite,"
IV,IV,CORDELIA,"But love, dear love, and our aged father's right:"
IV,IV,CORDELIA,"Soon may I hear and see him!"
IV,V,REGAN,"But are my brother's powers set forth?"
IV,V,OSWALD,"Ay, madam."
IV,V,REGAN,"Himself in person there?"
IV,V,OSWALD,"Madam, with much ado:"
IV,V,OSWALD,"Your sister is the better soldier."
IV,V,REGAN,"Lord Edmund spake not with your lord at home?"
IV,V,OSWALD,"No, madam."
IV,V,REGAN,"What might import my sister's letter to him?"
IV,V,OSWALD,"I know not, lady."
IV,V,REGAN,"'Faith, he is posted hence on serious matter."
IV,V,REGAN,"It was great ignorance, Gloucester's eyes being out,"
IV,V,REGAN,"To let him live: where he arrives he moves"
IV,V,REGAN,"All hearts against us: Edmund, I think, is gone,"
IV,V,REGAN,"In pity of his misery, to dispatch"
IV,V,REGAN,"His nighted life: moreover, to descry"
IV,V,REGAN,"The strength o' the enemy."
IV,V,OSWALD,"I must needs after him, madam, with my letter."
IV,V,REGAN,"Our troops set forth to-morrow: stay with us;"
IV,V,REGAN,"The ways are dangerous."
IV,V,OSWALD,"I may not, madam:"
IV,V,OSWALD,"My lady charged my duty in this business."
IV,V,REGAN,"Why should she write to Edmund? Might not you"
IV,V,REGAN,"Transport her purposes by word? Belike,"
IV,V,REGAN,"Something--I know not what: I'll love thee much,"
IV,V,REGAN,"Let me unseal the letter."
IV,V,OSWALD,"Madam, I had rather--"
IV,V,REGAN,"I know your lady does not love her husband;"
IV,V,REGAN,"I am sure of that: and at her late being here"
IV,V,REGAN,"She gave strange oeillades and most speaking looks"
IV,V,REGAN,"To noble Edmund. I know you are of her bosom."
IV,V,OSWALD,"I, madam?"
IV,V,REGAN,"I speak in understanding; you are; I know't:"
IV,V,REGAN,"Therefore I do advise you, take this note:"
IV,V,REGAN,"My lord is dead; Edmund and I have talk'd;"
IV,V,REGAN,"And more convenient is he for my hand"
IV,V,REGAN,"Than for your lady's: you may gather more."
IV,V,REGAN,"If you do find him, pray you, give him this;"
IV,V,REGAN,"And when your mistress hears thus much from you,"
IV,V,REGAN,"I pray, desire her call her wisdom to her."
IV,V,REGAN,"So, fare you well."
IV,V,REGAN,"If you do chance to hear of that blind traitor,"
IV,V,REGAN,"Preferment falls on him that cuts him off."
IV,V,OSWALD,"Would I could meet him, madam! I should show"
IV,V,OSWALD,"What party I do follow."
IV,V,REGAN,"Fare thee well."
IV,VI,GLOUCESTER,"When shall we come to the top of that same hill?"
IV,VI,EDGAR,"You do climb up it now: look, how we labour."
IV,VI,GLOUCESTER,"Methinks the ground is even."
IV,VI,EDGAR,"Horrible steep."
IV,VI,EDGAR,"Hark, do you hear the sea?"
IV,VI,GLOUCESTER,"No, truly."
IV,VI,EDGAR,"Why, then, your other senses grow imperfect"
IV,VI,EDGAR,"By your eyes' anguish."
IV,VI,GLOUCESTER,"So may it be, indeed:"
IV,VI,GLOUCESTER,"Methinks thy voice is alter'd; and thou speak'st"
IV,VI,GLOUCESTER,"In better phrase and matter than thou didst."
IV,VI,EDGAR,"You're much deceived: in nothing am I changed"
IV,VI,EDGAR,"But in my garments."
IV,VI,GLOUCESTER,"Methinks you're better spoken."
IV,VI,EDGAR,"Come on, sir; here's the place: stand still. How fearful"
IV,VI,EDGAR,"And dizzy 'tis, to cast one's eyes so low!"
IV,VI,EDGAR,"The crows and choughs that wing the midway air"
IV,VI,EDGAR,"Show scarce so gross as beetles: half way down"
IV,VI,EDGAR,"Hangs one that gathers samphire, dreadful trade!"
IV,VI,EDGAR,"Methinks he seems no bigger than his head:"
IV,VI,EDGAR,"The fishermen, that walk upon the beach,"
IV,VI,EDGAR,"Appear like mice; and yond tall anchoring bark,"
IV,VI,EDGAR,"Diminish'd to her cock; her cock, a buoy"
IV,VI,EDGAR,"Almost too small for sight: the murmuring surge,"
IV,VI,EDGAR,"That on the unnumber'd idle pebbles chafes,"
IV,VI,EDGAR,"Cannot be heard so high. I'll look no more;"
IV,VI,EDGAR,"Lest my brain turn, and the deficient sight"
IV,VI,EDGAR,"Topple down headlong."
IV,VI,GLOUCESTER,"Set me where you stand."
IV,VI,EDGAR,"Give me your hand: you are now within a foot"
IV,VI,EDGAR,"Of the extreme verge: for all beneath the moon"
IV,VI,EDGAR,"Would I not leap upright."
IV,VI,GLOUCESTER,"Let go my hand."
IV,VI,GLOUCESTER,"Here, friend, 's another purse; in it a jewel"
IV,VI,GLOUCESTER,"Well worth a poor man's taking: fairies and gods"
IV,VI,GLOUCESTER,"Prosper it with thee! Go thou farther off;"
IV,VI,GLOUCESTER,"Bid me farewell, and let me hear thee going."
IV,VI,EDGAR,"Now fare you well, good sir."
IV,VI,GLOUCESTER,"With all my heart."
IV,VI,EDGAR,"Why I do trifle thus with his despair"
IV,VI,EDGAR,"Is done to cure it."
IV,VI,GLOUCESTER,"This world I do renounce, and, in your sights,"
IV,VI,GLOUCESTER,"Shake patiently my great affliction off:"
IV,VI,GLOUCESTER,"If I could bear it longer, and not fall"
IV,VI,GLOUCESTER,"To quarrel with your great opposeless wills,"
IV,VI,GLOUCESTER,"My snuff and loathed part of nature should"
IV,VI,GLOUCESTER,"Burn itself out. If Edgar live, O, bless him!"
IV,VI,GLOUCESTER,"Now, fellow, fare thee well."
IV,VI,EDGAR,"Gone, sir: farewell."
IV,VI,EDGAR,"And yet I know not how conceit may rob"
IV,VI,EDGAR,"The treasury of life, when life itself"
IV,VI,EDGAR,"Yields to the theft: had he been where he thought,"
IV,VI,EDGAR,"By this, had thought been past. Alive or dead?"
IV,VI,EDGAR,"Ho, you sir! friend! Hear you, sir! speak!"
IV,VI,EDGAR,"Thus might he pass indeed: yet he revives."
IV,VI,EDGAR,"What are you, sir?"
IV,VI,GLOUCESTER,"Away, and let me die."
IV,VI,EDGAR,"Hadst thou been aught but gossamer, feathers, air,"
IV,VI,EDGAR,"So many fathom down precipitating,"
IV,VI,EDGAR,"Thou'dst shiver'd like an egg: but thou dost breathe;"
IV,VI,EDGAR,"Hast heavy substance; bleed'st not; speak'st; art sound."
IV,VI,EDGAR,"Ten masts at each make not the altitude"
IV,VI,EDGAR,"Which thou hast perpendicularly fell:"
IV,VI,EDGAR,"Thy life's a miracle. Speak yet again."
IV,VI,GLOUCESTER,"But have I fall'n, or no?"
IV,VI,EDGAR,"From the dread summit of this chalky bourn."
IV,VI,EDGAR,"Look up a-height; the shrill-gorged lark so far"
IV,VI,EDGAR,"Cannot be seen or heard: do but look up."
IV,VI,GLOUCESTER,"Alack, I have no eyes."
IV,VI,GLOUCESTER,"Is wretchedness deprived that benefit,"
IV,VI,GLOUCESTER,"To end itself by death? 'Twas yet some comfort,"
IV,VI,GLOUCESTER,"When misery could beguile the tyrant's rage,"
IV,VI,GLOUCESTER,"And frustrate his proud will."
IV,VI,EDGAR,"Give me your arm:"
IV,VI,EDGAR,"Up: so. How is 't? Feel you your legs? You stand."
IV,VI,GLOUCESTER,"Too well, too well."
IV,VI,EDGAR,"This is above all strangeness."
IV,VI,EDGAR,"Upon the crown o' the cliff, what thing was that"
IV,VI,EDGAR,"Which parted from you?"
IV,VI,GLOUCESTER,"A poor unfortunate beggar."
IV,VI,EDGAR,"As I stood here below, methought his eyes"
IV,VI,EDGAR,"Were two full moons; he had a thousand noses,"
IV,VI,EDGAR,"Horns whelk'd and waved like the enridged sea:"
IV,VI,EDGAR,"It was some fiend; therefore, thou happy father,"
IV,VI,EDGAR,"Think that the clearest gods, who make them honours"
IV,VI,EDGAR,"Of men's impossibilities, have preserved thee."
IV,VI,GLOUCESTER,"I do remember now: henceforth I'll bear"
IV,VI,GLOUCESTER,"Affliction till it do cry out itself"
IV,VI,GLOUCESTER,"'Enough, enough,' and die. That thing you speak of,"
IV,VI,GLOUCESTER,"I took it for a man; often 'twould say"
IV,VI,GLOUCESTER,"'The fiend, the fiend:' he led me to that place."
IV,VI,EDGAR,"Bear free and patient thoughts. But who comes here?"
IV,VI,EDGAR,"The safer sense will ne'er accommodate"
IV,VI,EDGAR,"His master thus."
IV,VI,KING LEAR,"No, they cannot touch me for coining; I am the"
IV,VI,KING LEAR,"king himself."
IV,VI,EDGAR,"O thou side-piercing sight!"
IV,VI,KING LEAR,"Nature's above art in that respect. There's your"
IV,VI,KING LEAR,"press-money. That fellow handles his bow like a"
IV,VI,KING LEAR,"crow-keeper: draw me a clothier's yard. Look,"
IV,VI,KING LEAR,"look, a mouse! Peace, peace; this piece of toasted"
IV,VI,KING LEAR,"cheese will do 't. There's my gauntlet; I'll prove"
IV,VI,KING LEAR,"it on a giant. Bring up the brown bills. O, well"
IV,VI,KING LEAR,"flown, bird! i' the clout, i' the clout: hewgh!"
IV,VI,KING LEAR,"Give the word."
IV,VI,EDGAR,"Sweet marjoram."
IV,VI,KING LEAR,"Pass."
IV,VI,GLOUCESTER,"I know that voice."
IV,VI,KING LEAR,"Ha! Goneril, with a white beard! They flattered"
IV,VI,KING LEAR,"me like a dog; and told me I had white hairs in my"
IV,VI,KING LEAR,"beard ere the black ones were there. To say 'ay'"
IV,VI,KING LEAR,"and 'no' to every thing that I said!--'Ay' and 'no'"
IV,VI,KING LEAR,"too was no good divinity. When the rain came to"
IV,VI,KING LEAR,"wet me once, and the wind to make me chatter; when"
IV,VI,KING LEAR,"the thunder would not peace at my bidding; there I"
IV,VI,KING LEAR,"found 'em, there I smelt 'em out. Go to, they are"
IV,VI,KING LEAR,"not men o' their words: they told me I was every"
IV,VI,KING LEAR,"thing; 'tis a lie, I am not ague-proof."
IV,VI,GLOUCESTER,"The trick of that voice I do well remember:"
IV,VI,GLOUCESTER,"Is 't not the king?"
IV,VI,KING LEAR,"Ay, every inch a king:"
IV,VI,KING LEAR,"When I do stare, see how the subject quakes."
IV,VI,KING LEAR,"I pardon that man's life. What was thy cause? Adultery?"
IV,VI,KING LEAR,"Thou shalt not die: die for adultery! No:"
IV,VI,KING LEAR,"The wren goes to 't, and the small gilded fly"
IV,VI,KING LEAR,"Does lecher in my sight."
IV,VI,KING LEAR,"Let copulation thrive; for Gloucester's bastard son"
IV,VI,KING LEAR,"Was kinder to his father than my daughters"
IV,VI,KING LEAR,"Got 'tween the lawful sheets."
IV,VI,KING LEAR,"To 't, luxury, pell-mell! for I lack soldiers."
IV,VI,KING LEAR,"Behold yond simpering dame,"
IV,VI,KING LEAR,"Whose face between her forks presages snow;"
IV,VI,KING LEAR,"That minces virtue, and does shake the head"
IV,VI,KING LEAR,"To hear of pleasure's name;"
IV,VI,KING LEAR,"The fitchew, nor the soiled horse, goes to 't"
IV,VI,KING LEAR,"With a more riotous appetite."
IV,VI,KING LEAR,"Down from the waist they are Centaurs,"
IV,VI,KING LEAR,"Though women all above:"
IV,VI,KING LEAR,"But to the girdle do the gods inherit,"
IV,VI,KING LEAR,"Beneath is all the fiends';"
IV,VI,KING LEAR,"There's hell, there's darkness, there's the"
IV,VI,KING LEAR,"sulphurous pit,"
IV,VI,KING LEAR,"Burning, scalding, stench, consumption; fie,"
IV,VI,KING LEAR,"fie, fie! pah, pah! Give me an ounce of civet,"
IV,VI,KING LEAR,"good apothecary, to sweeten my imagination:"
IV,VI,KING LEAR,"there's money for thee."
IV,VI,GLOUCESTER,"O, let me kiss that hand!"
IV,VI,KING LEAR,"Let me wipe it first; it smells of mortality."
IV,VI,GLOUCESTER,"O ruin'd piece of nature! This great world"
IV,VI,GLOUCESTER,"Shall so wear out to nought. Dost thou know me?"
IV,VI,KING LEAR,"I remember thine eyes well enough. Dost thou squiny"
IV,VI,KING LEAR,"at me? No, do thy worst, blind Cupid! I'll not"
IV,VI,KING LEAR,"love. Read thou this challenge; mark but the"
IV,VI,KING LEAR,"penning of it."
IV,VI,GLOUCESTER,"Were all the letters suns, I could not see one."
IV,VI,EDGAR,"I would not take this from report; it is,"
IV,VI,EDGAR,"And my heart breaks at it."
IV,VI,KING LEAR,"Read."
IV,VI,GLOUCESTER,"What, with the case of eyes?"
IV,VI,KING LEAR,"O, ho, are you there with me? No eyes in your"
IV,VI,KING LEAR,"head, nor no money in your purse? Your eyes are in"
IV,VI,KING LEAR,"a heavy case, your purse in a light; yet you see how"
IV,VI,KING LEAR,"this world goes."
IV,VI,GLOUCESTER,"I see it feelingly."
IV,VI,KING LEAR,"What, art mad? A man may see how this world goes"
IV,VI,KING LEAR,"with no eyes. Look with thine ears: see how yond"
IV,VI,KING LEAR,"justice rails upon yond simple thief. Hark, in"
IV,VI,KING LEAR,"thine ear: change places; and, handy-dandy, which"
IV,VI,KING LEAR,"is the justice, which is the thief? Thou hast seen"
IV,VI,KING LEAR,"a farmer's dog bark at a beggar?"
IV,VI,GLOUCESTER,"Ay, sir."
IV,VI,KING LEAR,"And the creature run from the cur? There thou"
IV,VI,KING LEAR,"mightst behold the great image of authority: a"
IV,VI,KING LEAR,"dog's obeyed in office."
IV,VI,KING LEAR,"Thou rascal beadle, hold thy bloody hand!"
IV,VI,KING LEAR,"Why dost thou lash that whore? Strip thine own back;"
IV,VI,KING LEAR,"Thou hotly lust'st to use her in that kind"
IV,VI,KING LEAR,"For which thou whipp'st her. The usurer hangs the cozener."
IV,VI,KING LEAR,"Through tatter'd clothes small vices do appear;"
IV,VI,KING LEAR,"Robes and furr'd gowns hide all. Plate sin with gold,"
IV,VI,KING LEAR,"And the strong lance of justice hurtless breaks:"
IV,VI,KING LEAR,"Arm it in rags, a pigmy's straw does pierce it."
IV,VI,KING LEAR,"None does offend, none, I say, none; I'll able 'em:"
IV,VI,KING LEAR,"Take that of me, my friend, who have the power"
IV,VI,KING LEAR,"To seal the accuser's lips. Get thee glass eyes;"
IV,VI,KING LEAR,"And like a scurvy politician, seem"
IV,VI,KING LEAR,"To see the things thou dost not. Now, now, now, now:"
IV,VI,KING LEAR,"Pull off my boots: harder, harder: so."
IV,VI,EDGAR,"O, matter and impertinency mix'd! Reason in madness!"
IV,VI,KING LEAR,"If thou wilt weep my fortunes, take my eyes."
IV,VI,KING LEAR,"I know thee well enough; thy name is Gloucester:"
IV,VI,KING LEAR,"Thou must be patient; we came crying hither:"
IV,VI,KING LEAR,"Thou know'st, the first time that we smell the air,"
IV,VI,KING LEAR,"We wawl and cry. I will preach to thee: mark."
IV,VI,GLOUCESTER,"Alack, alack the day!"
IV,VI,KING LEAR,"When we are born, we cry that we are come"
IV,VI,KING LEAR,"To this great stage of fools: this a good block;"
IV,VI,KING LEAR,"It were a delicate stratagem, to shoe"
IV,VI,KING LEAR,"A troop of horse with felt: I'll put 't in proof;"
IV,VI,KING LEAR,"And when I have stol'n upon these sons-in-law,"
IV,VI,KING LEAR,"Then, kill, kill, kill, kill, kill, kill!"
IV,VI,Gentleman,"O, here he is: lay hand upon him. Sir,"
IV,VI,Gentleman,"Your most dear daughter--"
IV,VI,KING LEAR,"No rescue? What, a prisoner? I am even"
IV,VI,KING LEAR,"The natural fool of fortune. Use me well;"
IV,VI,KING LEAR,"You shall have ransom. Let me have surgeons;"
IV,VI,KING LEAR,"I am cut to the brains."
IV,VI,Gentleman,"You shall have any thing."
IV,VI,KING LEAR,"No seconds? all myself?"
IV,VI,KING LEAR,"Why, this would make a man a man of salt,"
IV,VI,KING LEAR,"To use his eyes for garden water-pots,"
IV,VI,KING LEAR,"Ay, and laying autumn's dust."
IV,VI,Gentleman,"Good sir,--"
IV,VI,KING LEAR,"I will die bravely, like a bridegroom. What!"
IV,VI,KING LEAR,"I will be jovial: come, come; I am a king,"
IV,VI,KING LEAR,"My masters, know you that."
IV,VI,Gentleman,"You are a royal one, and we obey you."
IV,VI,KING LEAR,"Then there's life in't. Nay, if you get it, you"
IV,VI,KING LEAR,"shall get it with running. Sa, sa, sa, sa."
IV,VI,Gentleman,"A sight most pitiful in the meanest wretch,"
IV,VI,Gentleman,"Past speaking of in a king! Thou hast one daughter,"
IV,VI,Gentleman,"Who redeems nature from the general curse"
IV,VI,Gentleman,"Which twain have brought her to."
IV,VI,EDGAR,"Hail, gentle sir."
IV,VI,Gentleman,"Sir, speed you: what's your will?"
IV,VI,EDGAR,"Do you hear aught, sir, of a battle toward?"
IV,VI,Gentleman,"Most sure and vulgar: every one hears that,"
IV,VI,Gentleman,"Which can distinguish sound."
IV,VI,EDGAR,"But, by your favour,"
IV,VI,EDGAR,"How near's the other army?"
IV,VI,Gentleman,"Near and on speedy foot; the main descry"
IV,VI,Gentleman,"Stands on the hourly thought."
IV,VI,EDGAR,"I thank you, sir: that's all."
IV,VI,Gentleman,"Though that the queen on special cause is here,"
IV,VI,Gentleman,"Her army is moved on."
IV,VI,EDGAR,"I thank you, sir."
IV,VI,GLOUCESTER,"You ever-gentle gods, take my breath from me:"
IV,VI,GLOUCESTER,"Let not my worser spirit tempt me again"
IV,VI,GLOUCESTER,"To die before you please!"
IV,VI,EDGAR,"Well pray you, father."
IV,VI,GLOUCESTER,"Now, good sir, what are you?"
IV,VI,EDGAR,"A most poor man, made tame to fortune's blows;"
IV,VI,EDGAR,"Who, by the art of known and feeling sorrows,"
IV,VI,EDGAR,"Am pregnant to good pity. Give me your hand,"
IV,VI,EDGAR,"I'll lead you to some biding."
