I,I,Poet,"Good day, sir."
III,II,LUCILIUS,"hope his honour will conceive the fairest of me,"
III,II,LUCILIUS,"because I have no power to be kind: and tell him"
III,II,LUCILIUS,"this from me, I count it one of my greatest"
III,II,LUCILIUS,"afflictions, say, that I cannot pleasure such an"
III,II,LUCILIUS,"honourable gentleman. Good Servilius, will you"
III,II,LUCILIUS,"befriend me so far, as to use mine own words to him?"
III,II,SERVILIUS,"Yes, sir, I shall."
III,II,LUCILIUS,"I'll look you out a good turn, Servilius."
III,II,LUCILIUS,"True as you said, Timon is shrunk indeed;"
III,II,LUCILIUS,"And he that's once denied will hardly speed."
III,II,First Stranger,"Do you observe this, Hostilius?"
III,II,Second Stranger,"Ay, too well."
III,II,First Stranger,"Why, this is the world's soul; and just of the"
III,II,First Stranger,"same piece"
III,II,First Stranger,"Is every flatterer's spirit. Who can call him"
III,II,First Stranger,"His friend that dips in the same dish? for, in"
III,II,First Stranger,"My knowing, Timon has been this lord's father,"
III,II,First Stranger,"And kept his credit with his purse,"
III,II,First Stranger,"Supported his estate; nay, Timon's money"
III,II,First Stranger,"Has paid his men their wages: he ne'er drinks,"
III,II,First Stranger,"But Timon's silver treads upon his lip;"
III,II,First Stranger,"And yet--O, see the monstrousness of man"
III,II,First Stranger,"When he looks out in an ungrateful shape!--"
III,II,First Stranger,"He does deny him, in respect of his,"
III,II,First Stranger,"What charitable men afford to beggars."
III,II,Third Stranger,"Religion groans at it."
III,II,First Stranger,"For mine own part,"
III,II,First Stranger,"I never tasted Timon in my life,"
III,II,First Stranger,"Nor came any of his bounties over me,"
III,II,First Stranger,"To mark me for his friend; yet, I protest,"
III,II,First Stranger,"For his right noble mind, illustrious virtue"
III,II,First Stranger,"And honourable carriage,"
III,II,First Stranger,"Had his necessity made use of me,"
III,II,First Stranger,"I would have put my wealth into donation,"
III,II,First Stranger,"And the best half should have return'd to him,"
III,II,First Stranger,"So much I love his heart: but, I perceive,"
III,II,First Stranger,"Men must learn now with pity to dispense;"
III,II,First Stranger,"For policy sits above conscience."
III,III,SEMPRONIUS,"Must he needs trouble me in 't,--hum!--'bove"
III,III,SEMPRONIUS,"all others?"
III,III,SEMPRONIUS,"He might have tried Lord Lucius or Lucullus;"
III,III,SEMPRONIUS,"And now Ventidius is wealthy too,"
III,III,SEMPRONIUS,"Whom he redeem'd from prison: all these"
III,III,SEMPRONIUS,"Owe their estates unto him."
III,III,Servant,"My lord,"
III,III,Servant,"They have all been touch'd and found base metal, for"
III,III,Servant,"They have au denied him."
III,III,SEMPRONIUS,"How! have they denied him?"
III,III,SEMPRONIUS,"Has Ventidius and Lucullus denied him?"
III,III,SEMPRONIUS,"And does he send to me? Three? hum!"
III,III,SEMPRONIUS,"It shows but little love or judgment in him:"
III,III,SEMPRONIUS,"Must I be his last refuge! His friends, like"
III,III,SEMPRONIUS,"physicians,"
III,III,SEMPRONIUS,"Thrive, give him over: must I take the cure upon me?"
III,III,SEMPRONIUS,"Has much disgraced me in't; I'm angry at him,"
III,III,SEMPRONIUS,"That might have known my place: I see no sense for't,"
III,III,SEMPRONIUS,"But his occasion might have woo'd me first;"
III,III,SEMPRONIUS,"For, in my conscience, I was the first man"
III,III,SEMPRONIUS,"That e'er received gift from him:"
III,III,SEMPRONIUS,"And does he think so backwardly of me now,"
III,III,SEMPRONIUS,"That I'll requite its last? No:"
III,III,SEMPRONIUS,"So it may prove an argument of laughter"
III,III,SEMPRONIUS,"To the rest, and 'mongst lords I be thought a fool."
III,III,SEMPRONIUS,"I'ld rather than the worth of thrice the sum,"
III,III,SEMPRONIUS,"Had sent to me first, but for my mind's sake;"
III,III,SEMPRONIUS,"I'd such a courage to do him good. But now return,"
III,III,SEMPRONIUS,"And with their faint reply this answer join;"
III,III,SEMPRONIUS,"Who bates mine honour shall not know my coin."
III,III,Servant,"Excellent! Your lordship's a goodly villain. The"
III,III,Servant,"devil knew not what he did when he made man"
III,III,Servant,"politic; he crossed himself by 't: and I cannot"
III,III,Servant,"think but, in the end, the villainies of man will"
III,III,Servant,"set him clear. How fairly this lord strives to"
III,III,Servant,"appear foul! takes virtuous copies to be wicked,"
III,III,Servant,"like those that under hot ardent zeal would set"
III,III,Servant,"whole realms on fire: Of such a nature is his"
III,III,Servant,"politic love."
III,III,Servant,"This was my lord's best hope; now all are fled,"
III,III,Servant,"Save only the gods: now his friends are dead,"
III,III,Servant,"Doors, that were ne'er acquainted with their wards"
III,III,Servant,"Many a bounteous year must be employ'd"
III,III,Servant,"Now to guard sure their master."
III,III,Servant,"And this is all a liberal course allows;"
III,III,Servant,"Who cannot keep his wealth must keep his house."
III,IV,Varro's First Servant,"Well met; good morrow, Titus and Hortensius."
III,IV,TITUS,"The like to you kind Varro."
III,IV,HORTENSIUS,"Lucius!"
III,IV,HORTENSIUS,"What, do we meet together?"
III,IV,Lucilius' Servant,"Ay, and I think"
III,IV,Lucilius' Servant,"One business does command us all; for mine Is money."
III,IV,TITUS,"So is theirs and ours."
III,IV,Lucilius' Servant,"And Sir Philotus too!"
III,IV,PHILOTUS,"Good day at once."
III,IV,Lucilius' Servant,"Welcome, good brother."
III,IV,Lucilius' Servant,"What do you think the hour?"
III,IV,PHILOTUS,"Labouring for nine."
III,IV,Lucilius' Servant,"So much?"
III,IV,PHILOTUS,"Is not my lord seen yet?"
III,IV,Lucilius' Servant,"Not yet."
III,IV,PHILOTUS,"I wonder on't; he was wont to shine at seven."
III,IV,Lucilius' Servant,"Ay, but the days are wax'd shorter with him:"
III,IV,Lucilius' Servant,"You must consider that a prodigal course"
III,IV,Lucilius' Servant,"Is like the sun's; but not, like his, recoverable."
III,IV,Lucilius' Servant,"I fear 'tis deepest winter in Lord Timon's purse;"
III,IV,Lucilius' Servant,"That is one may reach deep enough, and yet"
III,IV,Lucilius' Servant,"Find little."
III,IV,PHILOTUS,"I am of your fear for that."
III,IV,TITUS,"I'll show you how to observe a strange event."
III,IV,TITUS,"Your lord sends now for money."
III,IV,HORTENSIUS,"Most true, he does."
III,IV,TITUS,"And he wears jewels now of Timon's gift,"
III,IV,TITUS,"For which I wait for money."
III,IV,HORTENSIUS,"It is against my heart."
III,IV,Lucilius' Servant,"Mark, how strange it shows,"
III,IV,Lucilius' Servant,"Timon in this should pay more than he owes:"
III,IV,Lucilius' Servant,"And e'en as if your lord should wear rich jewels,"
III,IV,Lucilius' Servant,"And send for money for 'em."
III,IV,HORTENSIUS,"I'm weary of this charge, the gods can witness:"
III,IV,HORTENSIUS,"I know my lord hath spent of Timon's wealth,"
III,IV,HORTENSIUS,"And now ingratitude makes it worse than stealth."
III,IV,Varro's First Servant,"Yes, mine's three thousand crowns: what's yours?"
III,IV,Lucilius' Servant,"Five thousand mine."
III,IV,Varro's First Servant,"'Tis much deep: and it should seem by the sun,"
III,IV,Varro's First Servant,"Your master's confidence was above mine;"
III,IV,Varro's First Servant,"Else, surely, his had equall'd."
III,IV,Varro's First Servant,"Enter FLAMINIUS."
III,IV,TITUS,"One of Lord Timon's men."
III,IV,Lucilius' Servant,"Flaminius! Sir, a word: pray, is my lord ready to"
III,IV,Lucilius' Servant,"come forth?"
III,IV,FLAMINIUS,"No, indeed, he is not."
III,IV,TITUS,"We attend his lordship; pray, signify so much."
III,IV,FLAMINIUS,"I need not tell him that; he knows you are too diligent."
III,IV,Lucilius' Servant,"Ha! is not that his steward muffled so?"
III,IV,Lucilius' Servant,"He goes away in a cloud: call him, call him."
III,IV,TITUS,"Do you hear, sir?"
III,IV,Varro's Second Servant,"By your leave, sir,--"
III,IV,FLAVIUS,"What do ye ask of me, my friend?"
III,IV,TITUS,"We wait for certain money here, sir."
III,IV,FLAVIUS,"Ay,"
III,IV,FLAVIUS,"If money were as certain as your waiting,"
III,IV,FLAVIUS,"'Twere sure enough."
III,IV,FLAVIUS,"Why then preferr'd you not your sums and bills,"
III,IV,FLAVIUS,"When your false masters eat of my lord's meat?"
III,IV,FLAVIUS,"Then they could smile and fawn upon his debts"
III,IV,FLAVIUS,"And take down the interest into their"
III,IV,FLAVIUS,"gluttonous maws."
III,IV,FLAVIUS,"You do yourselves but wrong to stir me up;"
III,IV,FLAVIUS,"Let me pass quietly:"
III,IV,FLAVIUS,"Believe 't, my lord and I have made an end;"
III,IV,FLAVIUS,"I have no more to reckon, he to spend."
III,IV,Lucilius' Servant,"Ay, but this answer will not serve."
III,IV,FLAVIUS,"If 'twill not serve,'tis not so base as you;"
III,IV,FLAVIUS,"For you serve knaves."
III,IV,Varro's First Servant,"How! what does his cashiered worship mutter?"
III,IV,Varro's Second Servant,"No matter what; he's poor, and that's revenge"
III,IV,Varro's Second Servant,"enough. Who can speak broader than he that has no"
III,IV,Varro's Second Servant,"house to put his head in? such may rail against"
III,IV,Varro's Second Servant,"great buildings."
III,IV,TITUS,"O, here's Servilius; now we shall know some answer."
III,IV,SERVILIUS,"If I might beseech you, gentlemen, to repair some"
III,IV,SERVILIUS,"other hour, I should derive much from't; for,"
III,IV,SERVILIUS,"take't of my soul, my lord leans wondrously to"
III,IV,SERVILIUS,"discontent: his comfortable temper has forsook him;"
III,IV,SERVILIUS,"he's much out of health, and keeps his chamber."
III,IV,Lucilius' Servant,"Many do keep their chambers are not sick:"
III,IV,Lucilius' Servant,"And, if it be so far beyond his health,"
III,IV,Lucilius' Servant,"Methinks he should the sooner pay his debts,"
III,IV,Lucilius' Servant,"And make a clear way to the gods."
III,IV,SERVILIUS,"Good gods!"
III,IV,TITUS,"We cannot take this for answer, sir."
III,IV,TIMON,"What, are my doors opposed against my passage?"
III,IV,TIMON,"Have I been ever free, and must my house"
III,IV,TIMON,"Be my retentive enemy, my gaol?"
III,IV,TIMON,"The place which I have feasted, does it now,"
III,IV,TIMON,"Like all mankind, show me an iron heart?"
III,IV,Lucilius' Servant,"Put in now, Titus."
III,IV,TITUS,"My lord, here is my bill."
III,IV,Lucilius' Servant,"Here's mine."
III,IV,HORTENSIUS,"And mine, my lord."
III,IV,Both Varro's Servants,"And ours, my lord."
III,IV,PHILOTUS,"All our bills."
III,IV,TIMON,"Knock me down with 'em: cleave me to the girdle."
III,IV,Lucilius' Servant,"Alas, my lord,-"
III,IV,TIMON,"Cut my heart in sums."
III,IV,TITUS,"Mine, fifty talents."
III,IV,TIMON,"Tell out my blood."
III,IV,Lucilius' Servant,"Five thousand crowns, my lord."
III,IV,TIMON,"Five thousand drops pays that."
III,IV,TIMON,"What yours?--and yours?"
III,IV,Varro's First Servant,"My lord,--"
III,IV,Varro's Second Servant,"My lord,--"
III,IV,TIMON,"Tear me, take me, and the gods fall upon you!"
III,IV,HORTENSIUS,"'Faith, I perceive our masters may throw their caps"
III,IV,HORTENSIUS,"at their money: these debts may well be called"
III,IV,HORTENSIUS,"desperate ones, for a madman owes 'em."
III,IV,TIMON,"They have e'en put my breath from me, the slaves."
III,IV,TIMON,"Creditors? devils!"
III,IV,FLAVIUS,"My dear lord,--"
III,IV,TIMON,"What if it should be so?"
III,IV,FLAVIUS,"My lord,--"
III,IV,TIMON,"I'll have it so. My steward!"
III,IV,FLAVIUS,"Here, my lord."
III,IV,TIMON,"So fitly? Go, bid all my friends again,"
III,IV,TIMON,"Lucius, Lucullus, and Sempronius:"
III,IV,TIMON,"All, sirrah, all:"
III,IV,TIMON,"I'll once more feast the rascals."
III,IV,FLAVIUS,"O my lord,"
III,IV,FLAVIUS,"You only speak from your distracted soul;"
III,IV,FLAVIUS,"There is not so much left, to furnish out"
III,IV,FLAVIUS,"A moderate table."
III,IV,TIMON,"Be't not in thy care; go,"
III,IV,TIMON,"I charge thee, invite them all: let in the tide"
III,IV,TIMON,"Of knaves once more; my cook and I'll provide."
III,V,First Senator,"My lord, you have my voice to it; the fault's"
III,V,First Senator,"Bloody; 'tis necessary he should die:"
III,V,First Senator,"Nothing emboldens sin so much as mercy."
III,V,Second Senator,"Most true; the law shall bruise him."
III,V,ALCIBIADES,"Honour, health, and compassion to the senate!"
III,V,First Senator,"Now, captain?"
III,V,ALCIBIADES,"I am an humble suitor to your virtues;"
III,V,ALCIBIADES,"For pity is the virtue of the law,"
III,V,ALCIBIADES,"And none but tyrants use it cruelly."
III,V,ALCIBIADES,"It pleases time and fortune to lie heavy"
III,V,ALCIBIADES,"Upon a friend of mine, who, in hot blood,"
III,V,ALCIBIADES,"Hath stepp'd into the law, which is past depth"
III,V,ALCIBIADES,"To those that, without heed, do plunge into 't."
III,V,ALCIBIADES,"He is a man, setting his fate aside,"
III,V,ALCIBIADES,"Of comely virtues:"
III,V,ALCIBIADES,"Nor did he soil the fact with cowardice--"
III,V,ALCIBIADES,"An honour in him which buys out his fault--"
III,V,ALCIBIADES,"But with a noble fury and fair spirit,"
III,V,ALCIBIADES,"Seeing his reputation touch'd to death,"
III,V,ALCIBIADES,"He did oppose his foe:"
III,V,ALCIBIADES,"And with such sober and unnoted passion"
III,V,ALCIBIADES,"He did behave his anger, ere 'twas spent,"
III,V,ALCIBIADES,"As if he had but proved an argument."
III,V,First Senator,"You undergo too strict a paradox,"
III,V,First Senator,"Striving to make an ugly deed look fair:"
III,V,First Senator,"Your words have took such pains as if they labour'd"
III,V,First Senator,"To bring manslaughter into form and set quarrelling"
III,V,First Senator,"Upon the head of valour; which indeed"
III,V,First Senator,"Is valour misbegot and came into the world"
III,V,First Senator,"When sects and factions were newly born:"
III,V,First Senator,"He's truly valiant that can wisely suffer"
III,V,First Senator,"The worst that man can breathe, and make his wrongs"
III,V,First Senator,"His outsides, to wear them like his raiment,"
III,V,First Senator,"carelessly,"
III,V,First Senator,"And ne'er prefer his injuries to his heart,"
III,V,First Senator,"To bring it into danger."
III,V,First Senator,"If wrongs be evils and enforce us kill,"
III,V,First Senator,"What folly 'tis to hazard life for ill!"
III,V,ALCIBIADES,"My lord,--"
III,V,First Senator,"You cannot make gross sins look clear:"
III,V,First Senator,"To revenge is no valour, but to bear."
III,V,ALCIBIADES,"My lords, then, under favour, pardon me,"
III,V,ALCIBIADES,"If I speak like a captain."
III,V,ALCIBIADES,"Why do fond men expose themselves to battle,"
III,V,ALCIBIADES,"And not endure all threats? sleep upon't,"
III,V,ALCIBIADES,"And let the foes quietly cut their throats,"
III,V,ALCIBIADES,"Without repugnancy? If there be"
III,V,ALCIBIADES,"Such valour in the bearing, what make we"
III,V,ALCIBIADES,"Abroad? why then, women are more valiant"
III,V,ALCIBIADES,"That stay at home, if bearing carry it,"
III,V,ALCIBIADES,"And the ass more captain than the lion, the felon"
III,V,ALCIBIADES,"Loaden with irons wiser than the judge,"
III,V,ALCIBIADES,"If wisdom be in suffering. O my lords,"
III,V,ALCIBIADES,"As you are great, be pitifully good:"
III,V,ALCIBIADES,"Who cannot condemn rashness in cold blood?"
III,V,ALCIBIADES,"To kill, I grant, is sin's extremest gust;"
III,V,ALCIBIADES,"But, in defence, by mercy, 'tis most just."
III,V,ALCIBIADES,"To be in anger is impiety;"
III,V,ALCIBIADES,"But who is man that is not angry?"
III,V,ALCIBIADES,"Weigh but the crime with this."
III,V,Second Senator,"You breathe in vain."
III,V,ALCIBIADES,"In vain! his service done"
III,V,ALCIBIADES,"At Lacedaemon and Byzantium"
III,V,ALCIBIADES,"Were a sufficient briber for his life."
III,V,First Senator,"What's that?"
III,V,ALCIBIADES,"I say, my lords, he has done fair service,"
III,V,ALCIBIADES,"And slain in fight many of your enemies:"
III,V,ALCIBIADES,"How full of valour did he bear himself"
III,V,ALCIBIADES,"In the last conflict, and made plenteous wounds!"
III,V,Second Senator,"He has made too much plenty with 'em;"
III,V,Second Senator,"He's a sworn rioter: he has a sin that often"
III,V,Second Senator,"Drowns him, and takes his valour prisoner:"
III,V,Second Senator,"If there were no foes, that were enough"
III,V,Second Senator,"To overcome him: in that beastly fury"
III,V,Second Senator,"He has been known to commit outrages,"
III,V,Second Senator,"And cherish factions: 'tis inferr'd to us,"
III,V,Second Senator,"His days are foul and his drink dangerous."
III,V,First Senator,"He dies."
III,V,ALCIBIADES,"Hard fate! he might have died in war."
III,V,ALCIBIADES,"My lords, if not for any parts in him--"
III,V,ALCIBIADES,"Though his right arm might purchase his own time"
III,V,ALCIBIADES,"And be in debt to none--yet, more to move you,"
III,V,ALCIBIADES,"Take my deserts to his, and join 'em both:"
III,V,ALCIBIADES,"And, for I know your reverend ages love"
III,V,ALCIBIADES,"Security, I'll pawn my victories, all"
III,V,ALCIBIADES,"My honours to you, upon his good returns."
III,V,ALCIBIADES,"If by this crime he owes the law his life,"
III,V,ALCIBIADES,"Why, let the war receive 't in valiant gore"
III,V,ALCIBIADES,"For law is strict, and war is nothing more."
III,V,First Senator,"We are for law: he dies; urge it no more,"
III,V,First Senator,"On height of our displeasure: friend or brother,"
III,V,First Senator,"He forfeits his own blood that spills another."
III,V,ALCIBIADES,"Must it be so? it must not be. My lords,"
III,V,ALCIBIADES,"I do beseech you, know me."
III,V,Second Senator,"How!"
III,V,ALCIBIADES,"Call me to your remembrances."
III,V,Third Senator,"What!"
III,V,ALCIBIADES,"I cannot think but your age has forgot me;"
III,V,ALCIBIADES,"It could not else be, I should prove so base,"
III,V,ALCIBIADES,"To sue, and be denied such common grace:"
III,V,ALCIBIADES,"My wounds ache at you."
III,V,First Senator,"Do you dare our anger?"
III,V,First Senator,"'Tis in few words, but spacious in effect;"
III,V,First Senator,"We banish thee for ever."
III,V,ALCIBIADES,"Banish me!"
III,V,ALCIBIADES,"Banish your dotage; banish usury,"
III,V,ALCIBIADES,"That makes the senate ugly."
III,V,First Senator,"If, after two days' shine, Athens contain thee,"
III,V,First Senator,"Attend our weightier judgment. And, not to swell"
III,V,First Senator,"our spirit,"
III,V,First Senator,"He shall be executed presently."
III,V,ALCIBIADES,"Now the gods keep you old enough; that you may live"
III,V,ALCIBIADES,"Only in bone, that none may look on you!"
III,V,ALCIBIADES,"I'm worse than mad: I have kept back their foes,"
III,V,ALCIBIADES,"While they have told their money and let out"
III,V,ALCIBIADES,"Their coin upon large interest, I myself"
III,V,ALCIBIADES,"Rich only in large hurts. All those for this?"
III,V,ALCIBIADES,"Is this the balsam that the usuring senate"
III,V,ALCIBIADES,"Pours into captains' wounds? Banishment!"
III,V,ALCIBIADES,"It comes not ill; I hate not to be banish'd;"
III,V,ALCIBIADES,"It is a cause worthy my spleen and fury,"
III,V,ALCIBIADES,"That I may strike at Athens. I'll cheer up"
III,V,ALCIBIADES,"My discontented troops, and lay for hearts."
III,V,ALCIBIADES,"'Tis honour with most lands to be at odds;"
III,V,ALCIBIADES,"Soldiers should brook as little wrongs as gods."
III,VI,First Lord,"The good time of day to you, sir."
III,VI,Second Lord,"I also wish it to you. I think this honourable lord"
III,VI,Second Lord,"did but try us this other day."
III,VI,First Lord,"Upon that were my thoughts tiring, when we"
III,VI,First Lord,"encountered: I hope it is not so low with him as"
III,VI,First Lord,"he made it seem in the trial of his several friends."
III,VI,Second Lord,"It should not be, by the persuasion of his new feasting."
III,VI,First Lord,"I should think so: he hath sent me an earnest"
III,VI,First Lord,"inviting, which many my near occasions did urge me"
III,VI,First Lord,"to put off; but he hath conjured me beyond them, and"
III,VI,First Lord,"I must needs appear."
III,VI,Second Lord,"In like manner was I in debt to my importunate"
III,VI,Second Lord,"business, but he would not hear my excuse. I am"
III,VI,Second Lord,"sorry, when he sent to borrow of me, that my"
III,VI,Second Lord,"provision was out."
III,VI,First Lord,"I am sick of that grief too, as I understand how all"
III,VI,First Lord,"things go."
III,VI,Second Lord,"Every man here's so. What would he have borrowed of"
III,VI,Second Lord,"you?"
III,VI,First Lord,"A thousand pieces."
III,VI,Second Lord,"A thousand pieces!"
III,VI,First Lord,"What of you?"
III,VI,Second Lord,"He sent to me, sir,--Here he comes."
III,VI,TIMON,"With all my heart, gentlemen both; and how fare you?"
III,VI,First Lord,"Ever at the best, hearing well of your lordship."
III,VI,Second Lord,"The swallow follows not summer more willing than we"
III,VI,Second Lord,"your lordship."
III,VI,TIMON,"summer-birds are men. Gentlemen, our dinner will not"
III,VI,TIMON,"recompense this long stay: feast your ears with the"
III,VI,TIMON,"music awhile, if they will fare so harshly o' the"
III,VI,TIMON,"trumpet's sound; we shall to 't presently."
III,VI,First Lord,"I hope it remains not unkindly with your lordship"
III,VI,First Lord,"that I returned you an empty messenger."
III,VI,TIMON,"O, sir, let it not trouble you."
III,VI,Second Lord,"My noble lord,--"
III,VI,TIMON,"Ah, my good friend, what cheer?"
III,VI,Second Lord,"My most honourable lord, I am e'en sick of shame,"
III,VI,Second Lord,"that, when your lordship this other day sent to me,"
III,VI,Second Lord,"I was so unfortunate a beggar."
III,VI,TIMON,"Think not on 't, sir."
III,VI,Second Lord,"If you had sent but two hours before,--"
III,VI,TIMON,"Let it not cumber your better remembrance."
III,VI,TIMON,"Come, bring in all together."
III,VI,Second Lord,"All covered dishes!"
III,VI,First Lord,"Royal cheer, I warrant you."
III,VI,Third Lord,"Doubt not that, if money and the season can yield"
III,VI,Third Lord,"it."
III,VI,First Lord,"How do you? What's the news?"
III,VI,Third Lord,"Alcibiades is banished: hear you of it?"
III,VI,First Lord,"Alcibiades banished!"
III,VI,Third Lord,"'Tis so, be sure of it."
III,VI,First Lord,"How! how!"
III,VI,Second Lord,"I pray you, upon what?"
III,VI,TIMON,"My worthy friends, will you draw near?"
III,VI,Third Lord,"I'll tell you more anon. Here's a noble feast toward."
III,VI,Second Lord,"This is the old man still."
III,VI,Third Lord,"Will 't hold? will 't hold?"
III,VI,Second Lord,"It does: but time will--and so--"
III,VI,Third Lord,"I do conceive."
III,VI,TIMON,"Each man to his stool, with that spur as he would to"
III,VI,TIMON,"the lip of his mistress: your diet shall be in all"
III,VI,TIMON,"places alike. Make not a city feast of it, to let"
III,VI,TIMON,"the meat cool ere we can agree upon the first place:"
III,VI,TIMON,"sit, sit. The gods require our thanks."
III,VI,TIMON,"You great benefactors, sprinkle our society with"
III,VI,TIMON,"thankfulness. For your own gifts, make yourselves"
III,VI,TIMON,"praised: but reserve still to give, lest your"
III,VI,TIMON,"deities be despised. Lend to each man enough, that"
III,VI,TIMON,"one need not lend to another; for, were your"
III,VI,TIMON,"godheads to borrow of men, men would forsake the"
III,VI,TIMON,"gods. Make the meat be beloved more than the man"
III,VI,TIMON,"that gives it. Let no assembly of twenty be without"
III,VI,TIMON,"a score of villains: if there sit twelve women at"
III,VI,TIMON,"the table, let a dozen of them be--as they are. The"
III,VI,TIMON,"rest of your fees, O gods--the senators of Athens,"
III,VI,TIMON,"together with the common lag of people--what is"
III,VI,TIMON,"amiss in them, you gods, make suitable for"
III,VI,TIMON,"destruction. For these my present friends, as they"
III,VI,TIMON,"are to me nothing, so in nothing bless them, and to"
III,VI,TIMON,"nothing are they welcome."
III,VI,TIMON,"Uncover, dogs, and lap."
III,VI,Some Speak,"What does his lordship mean?"
III,VI,Some Others,"I know not."
III,VI,TIMON,"May you a better feast never behold,"
III,VI,TIMON,"You knot of mouth-friends I smoke and lukewarm water"
III,VI,TIMON,"Is your perfection. This is Timon's last;"
III,VI,TIMON,"Who, stuck and spangled with your flatteries,"
III,VI,TIMON,"Washes it off, and sprinkles in your faces"
III,VI,TIMON,"Your reeking villany."
III,VI,TIMON,"Live loathed and long,"
III,VI,TIMON,"Most smiling, smooth, detested parasites,"
III,VI,TIMON,"Courteous destroyers, affable wolves, meek bears,"
III,VI,TIMON,"You fools of fortune, trencher-friends, time's flies,"
III,VI,TIMON,"Cap and knee slaves, vapours, and minute-jacks!"
III,VI,TIMON,"Of man and beast the infinite malady"
III,VI,TIMON,"Crust you quite o'er! What, dost thou go?"
III,VI,TIMON,"Soft! take thy physic first--thou too--and thou;--"
III,VI,TIMON,"Stay, I will lend thee money, borrow none."
III,VI,TIMON,"What, all in motion? Henceforth be no feast,"
III,VI,TIMON,"Whereat a villain's not a welcome guest."
III,VI,TIMON,"Burn, house! sink, Athens! henceforth hated be"
III,VI,TIMON,"Of Timon man and all humanity!"
III,VI,First Lord,"How now, my lords!"
III,VI,Second Lord,"Know you the quality of Lord Timon's fury?"
III,VI,Third Lord,"Push! did you see my cap?"
III,VI,Fourth Lord,"I have lost my gown."
III,VI,First Lord,"He's but a mad lord, and nought but humour sways him."
III,VI,First Lord,"He gave me a jewel th' other day, and now he has"
III,VI,First Lord,"beat it out of my hat: did you see my jewel?"
III,VI,Third Lord,"Did you see my cap?"
III,VI,Second Lord,"Here 'tis."
III,VI,Fourth Lord,"Here lies my gown."
III,VI,First Lord,"Let's make no stay."
III,VI,Second Lord,"Lord Timon's mad."
III,VI,Third Lord,"I feel 't upon my bones."
III,VI,Fourth Lord,"One day he gives us diamonds, next day stones."
IV,I,TIMON,"Let me look back upon thee. O thou wall,"
IV,I,TIMON,"That girdlest in those wolves, dive in the earth,"
