I,I,Poet,"Good day, sir."
IV,III,TIMON,"unicorn, pride and wrath would confound thee and"
IV,III,TIMON,"make thine own self the conquest of thy fury: wert"
IV,III,TIMON,"thou a bear, thou wouldst be killed by the horse:"
IV,III,TIMON,"wert thou a horse, thou wouldst be seized by the"
IV,III,TIMON,"leopard: wert thou a leopard, thou wert german to"
IV,III,TIMON,"the lion and the spots of thy kindred were jurors on"
IV,III,TIMON,"thy life: all thy safety were remotion and thy"
IV,III,TIMON,"defence absence. What beast couldst thou be, that"
IV,III,TIMON,"were not subject to a beast? and what a beast art"
IV,III,TIMON,"thou already, that seest not thy loss in"
IV,III,TIMON,"transformation!"
IV,III,APEMANTUS,"If thou couldst please me with speaking to me, thou"
IV,III,APEMANTUS,"mightst have hit upon it here: the commonwealth of"
IV,III,APEMANTUS,"Athens is become a forest of beasts."
IV,III,TIMON,"How has the ass broke the wall, that thou art out of the city?"
IV,III,APEMANTUS,"Yonder comes a poet and a painter: the plague of"
IV,III,APEMANTUS,"company light upon thee! I will fear to catch it"
IV,III,APEMANTUS,"and give way: when I know not what else to do, I'll"
IV,III,APEMANTUS,"see thee again."
IV,III,TIMON,"When there is nothing living but thee, thou shalt be"
IV,III,TIMON,"welcome. I had rather be a beggar's dog than Apemantus."
IV,III,APEMANTUS,"Thou art the cap of all the fools alive."
IV,III,TIMON,"Would thou wert clean enough to spit upon!"
IV,III,APEMANTUS,"A plague on thee! thou art too bad to curse."
IV,III,TIMON,"All villains that do stand by thee are pure."
IV,III,APEMANTUS,"There is no leprosy but what thou speak'st."
IV,III,TIMON,"If I name thee."
IV,III,TIMON,"I'll beat thee, but I should infect my hands."
IV,III,APEMANTUS,"I would my tongue could rot them off!"
IV,III,TIMON,"Away, thou issue of a mangy dog!"
IV,III,TIMON,"Choler does kill me that thou art alive;"
IV,III,TIMON,"I swound to see thee."
IV,III,APEMANTUS,"Would thou wouldst burst!"
IV,III,TIMON,"Away,"
IV,III,TIMON,"Thou tedious rogue! I am sorry I shall lose"
IV,III,TIMON,"A stone by thee."
IV,III,APEMANTUS,"Beast!"
IV,III,TIMON,"Slave!"
IV,III,APEMANTUS,"Toad!"
IV,III,TIMON,"Rogue, rogue, rogue!"
IV,III,TIMON,"I am sick of this false world, and will love nought"
IV,III,TIMON,"But even the mere necessities upon 't."
IV,III,TIMON,"Then, Timon, presently prepare thy grave;"
IV,III,TIMON,"Lie where the light foam the sea may beat"
IV,III,TIMON,"Thy grave-stone daily: make thine epitaph,"
IV,III,TIMON,"That death in me at others' lives may laugh."
IV,III,TIMON,"O thou sweet king-killer, and dear divorce"
IV,III,TIMON,"'Twixt natural son and sire! thou bright defiler"
IV,III,TIMON,"Of Hymen's purest bed! thou valiant Mars!"
IV,III,TIMON,"Thou ever young, fresh, loved and delicate wooer,"
IV,III,TIMON,"Whose blush doth thaw the consecrated snow"
IV,III,TIMON,"That lies on Dian's lap! thou visible god,"
IV,III,TIMON,"That solder'st close impossibilities,"
IV,III,TIMON,"And makest them kiss! that speak'st with"
IV,III,TIMON,"every tongue,"
IV,III,TIMON,"To every purpose! O thou touch of hearts!"
IV,III,TIMON,"Think, thy slave man rebels, and by thy virtue"
IV,III,TIMON,"Set them into confounding odds, that beasts"
IV,III,TIMON,"May have the world in empire!"
IV,III,APEMANTUS,"Would 'twere so!"
IV,III,APEMANTUS,"But not till I am dead. I'll say thou'st gold:"
IV,III,APEMANTUS,"Thou wilt be throng'd to shortly."
IV,III,TIMON,"Throng'd to!"
IV,III,APEMANTUS,"Ay."
IV,III,TIMON,"Thy back, I prithee."
IV,III,APEMANTUS,"Live, and love thy misery."
IV,III,TIMON,"Long live so, and so die."
IV,III,TIMON,"I am quit."
IV,III,TIMON,"Moe things like men! Eat, Timon, and abhor them."
IV,III,First Bandit,"Where should he have this gold? It is some poor"
IV,III,First Bandit,"fragment, some slender sort of his remainder: the"
IV,III,First Bandit,"mere want of gold, and the falling-from of his"
IV,III,First Bandit,"friends, drove him into this melancholy."
IV,III,Second Bandit,"It is noised he hath a mass of treasure."
IV,III,Third Bandit,"Let us make the assay upon him: if he care not"
IV,III,Third Bandit,"for't, he will supply us easily; if he covetously"
IV,III,Third Bandit,"reserve it, how shall's get it?"
IV,III,Second Bandit,"True; for he bears it not about him, 'tis hid."
IV,III,First Bandit,"Is not this he?"
IV,III,Banditti,"Where?"
IV,III,Second Bandit,"'Tis his description."
IV,III,Third Bandit,"He; I know him."
IV,III,Banditti,"Save thee, Timon."
IV,III,TIMON,"Now, thieves?"
IV,III,Banditti,"Soldiers, not thieves."
IV,III,TIMON,"Both too; and women's sons."
IV,III,Banditti,"We are not thieves, but men that much do want."
IV,III,TIMON,"Your greatest want is, you want much of meat."
IV,III,TIMON,"Why should you want? Behold, the earth hath roots;"
IV,III,TIMON,"Within this mile break forth a hundred springs;"
IV,III,TIMON,"The oaks bear mast, the briers scarlet hips;"
IV,III,TIMON,"The bounteous housewife, nature, on each bush"
IV,III,TIMON,"Lays her full mess before you. Want! why want?"
IV,III,First Bandit,"We cannot live on grass, on berries, water,"
IV,III,First Bandit,"As beasts and birds and fishes."
IV,III,TIMON,"Nor on the beasts themselves, the birds, and fishes;"
IV,III,TIMON,"You must eat men. Yet thanks I must you con"
IV,III,TIMON,"That you are thieves profess'd, that you work not"
IV,III,TIMON,"In holier shapes: for there is boundless theft"
IV,III,TIMON,"In limited professions. Rascal thieves,"
IV,III,TIMON,"Here's gold. Go, suck the subtle blood o' the grape,"
IV,III,TIMON,"Till the high fever seethe your blood to froth,"
IV,III,TIMON,"And so 'scape hanging: trust not the physician;"
IV,III,TIMON,"His antidotes are poison, and he slays"
IV,III,TIMON,"Moe than you rob: take wealth and lives together;"
IV,III,TIMON,"Do villany, do, since you protest to do't,"
IV,III,TIMON,"Like workmen. I'll example you with thievery."
IV,III,TIMON,"The sun's a thief, and with his great attraction"
IV,III,TIMON,"Robs the vast sea: the moon's an arrant thief,"
IV,III,TIMON,"And her pale fire she snatches from the sun:"
IV,III,TIMON,"The sea's a thief, whose liquid surge resolves"
IV,III,TIMON,"The moon into salt tears: the earth's a thief,"
IV,III,TIMON,"That feeds and breeds by a composture stolen"
IV,III,TIMON,"From general excrement: each thing's a thief:"
IV,III,TIMON,"The laws, your curb and whip, in their rough power"
IV,III,TIMON,"Have uncheque'd theft. Love not yourselves: away,"
IV,III,TIMON,"Rob one another. There's more gold. Cut throats:"
IV,III,TIMON,"All that you meet are thieves: to Athens go,"
IV,III,TIMON,"Break open shops; nothing can you steal,"
IV,III,TIMON,"But thieves do lose it: steal no less for this"
IV,III,TIMON,"I give you; and gold confound you howsoe'er! Amen."
IV,III,Third Bandit,"Has almost charmed me from my profession, by"
IV,III,Third Bandit,"persuading me to it."
IV,III,First Bandit,"'Tis in the malice of mankind that he thus advises"
IV,III,First Bandit,"us; not to have us thrive in our mystery."
IV,III,Second Bandit,"I'll believe him as an enemy, and give over my trade."
IV,III,First Bandit,"Let us first see peace in Athens: there is no time"
IV,III,First Bandit,"so miserable but a man may be true."
IV,III,FLAVIUS,"O you gods!"
IV,III,FLAVIUS,"Is yond despised and ruinous man my lord?"
IV,III,FLAVIUS,"Full of decay and failing? O monument"
IV,III,FLAVIUS,"And wonder of good deeds evilly bestow'd!"
IV,III,FLAVIUS,"What an alteration of honour"
IV,III,FLAVIUS,"Has desperate want made!"
IV,III,FLAVIUS,"What viler thing upon the earth than friends"
IV,III,FLAVIUS,"Who can bring noblest minds to basest ends!"
IV,III,FLAVIUS,"How rarely does it meet with this time's guise,"
IV,III,FLAVIUS,"When man was wish'd to love his enemies!"
IV,III,FLAVIUS,"Grant I may ever love, and rather woo"
IV,III,FLAVIUS,"Those that would mischief me than those that do!"
IV,III,FLAVIUS,"Has caught me in his eye: I will present"
IV,III,FLAVIUS,"My honest grief unto him; and, as my lord,"
IV,III,FLAVIUS,"Still serve him with my life. My dearest master!"
IV,III,TIMON,"Away! what art thou?"
IV,III,FLAVIUS,"Have you forgot me, sir?"
IV,III,TIMON,"Why dost ask that? I have forgot all men;"
IV,III,TIMON,"Then, if thou grant'st thou'rt a man, I have forgot thee."
IV,III,FLAVIUS,"An honest poor servant of yours."
IV,III,TIMON,"Then I know thee not:"
IV,III,TIMON,"I never had honest man about me, I; all"
IV,III,TIMON,"I kept were knaves, to serve in meat to villains."
IV,III,FLAVIUS,"The gods are witness,"
IV,III,FLAVIUS,"Ne'er did poor steward wear a truer grief"
IV,III,FLAVIUS,"For his undone lord than mine eyes for you."
IV,III,TIMON,"What, dost thou weep? Come nearer. Then I"
IV,III,TIMON,"love thee,"
IV,III,TIMON,"Because thou art a woman, and disclaim'st"
IV,III,TIMON,"Flinty mankind; whose eyes do never give"
IV,III,TIMON,"But thorough lust and laughter. Pity's sleeping:"
IV,III,TIMON,"Strange times, that weep with laughing, not with weeping!"
IV,III,FLAVIUS,"I beg of you to know me, good my lord,"
IV,III,FLAVIUS,"To accept my grief and whilst this poor wealth lasts"
IV,III,FLAVIUS,"To entertain me as your steward still."
IV,III,TIMON,"Had I a steward"
IV,III,TIMON,"So true, so just, and now so comfortable?"
IV,III,TIMON,"It almost turns my dangerous nature mild."
IV,III,TIMON,"Let me behold thy face. Surely, this man"
IV,III,TIMON,"Was born of woman."
IV,III,TIMON,"Forgive my general and exceptless rashness,"
IV,III,TIMON,"You perpetual-sober gods! I do proclaim"
IV,III,TIMON,"One honest man--mistake me not--but one;"
IV,III,TIMON,"No more, I pray,--and he's a steward."
IV,III,TIMON,"How fain would I have hated all mankind!"
IV,III,TIMON,"And thou redeem'st thyself: but all, save thee,"
IV,III,TIMON,"I fell with curses."
IV,III,TIMON,"Methinks thou art more honest now than wise;"
IV,III,TIMON,"For, by oppressing and betraying me,"
IV,III,TIMON,"Thou mightst have sooner got another service:"
IV,III,TIMON,"For many so arrive at second masters,"
IV,III,TIMON,"Upon their first lord's neck. But tell me true--"
IV,III,TIMON,"For I must ever doubt, though ne'er so sure--"
IV,III,TIMON,"Is not thy kindness subtle, covetous,"
IV,III,TIMON,"If not a usuring kindness, and, as rich men deal gifts,"
IV,III,TIMON,"Expecting in return twenty for one?"
IV,III,FLAVIUS,"No, my most worthy master; in whose breast"
IV,III,FLAVIUS,"Doubt and suspect, alas, are placed too late:"
IV,III,FLAVIUS,"You should have fear'd false times when you did feast:"
IV,III,FLAVIUS,"Suspect still comes where an estate is least."
IV,III,FLAVIUS,"That which I show, heaven knows, is merely love,"
IV,III,FLAVIUS,"Duty and zeal to your unmatched mind,"
IV,III,FLAVIUS,"Care of your food and living; and, believe it,"
IV,III,FLAVIUS,"My most honour'd lord,"
IV,III,FLAVIUS,"For any benefit that points to me,"
IV,III,FLAVIUS,"Either in hope or present, I'ld exchange"
IV,III,FLAVIUS,"For this one wish, that you had power and wealth"
IV,III,FLAVIUS,"To requite me, by making rich yourself."
IV,III,TIMON,"Look thee, 'tis so! Thou singly honest man,"
IV,III,TIMON,"Here, take: the gods out of my misery"
IV,III,TIMON,"Have sent thee treasure. Go, live rich and happy;"
IV,III,TIMON,"But thus condition'd: thou shalt build from men;"
IV,III,TIMON,"Hate all, curse all, show charity to none,"
IV,III,TIMON,"But let the famish'd flesh slide from the bone,"
IV,III,TIMON,"Ere thou relieve the beggar; give to dogs"
IV,III,TIMON,"What thou deny'st to men; let prisons swallow 'em,"
IV,III,TIMON,"Debts wither 'em to nothing; be men like"
IV,III,TIMON,"blasted woods,"
IV,III,TIMON,"And may diseases lick up their false bloods!"
IV,III,TIMON,"And so farewell and thrive."
IV,III,FLAVIUS,"O, let me stay,"
IV,III,FLAVIUS,"And comfort you, my master."
IV,III,TIMON,"If thou hatest curses,"
IV,III,TIMON,"Stay not; fly, whilst thou art blest and free:"
IV,III,TIMON,"Ne'er see thou man, and let me ne'er see thee."
V,I,Painter,"As I took note of the place, it cannot be far where"
V,I,Painter,"he abides."
V,I,Poet,"What's to be thought of him? does the rumour hold"
V,I,Poet,"for true, that he's so full of gold?"
V,I,Painter,"Certain: Alcibiades reports it; Phrynia and"
V,I,Painter,"Timandra had gold of him: he likewise enriched poor"
V,I,Painter,"straggling soldiers with great quantity: 'tis said"
V,I,Painter,"he gave unto his steward a mighty sum."
V,I,Poet,"Then this breaking of his has been but a try for his friends."
V,I,Painter,"Nothing else: you shall see him a palm in Athens"
V,I,Painter,"again, and flourish with the highest. Therefore"
V,I,Painter,"'tis not amiss we tender our loves to him, in this"
V,I,Painter,"supposed distress of his: it will show honestly in"
V,I,Painter,"us; and is very likely to load our purposes with"
V,I,Painter,"what they travail for, if it be a just true report"
V,I,Painter,"that goes of his having."
V,I,Poet,"What have you now to present unto him?"
V,I,Painter,"Nothing at this time but my visitation: only I will"
V,I,Painter,"promise him an excellent piece."
V,I,Poet,"I must serve him so too, tell him of an intent"
V,I,Poet,"that's coming toward him."
V,I,Painter,"Good as the best. Promising is the very air o' the"
V,I,Painter,"time: it opens the eyes of expectation:"
V,I,Painter,"performance is ever the duller for his act; and,"
V,I,Painter,"but in the plainer and simpler kind of people, the"
V,I,Painter,"deed of saying is quite out of use. To promise is"
V,I,Painter,"most courtly and fashionable: performance is a kind"
V,I,Painter,"of will or testament which argues a great sickness"
V,I,Painter,"in his judgment that makes it."
V,I,TIMON,"man so bad as is thyself."
V,I,Poet,"I am thinking what I shall say I have provided for"
V,I,Poet,"him: it must be a personating of himself; a satire"
V,I,Poet,"against the softness of prosperity, with a discovery"
V,I,Poet,"of the infinite flatteries that follow youth and opulency."
V,I,TIMON,"thine own work? wilt thou whip thine own faults in"
V,I,TIMON,"other men? Do so, I have gold for thee."
V,I,Poet,"Nay, let's seek him:"
V,I,Poet,"Then do we sin against our own estate,"
V,I,Poet,"When we may profit meet, and come too late."
V,I,Painter,"True;"
V,I,Painter,"When the day serves, before black-corner'd night,"
V,I,Painter,"Find what thou want'st by free and offer'd light. Come."
V,I,TIMON,"god's gold,"
V,I,TIMON,"That he is worshipp'd in a baser temple"
V,I,TIMON,"Than where swine feed!"
V,I,TIMON,"'Tis thou that rigg'st the bark and plough'st the foam,"
V,I,TIMON,"Settlest admired reverence in a slave:"
V,I,TIMON,"To thee be worship! and thy saints for aye"
V,I,TIMON,"Be crown'd with plagues that thee alone obey!"
V,I,TIMON,"Fit I meet them."
V,I,Poet,"Hail, worthy Timon!"
V,I,Painter,"Our late noble master!"
V,I,TIMON,"Have I once lived to see two honest men?"
V,I,Poet,"Sir,"
V,I,Poet,"Having often of your open bounty tasted,"
V,I,Poet,"Hearing you were retired, your friends fall'n off,"
V,I,Poet,"Whose thankless natures--O abhorred spirits!--"
V,I,Poet,"Not all the whips of heaven are large enough:"
V,I,Poet,"What! to you,"
V,I,Poet,"Whose star-like nobleness gave life and influence"
V,I,Poet,"To their whole being! I am rapt and cannot cover"
V,I,Poet,"The monstrous bulk of this ingratitude"
V,I,Poet,"With any size of words."
V,I,TIMON,"Let it go naked, men may see't the better:"
V,I,TIMON,"You that are honest, by being what you are,"
V,I,TIMON,"Make them best seen and known."
V,I,Painter,"He and myself"
V,I,Painter,"Have travail'd in the great shower of your gifts,"
V,I,Painter,"And sweetly felt it."
V,I,TIMON,"Ay, you are honest men."
V,I,Painter,"We are hither come to offer you our service."
V,I,TIMON,"Most honest men! Why, how shall I requite you?"
V,I,TIMON,"Can you eat roots, and drink cold water? no."
V,I,Both,"What we can do, we'll do, to do you service."
V,I,TIMON,"Ye're honest men: ye've heard that I have gold;"
V,I,TIMON,"I am sure you have: speak truth; ye're honest men."
V,I,Painter,"So it is said, my noble lord; but therefore"
V,I,Painter,"Came not my friend nor I."
V,I,TIMON,"Good honest men! Thou draw'st a counterfeit"
V,I,TIMON,"Best in all Athens: thou'rt, indeed, the best;"
V,I,TIMON,"Thou counterfeit'st most lively."
V,I,Painter,"So, so, my lord."
V,I,TIMON,"E'en so, sir, as I say. And, for thy fiction,"
V,I,TIMON,"Why, thy verse swells with stuff so fine and smooth"
V,I,TIMON,"That thou art even natural in thine art."
V,I,TIMON,"But, for all this, my honest-natured friends,"
V,I,TIMON,"I must needs say you have a little fault:"
V,I,TIMON,"Marry, 'tis not monstrous in you, neither wish I"
V,I,TIMON,"You take much pains to mend."
V,I,Both,"Beseech your honour"
V,I,Both,"To make it known to us."
V,I,TIMON,"You'll take it ill."
V,I,Both,"Most thankfully, my lord."
V,I,TIMON,"Will you, indeed?"
V,I,Both,"Doubt it not, worthy lord."
V,I,TIMON,"There's never a one of you but trusts a knave,"
V,I,TIMON,"That mightily deceives you."
V,I,Both,"Do we, my lord?"
V,I,TIMON,"Ay, and you hear him cog, see him dissemble,"
V,I,TIMON,"Know his gross patchery, love him, feed him,"
V,I,TIMON,"Keep in your bosom: yet remain assured"
V,I,TIMON,"That he's a made-up villain."
V,I,Painter,"I know none such, my lord."
V,I,Poet,"Nor I."
V,I,TIMON,"Look you, I love you well; I'll give you gold,"
V,I,TIMON,"Rid me these villains from your companies:"
V,I,TIMON,"Hang them or stab them, drown them in a draught,"
V,I,TIMON,"Confound them by some course, and come to me,"
V,I,TIMON,"I'll give you gold enough."
V,I,Both,"Name them, my lord, let's know them."
V,I,TIMON,"You that way and you this, but two in company;"
V,I,TIMON,"Each man apart, all single and alone,"
V,I,TIMON,"Yet an arch-villain keeps him company."
V,I,TIMON,"If where thou art two villains shall not be,"
V,I,TIMON,"Come not near him. If thou wouldst not reside"
V,I,TIMON,"But where one villain is, then him abandon."
V,I,TIMON,"Hence, pack! there's gold; you came for gold, ye slaves:"
V,I,TIMON,"You have work'd for me; there's payment for you: hence!"
V,I,TIMON,"You are an alchemist; make gold of that."
V,I,TIMON,"Out, rascal dogs!"
V,I,FLAVIUS,"It is in vain that you would speak with Timon;"
V,I,FLAVIUS,"For he is set so only to himself"
V,I,FLAVIUS,"That nothing but himself which looks like man"
V,I,FLAVIUS,"Is friendly with him."
V,I,First Senator,"Bring us to his cave:"
V,I,First Senator,"It is our part and promise to the Athenians"
V,I,First Senator,"To speak with Timon."
V,I,Second Senator,"At all times alike"
V,I,Second Senator,"Men are not still the same: 'twas time and griefs"
V,I,Second Senator,"That framed him thus: time, with his fairer hand,"
V,I,Second Senator,"Offering the fortunes of his former days,"
V,I,Second Senator,"The former man may make him. Bring us to him,"
V,I,Second Senator,"And chance it as it may."
V,I,FLAVIUS,"Here is his cave."
V,I,FLAVIUS,"Peace and content be here! Lord Timon! Timon!"
V,I,FLAVIUS,"Look out, and speak to friends: the Athenians,"
V,I,FLAVIUS,"By two of their most reverend senate, greet thee:"
V,I,FLAVIUS,"Speak to them, noble Timon."
V,I,TIMON,"Thou sun, that comfort'st, burn! Speak, and"
V,I,TIMON,"be hang'd:"
V,I,TIMON,"For each true word, a blister! and each false"
V,I,TIMON,"Be as cauterizing to the root o' the tongue,"
V,I,TIMON,"Consuming it with speaking!"
V,I,First Senator,"Worthy Timon,--"
V,I,TIMON,"Of none but such as you, and you of Timon."
V,I,First Senator,"The senators of Athens greet thee, Timon."
V,I,TIMON,"I thank them; and would send them back the plague,"
V,I,TIMON,"Could I but catch it for them."
V,I,First Senator,"O, forget"
V,I,First Senator,"What we are sorry for ourselves in thee."
V,I,First Senator,"The senators with one consent of love"
V,I,First Senator,"Entreat thee back to Athens; who have thought"
V,I,First Senator,"On special dignities, which vacant lie"
V,I,First Senator,"For thy best use and wearing."
V,I,Second Senator,"They confess"
V,I,Second Senator,"Toward thee forgetfulness too general, gross:"
V,I,Second Senator,"Which now the public body, which doth seldom"
V,I,Second Senator,"Play the recanter, feeling in itself"
V,I,Second Senator,"A lack of Timon's aid, hath sense withal"
V,I,Second Senator,"Of its own fail, restraining aid to Timon;"
V,I,Second Senator,"And send forth us, to make their sorrow'd render,"
V,I,Second Senator,"Together with a recompense more fruitful"
V,I,Second Senator,"Than their offence can weigh down by the dram;"
V,I,Second Senator,"Ay, even such heaps and sums of love and wealth"
V,I,Second Senator,"As shall to thee blot out what wrongs were theirs"
V,I,Second Senator,"And write in thee the figures of their love,"
V,I,Second Senator,"Ever to read them thine."
V,I,TIMON,"You witch me in it;"
V,I,TIMON,"Surprise me to the very brink of tears:"
V,I,TIMON,"Lend me a fool's heart and a woman's eyes,"
V,I,TIMON,"And I'll beweep these comforts, worthy senators."
V,I,First Senator,"Therefore, so please thee to return with us"
V,I,First Senator,"And of our Athens, thine and ours, to take"
V,I,First Senator,"The captainship, thou shalt be met with thanks,"
V,I,First Senator,"Allow'd with absolute power and thy good name"
V,I,First Senator,"Live with authority: so soon we shall drive back"
V,I,First Senator,"Of Alcibiades the approaches wild,"
V,I,First Senator,"Who, like a boar too savage, doth root up"
V,I,First Senator,"His country's peace."
V,I,Second Senator,"And shakes his threatening sword"
V,I,Second Senator,"Against the walls of Athens."
V,I,First Senator,"Therefore, Timon,--"
V,I,TIMON,"Well, sir, I will; therefore, I will, sir; thus:"
V,I,TIMON,"If Alcibiades kill my countrymen,"
V,I,TIMON,"Let Alcibiades know this of Timon,"
V,I,TIMON,"That Timon cares not. But if be sack fair Athens,"
V,I,TIMON,"And take our goodly aged men by the beards,"
V,I,TIMON,"Giving our holy virgins to the stain"
V,I,TIMON,"Of contumelious, beastly, mad-brain'd war,"
V,I,TIMON,"Then let him know, and tell him Timon speaks it,"
V,I,TIMON,"In pity of our aged and our youth,"
V,I,TIMON,"I cannot choose but tell him, that I care not,"
V,I,TIMON,"And let him take't at worst; for their knives care not,"
V,I,TIMON,"While you have throats to answer: for myself,"
V,I,TIMON,"There's not a whittle in the unruly camp"
V,I,TIMON,"But I do prize it at my love before"
V,I,TIMON,"The reverend'st throat in Athens. So I leave you"
V,I,TIMON,"To the protection of the prosperous gods,"
V,I,TIMON,"As thieves to keepers."
V,I,FLAVIUS,"Stay not, all's in vain."
V,I,TIMON,"Why, I was writing of my epitaph;"
V,I,TIMON,"it will be seen to-morrow: my long sickness"
V,I,TIMON,"Of health and living now begins to mend,"
V,I,TIMON,"And nothing brings me all things. Go, live still;"
V,I,TIMON,"Be Alcibiades your plague, you his,"
V,I,TIMON,"And last so long enough!"
V,I,First Senator,"We speak in vain."
V,I,TIMON,"But yet I love my country, and am not"
V,I,TIMON,"One that rejoices in the common wreck,"
V,I,TIMON,"As common bruit doth put it."
V,I,First Senator,"That's well spoke."
V,I,TIMON,"Commend me to my loving countrymen,--"
V,I,First Senator,"These words become your lips as they pass"
V,I,First Senator,"thorough them."
V,I,Second Senator,"And enter in our ears like great triumphers"
V,I,Second Senator,"In their applauding gates."
V,I,TIMON,"Commend me to them,"
V,I,TIMON,"And tell them that, to ease them of their griefs,"
V,I,TIMON,"Their fears of hostile strokes, their aches, losses,"
V,I,TIMON,"Their pangs of love, with other incident throes"
V,I,TIMON,"That nature's fragile vessel doth sustain"
V,I,TIMON,"In life's uncertain voyage, I will some kindness do them:"
V,I,TIMON,"I'll teach them to prevent wild Alcibiades' wrath."
V,I,First Senator,"I like this well; he will return again."
V,I,TIMON,"I have a tree, which grows here in my close,"
V,I,TIMON,"That mine own use invites me to cut down,"
V,I,TIMON,"And shortly must I fell it: tell my friends,"
V,I,TIMON,"Tell Athens, in the sequence of degree"
V,I,TIMON,"From high to low throughout, that whoso please"
V,I,TIMON,"To stop affliction, let him take his haste,"
V,I,TIMON,"Come hither, ere my tree hath felt the axe,"
V,I,TIMON,"And hang himself. I pray you, do my greeting."
V,I,FLAVIUS,"Trouble him no further; thus you still shall find him."
V,I,TIMON,"Come not to me again: but say to Athens,"
V,I,TIMON,"Timon hath made his everlasting mansion"
V,I,TIMON,"Upon the beached verge of the salt flood;"
V,I,TIMON,"Who once a day with his embossed froth"
V,I,TIMON,"The turbulent surge shall cover: thither come,"
V,I,TIMON,"And let my grave-stone be your oracle."
V,I,TIMON,"Lips, let sour words go by and language end:"
V,I,TIMON,"What is amiss plague and infection mend!"
V,I,TIMON,"Graves only be men's works and death their gain!"
V,I,TIMON,"Sun, hide thy beams! Timon hath done his reign."
V,I,First Senator,"His discontents are unremoveably"
V,I,First Senator,"Coupled to nature."
V,I,Second Senator,"Our hope in him is dead: let us return,"
V,I,Second Senator,"And strain what other means is left unto us"
V,I,Second Senator,"In our dear peril."
V,I,First Senator,"It requires swift foot."
V,II,First Senator,"Thou hast painfully discover'd: are his files"
V,II,First Senator,"As full as thy report?"
V,II,Messenger,"have spoke the least:"
V,II,Messenger,"Besides, his expedition promises"
V,II,Messenger,"Present approach."
V,II,Second Senator,"We stand much hazard, if they bring not Timon."
V,II,Messenger,"I met a courier, one mine ancient friend;"
V,II,Messenger,"Whom, though in general part we were opposed,"
V,II,Messenger,"Yet our old love made a particular force,"
V,II,Messenger,"And made us speak like friends: this man was riding"
V,II,Messenger,"From Alcibiades to Timon's cave,"
V,II,Messenger,"With letters of entreaty, which imported"
V,II,Messenger,"His fellowship i' the cause against your city,"
V,II,Messenger,"In part for his sake moved."
V,II,First Senator,"Here come our brothers."
V,II,Third Senator,"No talk of Timon, nothing of him expect."
