III,IV,ANTONIO,"I snatch'd one half out of the jaws of death,"
III,IV,ANTONIO,"Relieved him with such sanctity of love,"
III,IV,ANTONIO,"And to his image, which methought did promise"
III,IV,ANTONIO,"Most venerable worth, did I devotion."
III,IV,First Officer,"What's that to us? The time goes by: away!"
III,IV,ANTONIO,"But O how vile an idol proves this god"
III,IV,ANTONIO,"Thou hast, Sebastian, done good feature shame."
III,IV,ANTONIO,"In nature there's no blemish but the mind;"
III,IV,ANTONIO,"None can be call'd deform'd but the unkind:"
III,IV,ANTONIO,"Virtue is beauty, but the beauteous evil"
III,IV,ANTONIO,"Are empty trunks o'erflourish'd by the devil."
III,IV,First Officer,"The man grows mad: away with him! Come, come, sir."
III,IV,ANTONIO,"Lead me on."
III,IV,VIOLA,"Methinks his words do from such passion fly,"
III,IV,VIOLA,"That he believes himself: so do not I."
III,IV,VIOLA,"Prove true, imagination, O, prove true,"
III,IV,VIOLA,"That I, dear brother, be now ta'en for you!"
III,IV,SIR TOBY BELCH,"Come hither, knight; come hither, Fabian: we'll"
III,IV,SIR TOBY BELCH,"whisper o'er a couplet or two of most sage saws."
III,IV,VIOLA,"He named Sebastian: I my brother know"
III,IV,VIOLA,"Yet living in my glass; even such and so"
III,IV,VIOLA,"In favour was my brother, and he went"
III,IV,VIOLA,"Still in this fashion, colour, ornament,"
III,IV,VIOLA,"For him I imitate: O, if it prove,"
III,IV,VIOLA,"Tempests are kind and salt waves fresh in love."
III,IV,SIR TOBY BELCH,"A very dishonest paltry boy, and more a coward than"
III,IV,SIR TOBY BELCH,"a hare: his dishonesty appears in leaving his"
III,IV,SIR TOBY BELCH,"friend here in necessity and denying him; and for"
III,IV,SIR TOBY BELCH,"his cowardship, ask Fabian."
III,IV,FABIAN,"A coward, a most devout coward, religious in it."
III,IV,SIR ANDREW,"'Slid, I'll after him again and beat him."
III,IV,SIR TOBY BELCH,"Do; cuff him soundly, but never draw thy sword."
III,IV,SIR ANDREW,"An I do not,--"
III,IV,FABIAN,"Come, let's see the event."
III,IV,SIR TOBY BELCH,"I dare lay any money 'twill be nothing yet."
IV,I,Clown,"Will you make me believe that I am not sent for you?"
IV,I,SEBASTIAN,"Go to, go to, thou art a foolish fellow:"
IV,I,SEBASTIAN,"Let me be clear of thee."
IV,I,Clown,"Well held out, i' faith! No, I do not know you; nor"
IV,I,Clown,"I am not sent to you by my lady, to bid you come"
IV,I,Clown,"speak with her; nor your name is not Master Cesario;"
IV,I,Clown,"nor this is not my nose neither. Nothing that is so is so."
IV,I,SEBASTIAN,"I prithee, vent thy folly somewhere else: Thou"
IV,I,SEBASTIAN,"know'st not me."
IV,I,Clown,"Vent my folly! he has heard that word of some"
IV,I,Clown,"great man and now applies it to a fool. Vent my"
IV,I,Clown,"folly! I am afraid this great lubber, the world,"
IV,I,Clown,"will prove a cockney. I prithee now, ungird thy"
IV,I,Clown,"strangeness and tell me what I shall vent to my"
IV,I,Clown,"lady: shall I vent to her that thou art coming?"
IV,I,SEBASTIAN,"I prithee, foolish Greek, depart from me: There's"
IV,I,SEBASTIAN,"money for thee: if you tarry longer, I shall give"
IV,I,SEBASTIAN,"worse payment."
IV,I,Clown,"By my troth, thou hast an open hand. These wise men"
IV,I,Clown,"that give fools money get themselves a good"
IV,I,Clown,"report--after fourteen years' purchase."
IV,I,SIR ANDREW,"Now, sir, have I met you again? there's for you."
IV,I,SEBASTIAN,"Why, there's for thee, and there, and there. Are all"
IV,I,SEBASTIAN,"the people mad?"
IV,I,SIR TOBY BELCH,"Hold, sir, or I'll throw your dagger o'er the house."
IV,I,Clown,"This will I tell my lady straight: I would not be"
IV,I,Clown,"in some of your coats for two pence."
IV,I,SIR TOBY BELCH,"Come on, sir; hold."
IV,I,SIR ANDREW,"Nay, let him alone: I'll go another way to work"
IV,I,SIR ANDREW,"with him; I'll have an action of battery against"
IV,I,SIR ANDREW,"him, if there be any law in Illyria: though I"
IV,I,SIR ANDREW,"struck him first, yet it's no matter for that."
IV,I,SEBASTIAN,"Let go thy hand."
IV,I,SIR TOBY BELCH,"Come, sir, I will not let you go. Come, my young"
IV,I,SIR TOBY BELCH,"soldier, put up your iron: you are well fleshed; come on."
IV,I,SEBASTIAN,"I will be free from thee. What wouldst thou now? If"
IV,I,SEBASTIAN,"thou darest tempt me further, draw thy sword."
IV,I,SIR TOBY BELCH,"What, what? Nay, then I must have an ounce or two"
IV,I,SIR TOBY BELCH,"of this malapert blood from you."
IV,I,OLIVIA,"Hold, Toby; on thy life I charge thee, hold!"
IV,I,SIR TOBY BELCH,"Madam!"
IV,I,OLIVIA,"Will it be ever thus? Ungracious wretch,"
IV,I,OLIVIA,"Fit for the mountains and the barbarous caves,"
IV,I,OLIVIA,"Where manners ne'er were preach'd! out of my sight!"
IV,I,OLIVIA,"Be not offended, dear Cesario."
IV,I,OLIVIA,"Rudesby, be gone!"
IV,I,OLIVIA,"I prithee, gentle friend,"
IV,I,OLIVIA,"Let thy fair wisdom, not thy passion, sway"
IV,I,OLIVIA,"In this uncivil and thou unjust extent"
IV,I,OLIVIA,"Against thy peace. Go with me to my house,"
IV,I,OLIVIA,"And hear thou there how many fruitless pranks"
IV,I,OLIVIA,"This ruffian hath botch'd up, that thou thereby"
IV,I,OLIVIA,"Mayst smile at this: thou shalt not choose but go:"
IV,I,OLIVIA,"Do not deny. Beshrew his soul for me,"
IV,I,OLIVIA,"He started one poor heart of mine in thee."
IV,I,SEBASTIAN,"What relish is in this? how runs the stream?"
IV,I,SEBASTIAN,"Or I am mad, or else this is a dream:"
IV,I,SEBASTIAN,"Let fancy still my sense in Lethe steep;"
IV,I,SEBASTIAN,"If it be thus to dream, still let me sleep!"
IV,I,OLIVIA,"Nay, come, I prithee; would thou'ldst be ruled by me!"
IV,I,SEBASTIAN,"Madam, I will."
IV,I,OLIVIA,"O, say so, and so be!"
IV,II,MARIA,"Nay, I prithee, put on this gown and this beard;"
IV,II,MARIA,"make him believe thou art Sir Topas the curate: do"
IV,II,MARIA,"it quickly; I'll call Sir Toby the whilst."
IV,II,Clown,"Well, I'll put it on, and I will dissemble myself"
IV,II,Clown,"in't; and I would I were the first that ever"
IV,II,Clown,"dissembled in such a gown. I am not tall enough to"
IV,II,Clown,"become the function well, nor lean enough to be"
IV,II,Clown,"thought a good student; but to be said an honest man"
IV,II,Clown,"and a good housekeeper goes as fairly as to say a"
IV,II,Clown,"careful man and a great scholar. The competitors enter."
IV,II,SIR TOBY BELCH,"Jove bless thee, master Parson."
IV,II,Clown,"Bonos dies, Sir Toby: for, as the old hermit of"
IV,II,Clown,"Prague, that never saw pen and ink, very wittily"
IV,II,Clown,"said to a niece of King Gorboduc, 'That that is is;'"
IV,II,Clown,"so I, being Master Parson, am Master Parson; for,"
IV,II,Clown,"what is 'that' but 'that,' and 'is' but 'is'?"
IV,II,SIR TOBY BELCH,"To him, Sir Topas."
IV,II,Clown,"What, ho, I say! peace in this prison!"
IV,II,SIR TOBY BELCH,"The knave counterfeits well; a good knave."
IV,II,Clown,"Sir Topas the curate, who comes to visit Malvolio"
IV,II,Clown,"the lunatic."
IV,II,MALVOLIO,"Sir Topas, Sir Topas, good Sir Topas, go to my lady."
IV,II,Clown,"Out, hyperbolical fiend! how vexest thou this man!"
IV,II,Clown,"talkest thou nothing but of ladies?"
IV,II,SIR TOBY BELCH,"Well said, Master Parson."
IV,II,MALVOLIO,"Sir Topas, never was man thus wronged: good Sir"
IV,II,MALVOLIO,"Topas, do not think I am mad: they have laid me"
IV,II,MALVOLIO,"here in hideous darkness."
IV,II,Clown,"Fie, thou dishonest Satan! I call thee by the most"
IV,II,Clown,"modest terms; for I am one of those gentle ones"
IV,II,Clown,"that will use the devil himself with courtesy:"
IV,II,Clown,"sayest thou that house is dark?"
IV,II,MALVOLIO,"As hell, Sir Topas."
IV,II,Clown,"Why it hath bay windows transparent as barricadoes,"
IV,II,Clown,"and the clearstores toward the south north are as"
IV,II,Clown,"lustrous as ebony; and yet complainest thou of"
IV,II,Clown,"obstruction?"
IV,II,MALVOLIO,"I am not mad, Sir Topas: I say to you, this house is dark."
IV,II,Clown,"Madman, thou errest: I say, there is no darkness"
IV,II,Clown,"but ignorance; in which thou art more puzzled than"
IV,II,Clown,"the Egyptians in their fog."
IV,II,MALVOLIO,"I say, this house is as dark as ignorance, though"
IV,II,MALVOLIO,"ignorance were as dark as hell; and I say, there"
IV,II,MALVOLIO,"was never man thus abused. I am no more mad than you"
IV,II,MALVOLIO,"are: make the trial of it in any constant question."
IV,II,Clown,"What is the opinion of Pythagoras concerning wild fowl?"
IV,II,MALVOLIO,"That the soul of our grandam might haply inhabit a bird."
IV,II,Clown,"What thinkest thou of his opinion?"
IV,II,MALVOLIO,"I think nobly of the soul, and no way approve his opinion."
IV,II,Clown,"Fare thee well. Remain thou still in darkness:"
IV,II,Clown,"thou shalt hold the opinion of Pythagoras ere I will"
IV,II,Clown,"allow of thy wits, and fear to kill a woodcock, lest"
IV,II,Clown,"thou dispossess the soul of thy grandam. Fare thee well."
IV,II,MALVOLIO,"Sir Topas, Sir Topas!"
IV,II,SIR TOBY BELCH,"My most exquisite Sir Topas!"
IV,II,Clown,"Nay, I am for all waters."
IV,II,MARIA,"Thou mightst have done this without thy beard and"
IV,II,MARIA,"gown: he sees thee not."
IV,II,SIR TOBY BELCH,"To him in thine own voice, and bring me word how"
IV,II,SIR TOBY BELCH,"thou findest him: I would we were well rid of this"
IV,II,SIR TOBY BELCH,"knavery. If he may be conveniently delivered, I"
IV,II,SIR TOBY BELCH,"would he were, for I am now so far in offence with"
IV,II,SIR TOBY BELCH,"my niece that I cannot pursue with any safety this"
IV,II,SIR TOBY BELCH,"sport to the upshot. Come by and by to my chamber."
IV,II,Clown,"'Hey, Robin, jolly Robin,"
IV,II,Clown,"Tell me how thy lady does.'"
IV,II,MALVOLIO,"Fool!"
IV,II,Clown,"'My lady is unkind, perdy.'"
IV,II,MALVOLIO,"Fool!"
IV,II,Clown,"'Alas, why is she so?'"
IV,II,MALVOLIO,"Fool, I say!"
IV,II,Clown,"'She loves another'--Who calls, ha?"
IV,II,MALVOLIO,"Good fool, as ever thou wilt deserve well at my"
IV,II,MALVOLIO,"hand, help me to a candle, and pen, ink and paper:"
IV,II,MALVOLIO,"as I am a gentleman, I will live to be thankful to"
IV,II,MALVOLIO,"thee for't."
IV,II,Clown,"Master Malvolio?"
IV,II,MALVOLIO,"Ay, good fool."
IV,II,Clown,"Alas, sir, how fell you besides your five wits?"
IV,II,MALVOLIO,"Fool, there was never a man so notoriously abused: I"
IV,II,MALVOLIO,"am as well in my wits, fool, as thou art."
IV,II,Clown,"But as well? then you are mad indeed, if you be no"
IV,II,Clown,"better in your wits than a fool."
IV,II,MALVOLIO,"They have here propertied me; keep me in darkness,"
IV,II,MALVOLIO,"send ministers to me, asses, and do all they can to"
IV,II,MALVOLIO,"face me out of my wits."
IV,II,Clown,"Advise you what you say; the minister is here."
IV,II,Clown,"Malvolio, Malvolio, thy wits the heavens restore!"
IV,II,Clown,"endeavour thyself to sleep, and leave thy vain"
IV,II,Clown,"bibble babble."
IV,II,MALVOLIO,"Sir Topas!"
IV,II,Clown,"Maintain no words with him, good fellow. Who, I,"
IV,II,Clown,"sir? not I, sir. God be wi' you, good Sir Topas."
IV,II,Clown,"Merry, amen. I will, sir, I will."
IV,II,MALVOLIO,"Fool, fool, fool, I say!"
IV,II,Clown,"Alas, sir, be patient. What say you sir? I am"
IV,II,Clown,"shent for speaking to you."
IV,II,MALVOLIO,"Good fool, help me to some light and some paper: I"
IV,II,MALVOLIO,"tell thee, I am as well in my wits as any man in Illyria."
IV,II,Clown,"Well-a-day that you were, sir"
IV,II,MALVOLIO,"By this hand, I am. Good fool, some ink, paper and"
IV,II,MALVOLIO,"light; and convey what I will set down to my lady:"
IV,II,MALVOLIO,"it shall advantage thee more than ever the bearing"
IV,II,MALVOLIO,"of letter did."
IV,II,Clown,"I will help you to't. But tell me true, are you"
IV,II,Clown,"not mad indeed? or do you but counterfeit?"
IV,II,MALVOLIO,"Believe me, I am not; I tell thee true."
IV,II,Clown,"Nay, I'll ne'er believe a madman till I see his"
IV,II,Clown,"brains. I will fetch you light and paper and ink."
IV,II,MALVOLIO,"Fool, I'll requite it in the highest degree: I"
IV,II,MALVOLIO,"prithee, be gone."
IV,II,Clown,"I am gone, sir,"
IV,II,Clown,"And anon, sir,"
IV,II,Clown,"I'll be with you again,"
IV,II,Clown,"In a trice,"
IV,II,Clown,"Like to the old Vice,"
IV,II,Clown,"Your need to sustain;"
IV,II,Clown,"Who, with dagger of lath,"
IV,II,Clown,"In his rage and his wrath,"
IV,II,Clown,"Cries, ah, ha! to the devil:"
IV,II,Clown,"Like a mad lad,"
IV,II,Clown,"Pare thy nails, dad;"
IV,II,Clown,"Adieu, good man devil."
IV,III,SEBASTIAN,"This is the air; that is the glorious sun;"
IV,III,SEBASTIAN,"This pearl she gave me, I do feel't and see't;"
IV,III,SEBASTIAN,"And though 'tis wonder that enwraps me thus,"
IV,III,SEBASTIAN,"Yet 'tis not madness. Where's Antonio, then?"
IV,III,SEBASTIAN,"I could not find him at the Elephant:"
IV,III,SEBASTIAN,"Yet there he was; and there I found this credit,"
IV,III,SEBASTIAN,"That he did range the town to seek me out."
IV,III,SEBASTIAN,"His counsel now might do me golden service;"
IV,III,SEBASTIAN,"For though my soul disputes well with my sense,"
IV,III,SEBASTIAN,"That this may be some error, but no madness,"
IV,III,SEBASTIAN,"Yet doth this accident and flood of fortune"
IV,III,SEBASTIAN,"So far exceed all instance, all discourse,"
IV,III,SEBASTIAN,"That I am ready to distrust mine eyes"
IV,III,SEBASTIAN,"And wrangle with my reason that persuades me"
IV,III,SEBASTIAN,"To any other trust but that I am mad"
IV,III,SEBASTIAN,"Or else the lady's mad; yet, if 'twere so,"
IV,III,SEBASTIAN,"She could not sway her house, command her followers,"
IV,III,SEBASTIAN,"Take and give back affairs and their dispatch"
IV,III,SEBASTIAN,"With such a smooth, discreet and stable bearing"
IV,III,SEBASTIAN,"As I perceive she does: there's something in't"
IV,III,SEBASTIAN,"That is deceiveable. But here the lady comes."
IV,III,OLIVIA,"Blame not this haste of mine. If you mean well,"
IV,III,OLIVIA,"Now go with me and with this holy man"
IV,III,OLIVIA,"Into the chantry by: there, before him,"
IV,III,OLIVIA,"And underneath that consecrated roof,"
IV,III,OLIVIA,"Plight me the full assurance of your faith;"
IV,III,OLIVIA,"That my most jealous and too doubtful soul"
IV,III,OLIVIA,"May live at peace. He shall conceal it"
IV,III,OLIVIA,"Whiles you are willing it shall come to note,"
IV,III,OLIVIA,"What time we will our celebration keep"
IV,III,OLIVIA,"According to my birth. What do you say?"
IV,III,SEBASTIAN,"I'll follow this good man, and go with you;"
IV,III,SEBASTIAN,"And, having sworn truth, ever will be true."
IV,III,OLIVIA,"Then lead the way, good father; and heavens so shine,"
IV,III,OLIVIA,"That they may fairly note this act of mine!"
V,I,FABIAN,"Now, as thou lovest me, let me see his letter."
V,I,Clown,"Good Master Fabian, grant me another request."
V,I,FABIAN,"Any thing."
V,I,Clown,"Do not desire to see this letter."
V,I,FABIAN,"This is, to give a dog, and in recompense desire my"
V,I,FABIAN,"dog again."
V,I,DUKE ORSINO,"Belong you to the Lady Olivia, friends?"
V,I,Clown,"Ay, sir; we are some of her trappings."
V,I,DUKE ORSINO,"I know thee well; how dost thou, my good fellow?"
V,I,Clown,"Truly, sir, the better for my foes and the worse"
V,I,Clown,"for my friends."
V,I,DUKE ORSINO,"Just the contrary; the better for thy friends."
V,I,Clown,"No, sir, the worse."
V,I,DUKE ORSINO,"How can that be?"
V,I,Clown,"Marry, sir, they praise me and make an ass of me;"
V,I,Clown,"now my foes tell me plainly I am an ass: so that by"
V,I,Clown,"my foes, sir I profit in the knowledge of myself,"
V,I,Clown,"and by my friends, I am abused: so that,"
V,I,Clown,"conclusions to be as kisses, if your four negatives"
V,I,Clown,"make your two affirmatives why then, the worse for"
V,I,Clown,"my friends and the better for my foes."
V,I,DUKE ORSINO,"Why, this is excellent."
V,I,Clown,"By my troth, sir, no; though it please you to be"
V,I,Clown,"one of my friends."
V,I,DUKE ORSINO,"Thou shalt not be the worse for me: there's gold."
V,I,Clown,"But that it would be double-dealing, sir, I would"
V,I,Clown,"you could make it another."
V,I,DUKE ORSINO,"O, you give me ill counsel."
V,I,Clown,"Put your grace in your pocket, sir, for this once,"
V,I,Clown,"and let your flesh and blood obey it."
V,I,DUKE ORSINO,"Well, I will be so much a sinner, to be a"
V,I,DUKE ORSINO,"double-dealer: there's another."
V,I,Clown,"Primo, secundo, tertio, is a good play; and the old"
V,I,Clown,"saying is, the third pays for all: the triplex,"
V,I,Clown,"sir, is a good tripping measure; or the bells of"
V,I,Clown,"Saint Bennet, sir, may put you in mind; one, two, three."
V,I,DUKE ORSINO,"You can fool no more money out of me at this throw:"
V,I,DUKE ORSINO,"if you will let your lady know I am here to speak"
V,I,DUKE ORSINO,"with her, and bring her along with you, it may awake"
V,I,DUKE ORSINO,"my bounty further."
V,I,Clown,"Marry, sir, lullaby to your bounty till I come"
V,I,Clown,"again. I go, sir; but I would not have you to think"
V,I,Clown,"that my desire of having is the sin of covetousness:"
V,I,Clown,"but, as you say, sir, let your bounty take a nap, I"
V,I,Clown,"will awake it anon."
V,I,VIOLA,"Here comes the man, sir, that did rescue me."
V,I,DUKE ORSINO,"That face of his I do remember well;"
V,I,DUKE ORSINO,"Yet, when I saw it last, it was besmear'd"
V,I,DUKE ORSINO,"As black as Vulcan in the smoke of war:"
V,I,DUKE ORSINO,"A bawbling vessel was he captain of,"
V,I,DUKE ORSINO,"For shallow draught and bulk unprizable;"
V,I,DUKE ORSINO,"With which such scathful grapple did he make"
V,I,DUKE ORSINO,"With the most noble bottom of our fleet,"
V,I,DUKE ORSINO,"That very envy and the tongue of loss"
V,I,DUKE ORSINO,"Cried fame and honour on him. What's the matter?"
V,I,First Officer,"Orsino, this is that Antonio"
V,I,First Officer,"That took the Phoenix and her fraught from Candy;"
V,I,First Officer,"And this is he that did the Tiger board,"
V,I,First Officer,"When your young nephew Titus lost his leg:"
V,I,First Officer,"Here in the streets, desperate of shame and state,"
V,I,First Officer,"In private brabble did we apprehend him."
V,I,VIOLA,"He did me kindness, sir, drew on my side;"
V,I,VIOLA,"But in conclusion put strange speech upon me:"
V,I,VIOLA,"I know not what 'twas but distraction."
V,I,DUKE ORSINO,"Notable pirate! thou salt-water thief!"
V,I,DUKE ORSINO,"What foolish boldness brought thee to their mercies,"
V,I,DUKE ORSINO,"Whom thou, in terms so bloody and so dear,"
V,I,DUKE ORSINO,"Hast made thine enemies?"
V,I,ANTONIO,"Orsino, noble sir,"
V,I,ANTONIO,"Be pleased that I shake off these names you give me:"
V,I,ANTONIO,"Antonio never yet was thief or pirate,"
V,I,ANTONIO,"Though I confess, on base and ground enough,"
V,I,ANTONIO,"Orsino's enemy. A witchcraft drew me hither:"
V,I,ANTONIO,"That most ingrateful boy there by your side,"
V,I,ANTONIO,"From the rude sea's enraged and foamy mouth"
V,I,ANTONIO,"Did I redeem; a wreck past hope he was:"
V,I,ANTONIO,"His life I gave him and did thereto add"
V,I,ANTONIO,"My love, without retention or restraint,"
V,I,ANTONIO,"All his in dedication; for his sake"
V,I,ANTONIO,"Did I expose myself, pure for his love,"
V,I,ANTONIO,"Into the danger of this adverse town;"
V,I,ANTONIO,"Drew to defend him when he was beset:"
V,I,ANTONIO,"Where being apprehended, his false cunning,"
V,I,ANTONIO,"Not meaning to partake with me in danger,"
V,I,ANTONIO,"Taught him to face me out of his acquaintance,"
V,I,ANTONIO,"And grew a twenty years removed thing"
V,I,ANTONIO,"While one would wink; denied me mine own purse,"
V,I,ANTONIO,"Which I had recommended to his use"
V,I,ANTONIO,"Not half an hour before."
V,I,VIOLA,"How can this be?"
V,I,DUKE ORSINO,"When came he to this town?"
V,I,ANTONIO,"To-day, my lord; and for three months before,"
V,I,ANTONIO,"No interim, not a minute's vacancy,"
V,I,ANTONIO,"Both day and night did we keep company."
V,I,DUKE ORSINO,"Here comes the countess: now heaven walks on earth."
V,I,DUKE ORSINO,"But for thee, fellow; fellow, thy words are madness:"
V,I,DUKE ORSINO,"Three months this youth hath tended upon me;"
V,I,DUKE ORSINO,"But more of that anon. Take him aside."
V,I,OLIVIA,"What would my lord, but that he may not have,"
V,I,OLIVIA,"Wherein Olivia may seem serviceable?"
V,I,OLIVIA,"Cesario, you do not keep promise with me."
V,I,VIOLA,"Madam!"
V,I,DUKE ORSINO,"Gracious Olivia,--"
V,I,OLIVIA,"What do you say, Cesario? Good my lord,--"
V,I,VIOLA,"My lord would speak; my duty hushes me."
V,I,OLIVIA,"If it be aught to the old tune, my lord,"
V,I,OLIVIA,"It is as fat and fulsome to mine ear"
V,I,OLIVIA,"As howling after music."
V,I,DUKE ORSINO,"Still so cruel?"
V,I,OLIVIA,"Still so constant, lord."
V,I,DUKE ORSINO,"What, to perverseness? you uncivil lady,"
V,I,DUKE ORSINO,"To whose ingrate and unauspicious altars"
V,I,DUKE ORSINO,"My soul the faithfull'st offerings hath breathed out"
V,I,DUKE ORSINO,"That e'er devotion tender'd! What shall I do?"
V,I,OLIVIA,"Even what it please my lord, that shall become him."
V,I,DUKE ORSINO,"Why should I not, had I the heart to do it,"
V,I,DUKE ORSINO,"Like to the Egyptian thief at point of death,"
V,I,DUKE ORSINO,"Kill what I love?--a savage jealousy"
V,I,DUKE ORSINO,"That sometimes savours nobly. But hear me this:"
V,I,DUKE ORSINO,"Since you to non-regardance cast my faith,"
V,I,DUKE ORSINO,"And that I partly know the instrument"
V,I,DUKE ORSINO,"That screws me from my true place in your favour,"
V,I,DUKE ORSINO,"Live you the marble-breasted tyrant still;"
V,I,DUKE ORSINO,"But this your minion, whom I know you love,"
V,I,DUKE ORSINO,"And whom, by heaven I swear, I tender dearly,"
V,I,DUKE ORSINO,"Him will I tear out of that cruel eye,"
V,I,DUKE ORSINO,"Where he sits crowned in his master's spite."
V,I,DUKE ORSINO,"Come, boy, with me; my thoughts are ripe in mischief:"
V,I,DUKE ORSINO,"I'll sacrifice the lamb that I do love,"
V,I,DUKE ORSINO,"To spite a raven's heart within a dove."
V,I,VIOLA,"And I, most jocund, apt and willingly,"
V,I,VIOLA,"To do you rest, a thousand deaths would die."
V,I,OLIVIA,"Where goes Cesario?"
V,I,VIOLA,"After him I love"
V,I,VIOLA,"More than I love these eyes, more than my life,"
V,I,VIOLA,"More, by all mores, than e'er I shall love wife."
V,I,VIOLA,"If I do feign, you witnesses above"
V,I,VIOLA,"Punish my life for tainting of my love!"
V,I,OLIVIA,"Ay me, detested! how am I beguiled!"
V,I,VIOLA,"Who does beguile you? who does do you wrong?"
V,I,OLIVIA,"Hast thou forgot thyself? is it so long?"
V,I,OLIVIA,"Call forth the holy father."
V,I,DUKE ORSINO,"Come, away!"
V,I,OLIVIA,"Whither, my lord? Cesario, husband, stay."
V,I,DUKE ORSINO,"Husband!"
V,I,OLIVIA,"Ay, husband: can he that deny?"
V,I,DUKE ORSINO,"Her husband, sirrah!"
V,I,VIOLA,"No, my lord, not I."
V,I,OLIVIA,"Alas, it is the baseness of thy fear"
V,I,OLIVIA,"That makes thee strangle thy propriety:"
V,I,OLIVIA,"Fear not, Cesario; take thy fortunes up;"
V,I,OLIVIA,"Be that thou know'st thou art, and then thou art"
V,I,OLIVIA,"As great as that thou fear'st."
V,I,OLIVIA,"O, welcome, father!"
V,I,OLIVIA,"Father, I charge thee, by thy reverence,"
V,I,OLIVIA,"Here to unfold, though lately we intended"
V,I,OLIVIA,"To keep in darkness what occasion now"
V,I,OLIVIA,"Reveals before 'tis ripe, what thou dost know"
V,I,OLIVIA,"Hath newly pass'd between this youth and me."
V,I,Priest,"A contract of eternal bond of love,"
V,I,Priest,"Confirm'd by mutual joinder of your hands,"
V,I,Priest,"Attested by the holy close of lips,"
V,I,Priest,"Strengthen'd by interchangement of your rings;"
V,I,Priest,"And all the ceremony of this compact"
V,I,Priest,"Seal'd in my function, by my testimony:"
V,I,Priest,"Since when, my watch hath told me, toward my grave"
V,I,Priest,"I have travell'd but two hours."
V,I,DUKE ORSINO,"O thou dissembling cub! what wilt thou be"
V,I,DUKE ORSINO,"When time hath sow'd a grizzle on thy case?"
V,I,DUKE ORSINO,"Or will not else thy craft so quickly grow,"
V,I,DUKE ORSINO,"That thine own trip shall be thine overthrow?"
V,I,DUKE ORSINO,"Farewell, and take her; but direct thy feet"
V,I,DUKE ORSINO,"Where thou and I henceforth may never meet."
V,I,VIOLA,"My lord, I do protest--"
V,I,OLIVIA,"O, do not swear!"
V,I,OLIVIA,"Hold little faith, though thou hast too much fear."
V,I,SIR ANDREW,"For the love of God, a surgeon! Send one presently"
V,I,SIR ANDREW,"to Sir Toby."
V,I,OLIVIA,"What's the matter?"
V,I,SIR ANDREW,"He has broke my head across and has given Sir Toby"
V,I,SIR ANDREW,"a bloody coxcomb too: for the love of God, your"
V,I,SIR ANDREW,"help! I had rather than forty pound I were at home."
V,I,OLIVIA,"Who has done this, Sir Andrew?"
V,I,SIR ANDREW,"The count's gentleman, one Cesario: we took him for"
V,I,SIR ANDREW,"a coward, but he's the very devil incardinate."
V,I,DUKE ORSINO,"My gentleman, Cesario?"
V,I,SIR ANDREW,"'Od's lifelings, here he is! You broke my head for"
V,I,SIR ANDREW,"nothing; and that that I did, I was set on to do't"
V,I,SIR ANDREW,"by Sir Toby."
V,I,VIOLA,"Why do you speak to me? I never hurt you:"
V,I,VIOLA,"You drew your sword upon me without cause;"
V,I,VIOLA,"But I bespoke you fair, and hurt you not."
V,I,SIR ANDREW,"If a bloody coxcomb be a hurt, you have hurt me: I"
V,I,SIR ANDREW,"think you set nothing by a bloody coxcomb."
V,I,SIR ANDREW,"Here comes Sir Toby halting; you shall hear more:"
V,I,SIR ANDREW,"but if he had not been in drink, he would have"
V,I,SIR ANDREW,"tickled you othergates than he did."
V,I,DUKE ORSINO,"How now, gentleman! how is't with you?"
V,I,SIR TOBY BELCH,"That's all one: has hurt me, and there's the end"
V,I,SIR TOBY BELCH,"on't. Sot, didst see Dick surgeon, sot?"
V,I,Clown,"O, he's drunk, Sir Toby, an hour agone; his eyes"
V,I,Clown,"were set at eight i' the morning."
V,I,SIR TOBY BELCH,"Then he's a rogue, and a passy measures panyn: I"
V,I,SIR TOBY BELCH,"hate a drunken rogue."
V,I,OLIVIA,"Away with him! Who hath made this havoc with them?"
V,I,SIR ANDREW,"I'll help you, Sir Toby, because well be dressed together."
V,I,SIR TOBY BELCH,"Will you help? an ass-head and a coxcomb and a"
V,I,SIR TOBY BELCH,"knave, a thin-faced knave, a gull!"
