IV,IV,PERDITA,"Not yet on summer's death, nor on the birth"
IV,IV,PERDITA,"Of trembling winter, the fairest"
IV,IV,PERDITA,"flowers o' the season"
IV,IV,PERDITA,"Are our carnations and streak'd gillyvors,"
IV,IV,PERDITA,"Which some call nature's bastards: of that kind"
IV,IV,PERDITA,"Our rustic garden's barren; and I care not"
IV,IV,PERDITA,"To get slips of them."
IV,IV,POLIXENES,"Wherefore, gentle maiden,"
IV,IV,POLIXENES,"Do you neglect them?"
IV,IV,PERDITA,"For I have heard it said"
IV,IV,PERDITA,"There is an art which in their piedness shares"
IV,IV,PERDITA,"With great creating nature."
IV,IV,POLIXENES,"Say there be;"
IV,IV,POLIXENES,"Yet nature is made better by no mean"
IV,IV,POLIXENES,"But nature makes that mean: so, over that art"
IV,IV,POLIXENES,"Which you say adds to nature, is an art"
IV,IV,POLIXENES,"That nature makes. You see, sweet maid, we marry"
IV,IV,POLIXENES,"A gentler scion to the wildest stock,"
IV,IV,POLIXENES,"And make conceive a bark of baser kind"
IV,IV,POLIXENES,"By bud of nobler race: this is an art"
IV,IV,POLIXENES,"Which does mend nature, change it rather, but"
IV,IV,POLIXENES,"The art itself is nature."
IV,IV,PERDITA,"So it is."
IV,IV,POLIXENES,"Then make your garden rich in gillyvors,"
IV,IV,POLIXENES,"And do not call them bastards."
IV,IV,PERDITA,"I'll not put"
IV,IV,PERDITA,"The dibble in earth to set one slip of them;"
IV,IV,PERDITA,"No more than were I painted I would wish"
IV,IV,PERDITA,"This youth should say 'twere well and only therefore"
IV,IV,PERDITA,"Desire to breed by me. Here's flowers for you;"
IV,IV,PERDITA,"Hot lavender, mints, savoury, marjoram;"
IV,IV,PERDITA,"The marigold, that goes to bed wi' the sun"
IV,IV,PERDITA,"And with him rises weeping: these are flowers"
IV,IV,PERDITA,"Of middle summer, and I think they are given"
IV,IV,PERDITA,"To men of middle age. You're very welcome."
IV,IV,CAMILLO,"I should leave grazing, were I of your flock,"
IV,IV,CAMILLO,"And only live by gazing."
IV,IV,PERDITA,"Out, alas!"
IV,IV,PERDITA,"You'd be so lean, that blasts of January"
IV,IV,PERDITA,"Would blow you through and through."
IV,IV,PERDITA,"Now, my fair'st friend,"
IV,IV,PERDITA,"I would I had some flowers o' the spring that might"
IV,IV,PERDITA,"Become your time of day; and yours, and yours,"
IV,IV,PERDITA,"That wear upon your virgin branches yet"
IV,IV,PERDITA,"Your maidenheads growing: O Proserpina,"
IV,IV,PERDITA,"For the flowers now, that frighted thou let'st fall"
IV,IV,PERDITA,"From Dis's waggon! daffodils,"
IV,IV,PERDITA,"That come before the swallow dares, and take"
IV,IV,PERDITA,"The winds of March with beauty; violets dim,"
IV,IV,PERDITA,"But sweeter than the lids of Juno's eyes"
IV,IV,PERDITA,"Or Cytherea's breath; pale primroses"
IV,IV,PERDITA,"That die unmarried, ere they can behold"
IV,IV,PERDITA,"Bight Phoebus in his strength--a malady"
IV,IV,PERDITA,"Most incident to maids; bold oxlips and"
IV,IV,PERDITA,"The crown imperial; lilies of all kinds,"
IV,IV,PERDITA,"The flower-de-luce being one! O, these I lack,"
IV,IV,PERDITA,"To make you garlands of, and my sweet friend,"
IV,IV,PERDITA,"To strew him o'er and o'er!"
IV,IV,FLORIZEL,"What, like a corse?"
IV,IV,PERDITA,"No, like a bank for love to lie and play on;"
IV,IV,PERDITA,"Not like a corse; or if, not to be buried,"
IV,IV,PERDITA,"But quick and in mine arms. Come, take your flowers:"
IV,IV,PERDITA,"Methinks I play as I have seen them do"
IV,IV,PERDITA,"In Whitsun pastorals: sure this robe of mine"
IV,IV,PERDITA,"Does change my disposition."
IV,IV,FLORIZEL,"What you do"
IV,IV,FLORIZEL,"Still betters what is done. When you speak, sweet."
IV,IV,FLORIZEL,"I'ld have you do it ever: when you sing,"
IV,IV,FLORIZEL,"I'ld have you buy and sell so, so give alms,"
IV,IV,FLORIZEL,"Pray so; and, for the ordering your affairs,"
IV,IV,FLORIZEL,"To sing them too: when you do dance, I wish you"
IV,IV,FLORIZEL,"A wave o' the sea, that you might ever do"
IV,IV,FLORIZEL,"Nothing but that; move still, still so,"
IV,IV,FLORIZEL,"And own no other function: each your doing,"
IV,IV,FLORIZEL,"So singular in each particular,"
IV,IV,FLORIZEL,"Crowns what you are doing in the present deed,"
IV,IV,FLORIZEL,"That all your acts are queens."
IV,IV,PERDITA,"O Doricles,"
IV,IV,PERDITA,"Your praises are too large: but that your youth,"
IV,IV,PERDITA,"And the true blood which peepeth fairly through't,"
IV,IV,PERDITA,"Do plainly give you out an unstain'd shepherd,"
IV,IV,PERDITA,"With wisdom I might fear, my Doricles,"
IV,IV,PERDITA,"You woo'd me the false way."
IV,IV,FLORIZEL,"I think you have"
IV,IV,FLORIZEL,"As little skill to fear as I have purpose"
IV,IV,FLORIZEL,"To put you to't. But come; our dance, I pray:"
IV,IV,FLORIZEL,"Your hand, my Perdita: so turtles pair,"
IV,IV,FLORIZEL,"That never mean to part."
IV,IV,PERDITA,"I'll swear for 'em."
IV,IV,POLIXENES,"This is the prettiest low-born lass that ever"
IV,IV,POLIXENES,"Ran on the green-sward: nothing she does or seems"
IV,IV,POLIXENES,"But smacks of something greater than herself,"
IV,IV,POLIXENES,"Too noble for this place."
IV,IV,CAMILLO,"He tells her something"
IV,IV,CAMILLO,"That makes her blood look out: good sooth, she is"
IV,IV,CAMILLO,"The queen of curds and cream."
IV,IV,Clown,"Come on, strike up!"
IV,IV,DORCAS,"Mopsa must be your mistress: marry, garlic,"
IV,IV,DORCAS,"To mend her kissing with!"
IV,IV,MOPSA,"Now, in good time!"
IV,IV,Clown,"Not a word, a word; we stand upon our manners."
IV,IV,Clown,"Come, strike up!"
IV,IV,POLIXENES,"Pray, good shepherd, what fair swain is this"
IV,IV,POLIXENES,"Which dances with your daughter?"
IV,IV,Shepherd,"They call him Doricles; and boasts himself"
IV,IV,Shepherd,"To have a worthy feeding: but I have it"
IV,IV,Shepherd,"Upon his own report and I believe it;"
IV,IV,Shepherd,"He looks like sooth. He says he loves my daughter:"
IV,IV,Shepherd,"I think so too; for never gazed the moon"
IV,IV,Shepherd,"Upon the water as he'll stand and read"
IV,IV,Shepherd,"As 'twere my daughter's eyes: and, to be plain."
IV,IV,Shepherd,"I think there is not half a kiss to choose"
IV,IV,Shepherd,"Who loves another best."
IV,IV,POLIXENES,"She dances featly."
IV,IV,Shepherd,"So she does any thing; though I report it,"
IV,IV,Shepherd,"That should be silent: if young Doricles"
IV,IV,Shepherd,"Do light upon her, she shall bring him that"
IV,IV,Shepherd,"Which he not dreams of."
IV,IV,Servant,"O master, if you did but hear the pedlar at the"
IV,IV,Servant,"door, you would never dance again after a tabour and"
IV,IV,Servant,"pipe; no, the bagpipe could not move you: he sings"
IV,IV,Servant,"several tunes faster than you'll tell money; he"
IV,IV,Servant,"utters them as he had eaten ballads and all men's"
IV,IV,Servant,"ears grew to his tunes."
IV,IV,Clown,"He could never come better; he shall come in. I"
IV,IV,Clown,"love a ballad but even too well, if it be doleful"
IV,IV,Clown,"matter merrily set down, or a very pleasant thing"
IV,IV,Clown,"indeed and sung lamentably."
IV,IV,Servant,"He hath songs for man or woman, of all sizes; no"
IV,IV,Servant,"milliner can so fit his customers with gloves: he"
IV,IV,Servant,"has the prettiest love-songs for maids; so without"
IV,IV,Servant,"bawdry, which is strange; with such delicate"
IV,IV,Servant,"burthens of dildos and fadings, 'jump her and thump"
IV,IV,Servant,"her;' and where some stretch-mouthed rascal would,"
IV,IV,Servant,"as it were, mean mischief and break a foul gap into"
IV,IV,Servant,"the matter, he makes the maid to answer 'Whoop, do me"
IV,IV,Servant,"no harm, good man;' puts him off, slights him, with"
IV,IV,Servant,"'Whoop, do me no harm, good man.'"
IV,IV,POLIXENES,"This is a brave fellow."
IV,IV,Clown,"Believe me, thou talkest of an admirable conceited"
IV,IV,Clown,"fellow. Has he any unbraided wares?"
IV,IV,Servant,"He hath ribbons of an the colours i' the rainbow;"
IV,IV,Servant,"points more than all the lawyers in Bohemia can"
IV,IV,Servant,"learnedly handle, though they come to him by the"
IV,IV,Servant,"gross: inkles, caddisses, cambrics, lawns: why, he"
IV,IV,Servant,"sings 'em over as they were gods or goddesses; you"
IV,IV,Servant,"would think a smock were a she-angel, he so chants"
IV,IV,Servant,"to the sleeve-hand and the work about the square on't."
IV,IV,Clown,"Prithee bring him in; and let him approach singing."
IV,IV,PERDITA,"Forewarn him that he use no scurrilous words in 's tunes."
IV,IV,Clown,"You have of these pedlars, that have more in them"
IV,IV,Clown,"than you'ld think, sister."
IV,IV,PERDITA,"Ay, good brother, or go about to think."
IV,IV,AUTOLYCUS,"Lawn as white as driven snow;"
IV,IV,AUTOLYCUS,"Cyprus black as e'er was crow;"
IV,IV,AUTOLYCUS,"Gloves as sweet as damask roses;"
IV,IV,AUTOLYCUS,"Masks for faces and for noses;"
IV,IV,AUTOLYCUS,"Bugle bracelet, necklace amber,"
IV,IV,AUTOLYCUS,"Perfume for a lady's chamber;"
IV,IV,AUTOLYCUS,"Golden quoifs and stomachers,"
IV,IV,AUTOLYCUS,"For my lads to give their dears:"
IV,IV,AUTOLYCUS,"Pins and poking-sticks of steel,"
IV,IV,AUTOLYCUS,"What maids lack from head to heel:"
IV,IV,AUTOLYCUS,"Come buy of me, come; come buy, come buy;"
IV,IV,AUTOLYCUS,"Buy lads, or else your lasses cry: Come buy."
IV,IV,Clown,"If I were not in love with Mopsa, thou shouldst take"
IV,IV,Clown,"no money of me; but being enthralled as I am, it"
IV,IV,Clown,"will also be the bondage of certain ribbons and gloves."
IV,IV,MOPSA,"I was promised them against the feast; but they come"
IV,IV,MOPSA,"not too late now."
IV,IV,DORCAS,"He hath promised you more than that, or there be liars."
IV,IV,MOPSA,"He hath paid you all he promised you; may be, he has"
IV,IV,MOPSA,"paid you more, which will shame you to give him again."
IV,IV,Clown,"Is there no manners left among maids? will they"
IV,IV,Clown,"wear their plackets where they should bear their"
IV,IV,Clown,"faces? Is there not milking-time, when you are"
IV,IV,Clown,"going to bed, or kiln-hole, to whistle off these"
IV,IV,Clown,"secrets, but you must be tittle-tattling before all"
IV,IV,Clown,"our guests? 'tis well they are whispering: clamour"
IV,IV,Clown,"your tongues, and not a word more."
IV,IV,MOPSA,"I have done. Come, you promised me a tawdry-lace"
IV,IV,MOPSA,"and a pair of sweet gloves."
IV,IV,Clown,"Have I not told thee how I was cozened by the way"
IV,IV,Clown,"and lost all my money?"
IV,IV,AUTOLYCUS,"And indeed, sir, there are cozeners abroad;"
IV,IV,AUTOLYCUS,"therefore it behoves men to be wary."
IV,IV,Clown,"Fear not thou, man, thou shalt lose nothing here."
IV,IV,AUTOLYCUS,"I hope so, sir; for I have about me many parcels of charge."
IV,IV,Clown,"What hast here? ballads?"
IV,IV,MOPSA,"Pray now, buy some: I love a ballad in print o'"
IV,IV,MOPSA,"life, for then we are sure they are true."
IV,IV,AUTOLYCUS,"Here's one to a very doleful tune, how a usurer's"
IV,IV,AUTOLYCUS,"wife was brought to bed of twenty money-bags at a"
IV,IV,AUTOLYCUS,"burthen and how she longed to eat adders' heads and"
IV,IV,AUTOLYCUS,"toads carbonadoed."
IV,IV,MOPSA,"Is it true, think you?"
IV,IV,AUTOLYCUS,"Very true, and but a month old."
IV,IV,DORCAS,"Bless me from marrying a usurer!"
IV,IV,AUTOLYCUS,"Here's the midwife's name to't, one Mistress"
IV,IV,AUTOLYCUS,"Tale-porter, and five or six honest wives that were"
IV,IV,AUTOLYCUS,"present. Why should I carry lies abroad?"
IV,IV,MOPSA,"Pray you now, buy it."
IV,IV,Clown,"Come on, lay it by: and let's first see moe"
IV,IV,Clown,"ballads; we'll buy the other things anon."
IV,IV,AUTOLYCUS,"Here's another ballad of a fish, that appeared upon"
IV,IV,AUTOLYCUS,"the coast on Wednesday the four-score of April,"
IV,IV,AUTOLYCUS,"forty thousand fathom above water, and sung this"
IV,IV,AUTOLYCUS,"ballad against the hard hearts of maids: it was"
IV,IV,AUTOLYCUS,"thought she was a woman and was turned into a cold"
IV,IV,AUTOLYCUS,"fish for she would not exchange flesh with one that"
IV,IV,AUTOLYCUS,"loved her: the ballad is very pitiful and as true."
IV,IV,DORCAS,"Is it true too, think you?"
IV,IV,AUTOLYCUS,"Five justices' hands at it, and witnesses more than"
IV,IV,AUTOLYCUS,"my pack will hold."
IV,IV,Clown,"Lay it by too: another."
IV,IV,AUTOLYCUS,"This is a merry ballad, but a very pretty one."
IV,IV,MOPSA,"Let's have some merry ones."
IV,IV,AUTOLYCUS,"Why, this is a passing merry one and goes to"
IV,IV,AUTOLYCUS,"the tune of 'Two maids wooing a man:' there's"
IV,IV,AUTOLYCUS,"scarce a maid westward but she sings it; 'tis in"
IV,IV,AUTOLYCUS,"request, I can tell you."
IV,IV,MOPSA,"We can both sing it: if thou'lt bear a part, thou"
IV,IV,MOPSA,"shalt hear; 'tis in three parts."
IV,IV,DORCAS,"We had the tune on't a month ago."
IV,IV,AUTOLYCUS,"I can bear my part; you must know 'tis my"
IV,IV,AUTOLYCUS,"occupation; have at it with you."
IV,IV,AUTOLYCUS,"Get you hence, for I must go"
IV,IV,AUTOLYCUS,"Where it fits not you to know."
IV,IV,DORCAS,"Whither?"
IV,IV,MOPSA,"O, whither?"
IV,IV,DORCAS,"Whither?"
IV,IV,MOPSA,"It becomes thy oath full well,"
IV,IV,MOPSA,"Thou to me thy secrets tell."
IV,IV,DORCAS,"Me too, let me go thither."
IV,IV,MOPSA,"Or thou goest to the orange or mill."
IV,IV,DORCAS,"If to either, thou dost ill."
IV,IV,AUTOLYCUS,"Neither."
IV,IV,DORCAS,"What, neither?"
IV,IV,AUTOLYCUS,"Neither."
IV,IV,DORCAS,"Thou hast sworn my love to be."
IV,IV,MOPSA,"Thou hast sworn it more to me:"
IV,IV,MOPSA,"Then whither goest? say, whither?"
IV,IV,Clown,"We'll have this song out anon by ourselves: my"
IV,IV,Clown,"father and the gentlemen are in sad talk, and we'll"
IV,IV,Clown,"not trouble them. Come, bring away thy pack after"
IV,IV,Clown,"me. Wenches, I'll buy for you both. Pedlar, let's"
IV,IV,Clown,"have the first choice. Follow me, girls."
IV,IV,AUTOLYCUS,"And you shall pay well for 'em."
IV,IV,AUTOLYCUS,"Will you buy any tape,"
IV,IV,AUTOLYCUS,"Or lace for your cape,"
IV,IV,AUTOLYCUS,"My dainty duck, my dear-a?"
IV,IV,AUTOLYCUS,"Any silk, any thread,"
IV,IV,AUTOLYCUS,"Any toys for your head,"
IV,IV,AUTOLYCUS,"Of the new'st and finest, finest wear-a?"
IV,IV,AUTOLYCUS,"Come to the pedlar;"
IV,IV,AUTOLYCUS,"Money's a medler."
IV,IV,AUTOLYCUS,"That doth utter all men's ware-a."
IV,IV,Servant,"Master, there is three carters, three shepherds,"
IV,IV,Servant,"three neat-herds, three swine-herds, that have made"
IV,IV,Servant,"themselves all men of hair, they call themselves"
IV,IV,Servant,"Saltiers, and they have a dance which the wenches"
IV,IV,Servant,"say is a gallimaufry of gambols, because they are"
IV,IV,Servant,"not in't; but they themselves are o' the mind, if it"
IV,IV,Servant,"be not too rough for some that know little but"
IV,IV,Servant,"bowling, it will please plentifully."
IV,IV,Shepherd,"Away! we'll none on 't: here has been too much"
IV,IV,Shepherd,"homely foolery already. I know, sir, we weary you."
IV,IV,POLIXENES,"You weary those that refresh us: pray, let's see"
IV,IV,POLIXENES,"these four threes of herdsmen."
IV,IV,Servant,"One three of them, by their own report, sir, hath"
IV,IV,Servant,"danced before the king; and not the worst of the"
IV,IV,Servant,"three but jumps twelve foot and a half by the squier."
IV,IV,Shepherd,"Leave your prating: since these good men are"
IV,IV,Shepherd,"pleased, let them come in; but quickly now."
IV,IV,Servant,"Why, they stay at door, sir."
IV,IV,POLIXENES,"O, father, you'll know more of that hereafter."
IV,IV,POLIXENES,"Is it not too far gone? 'Tis time to part them."
IV,IV,POLIXENES,"He's simple and tells much."
IV,IV,POLIXENES,"How now, fair shepherd!"
IV,IV,POLIXENES,"Your heart is full of something that does take"
IV,IV,POLIXENES,"Your mind from feasting. Sooth, when I was young"
IV,IV,POLIXENES,"And handed love as you do, I was wont"
IV,IV,POLIXENES,"To load my she with knacks: I would have ransack'd"
IV,IV,POLIXENES,"The pedlar's silken treasury and have pour'd it"
IV,IV,POLIXENES,"To her acceptance; you have let him go"
IV,IV,POLIXENES,"And nothing marted with him. If your lass"
IV,IV,POLIXENES,"Interpretation should abuse and call this"
IV,IV,POLIXENES,"Your lack of love or bounty, you were straited"
IV,IV,POLIXENES,"For a reply, at least if you make a care"
IV,IV,POLIXENES,"Of happy holding her."
IV,IV,FLORIZEL,"Old sir, I know"
IV,IV,FLORIZEL,"She prizes not such trifles as these are:"
IV,IV,FLORIZEL,"The gifts she looks from me are pack'd and lock'd"
IV,IV,FLORIZEL,"Up in my heart; which I have given already,"
IV,IV,FLORIZEL,"But not deliver'd. O, hear me breathe my life"
IV,IV,FLORIZEL,"Before this ancient sir, who, it should seem,"
IV,IV,FLORIZEL,"Hath sometime loved! I take thy hand, this hand,"
IV,IV,FLORIZEL,"As soft as dove's down and as white as it,"
IV,IV,FLORIZEL,"Or Ethiopian's tooth, or the fann'd"
IV,IV,FLORIZEL,"snow that's bolted"
IV,IV,FLORIZEL,"By the northern blasts twice o'er."
IV,IV,POLIXENES,"What follows this?"
IV,IV,POLIXENES,"How prettily the young swain seems to wash"
IV,IV,POLIXENES,"The hand was fair before! I have put you out:"
IV,IV,POLIXENES,"But to your protestation; let me hear"
IV,IV,POLIXENES,"What you profess."
IV,IV,FLORIZEL,"Do, and be witness to 't."
IV,IV,POLIXENES,"And this my neighbour too?"
IV,IV,FLORIZEL,"And he, and more"
IV,IV,FLORIZEL,"Than he, and men, the earth, the heavens, and all:"
IV,IV,FLORIZEL,"That, were I crown'd the most imperial monarch,"
IV,IV,FLORIZEL,"Thereof most worthy, were I the fairest youth"
IV,IV,FLORIZEL,"That ever made eye swerve, had force and knowledge"
IV,IV,FLORIZEL,"More than was ever man's, I would not prize them"
IV,IV,FLORIZEL,"Without her love; for her employ them all;"
IV,IV,FLORIZEL,"Commend them and condemn them to her service"
IV,IV,FLORIZEL,"Or to their own perdition."
IV,IV,POLIXENES,"Fairly offer'd."
IV,IV,CAMILLO,"This shows a sound affection."
IV,IV,Shepherd,"But, my daughter,"
IV,IV,Shepherd,"Say you the like to him?"
IV,IV,PERDITA,"I cannot speak"
IV,IV,PERDITA,"So well, nothing so well; no, nor mean better:"
IV,IV,PERDITA,"By the pattern of mine own thoughts I cut out"
IV,IV,PERDITA,"The purity of his."
IV,IV,Shepherd,"Take hands, a bargain!"
IV,IV,Shepherd,"And, friends unknown, you shall bear witness to 't:"
IV,IV,Shepherd,"I give my daughter to him, and will make"
IV,IV,Shepherd,"Her portion equal his."
IV,IV,FLORIZEL,"O, that must be"
IV,IV,FLORIZEL,"I' the virtue of your daughter: one being dead,"
IV,IV,FLORIZEL,"I shall have more than you can dream of yet;"
IV,IV,FLORIZEL,"Enough then for your wonder. But, come on,"
IV,IV,FLORIZEL,"Contract us 'fore these witnesses."
IV,IV,Shepherd,"Come, your hand;"
IV,IV,Shepherd,"And, daughter, yours."
IV,IV,POLIXENES,"Soft, swain, awhile, beseech you;"
IV,IV,POLIXENES,"Have you a father?"
IV,IV,FLORIZEL,"I have: but what of him?"
IV,IV,POLIXENES,"Knows he of this?"
IV,IV,FLORIZEL,"He neither does nor shall."
IV,IV,POLIXENES,"Methinks a father"
IV,IV,POLIXENES,"Is at the nuptial of his son a guest"
IV,IV,POLIXENES,"That best becomes the table. Pray you once more,"
IV,IV,POLIXENES,"Is not your father grown incapable"
IV,IV,POLIXENES,"Of reasonable affairs? is he not stupid"
IV,IV,POLIXENES,"With age and altering rheums? can he speak? hear?"
IV,IV,POLIXENES,"Know man from man? dispute his own estate?"
IV,IV,POLIXENES,"Lies he not bed-rid? and again does nothing"
IV,IV,POLIXENES,"But what he did being childish?"
IV,IV,FLORIZEL,"No, good sir;"
IV,IV,FLORIZEL,"He has his health and ampler strength indeed"
IV,IV,FLORIZEL,"Than most have of his age."
IV,IV,POLIXENES,"By my white beard,"
IV,IV,POLIXENES,"You offer him, if this be so, a wrong"
IV,IV,POLIXENES,"Something unfilial: reason my son"
IV,IV,POLIXENES,"Should choose himself a wife, but as good reason"
IV,IV,POLIXENES,"The father, all whose joy is nothing else"
IV,IV,POLIXENES,"But fair posterity, should hold some counsel"
IV,IV,POLIXENES,"In such a business."
IV,IV,FLORIZEL,"I yield all this;"
IV,IV,FLORIZEL,"But for some other reasons, my grave sir,"
IV,IV,FLORIZEL,"Which 'tis not fit you know, I not acquaint"
IV,IV,FLORIZEL,"My father of this business."
IV,IV,POLIXENES,"Let him know't."
IV,IV,FLORIZEL,"He shall not."
IV,IV,POLIXENES,"Prithee, let him."
IV,IV,FLORIZEL,"No, he must not."
IV,IV,Shepherd,"Let him, my son: he shall not need to grieve"
IV,IV,Shepherd,"At knowing of thy choice."
IV,IV,FLORIZEL,"Come, come, he must not."
IV,IV,FLORIZEL,"Mark our contract."
IV,IV,POLIXENES,"Mark your divorce, young sir,"
IV,IV,POLIXENES,"Whom son I dare not call; thou art too base"
IV,IV,POLIXENES,"To be acknowledged: thou a sceptre's heir,"
IV,IV,POLIXENES,"That thus affect'st a sheep-hook! Thou old traitor,"
IV,IV,POLIXENES,"I am sorry that by hanging thee I can"
IV,IV,POLIXENES,"But shorten thy life one week. And thou, fresh piece"
IV,IV,POLIXENES,"Of excellent witchcraft, who of force must know"
IV,IV,POLIXENES,"The royal fool thou copest with,--"
IV,IV,Shepherd,"O, my heart!"
IV,IV,POLIXENES,"I'll have thy beauty scratch'd with briers, and made"
IV,IV,POLIXENES,"More homely than thy state. For thee, fond boy,"
IV,IV,POLIXENES,"If I may ever know thou dost but sigh"
IV,IV,POLIXENES,"That thou no more shalt see this knack, as never"
IV,IV,POLIXENES,"I mean thou shalt, we'll bar thee from succession;"
IV,IV,POLIXENES,"Not hold thee of our blood, no, not our kin,"
IV,IV,POLIXENES,"Far than Deucalion off: mark thou my words:"
IV,IV,POLIXENES,"Follow us to the court. Thou churl, for this time,"
IV,IV,POLIXENES,"Though full of our displeasure, yet we free thee"
IV,IV,POLIXENES,"From the dead blow of it. And you, enchantment.--"
IV,IV,POLIXENES,"Worthy enough a herdsman: yea, him too,"
IV,IV,POLIXENES,"That makes himself, but for our honour therein,"
IV,IV,POLIXENES,"Unworthy thee,--if ever henceforth thou"
IV,IV,POLIXENES,"These rural latches to his entrance open,"
IV,IV,POLIXENES,"Or hoop his body more with thy embraces,"
IV,IV,POLIXENES,"I will devise a death as cruel for thee"
IV,IV,POLIXENES,"As thou art tender to't."
IV,IV,PERDITA,"Even here undone!"
IV,IV,PERDITA,"I was not much afeard; for once or twice"
IV,IV,PERDITA,"I was about to speak and tell him plainly,"
IV,IV,PERDITA,"The selfsame sun that shines upon his court"
IV,IV,PERDITA,"Hides not his visage from our cottage but"
IV,IV,PERDITA,"Looks on alike. Will't please you, sir, be gone?"
IV,IV,PERDITA,"I told you what would come of this: beseech you,"
IV,IV,PERDITA,"Of your own state take care: this dream of mine,--"
IV,IV,PERDITA,"Being now awake, I'll queen it no inch farther,"
IV,IV,PERDITA,"But milk my ewes and weep."
IV,IV,CAMILLO,"Why, how now, father!"
IV,IV,CAMILLO,"Speak ere thou diest."
IV,IV,Shepherd,"I cannot speak, nor think"
IV,IV,Shepherd,"Nor dare to know that which I know. O sir!"
IV,IV,Shepherd,"You have undone a man of fourscore three,"
IV,IV,Shepherd,"That thought to fill his grave in quiet, yea,"
IV,IV,Shepherd,"To die upon the bed my father died,"
IV,IV,Shepherd,"To lie close by his honest bones: but now"
IV,IV,Shepherd,"Some hangman must put on my shroud and lay me"
IV,IV,Shepherd,"Where no priest shovels in dust. O cursed wretch,"
IV,IV,Shepherd,"That knew'st this was the prince,"
IV,IV,Shepherd,"and wouldst adventure"
IV,IV,Shepherd,"To mingle faith with him! Undone! undone!"
IV,IV,Shepherd,"If I might die within this hour, I have lived"
IV,IV,Shepherd,"To die when I desire."
IV,IV,FLORIZEL,"Why look you so upon me?"
IV,IV,FLORIZEL,"I am but sorry, not afeard; delay'd,"
IV,IV,FLORIZEL,"But nothing alter'd: what I was, I am;"
IV,IV,FLORIZEL,"More straining on for plucking back, not following"
IV,IV,FLORIZEL,"My leash unwillingly."
IV,IV,CAMILLO,"Gracious my lord,"
IV,IV,CAMILLO,"You know your father's temper: at this time"
IV,IV,CAMILLO,"He will allow no speech, which I do guess"
IV,IV,CAMILLO,"You do not purpose to him; and as hardly"
IV,IV,CAMILLO,"Will he endure your sight as yet, I fear:"
IV,IV,CAMILLO,"Then, till the fury of his highness settle,"
IV,IV,CAMILLO,"Come not before him."
IV,IV,FLORIZEL,"I not purpose it."
IV,IV,FLORIZEL,"I think, Camillo?"
IV,IV,CAMILLO,"Even he, my lord."
IV,IV,PERDITA,"How often have I told you 'twould be thus!"
IV,IV,PERDITA,"How often said, my dignity would last"
IV,IV,PERDITA,"But till 'twere known!"
IV,IV,FLORIZEL,"It cannot fail but by"
IV,IV,FLORIZEL,"The violation of my faith; and then"
IV,IV,FLORIZEL,"Let nature crush the sides o' the earth together"
IV,IV,FLORIZEL,"And mar the seeds within! Lift up thy looks:"
IV,IV,FLORIZEL,"From my succession wipe me, father; I"
IV,IV,FLORIZEL,"Am heir to my affection."
IV,IV,CAMILLO,"Be advised."
IV,IV,FLORIZEL,"I am, and by my fancy: if my reason"
IV,IV,FLORIZEL,"Will thereto be obedient, I have reason;"
IV,IV,FLORIZEL,"If not, my senses, better pleased with madness,"
IV,IV,FLORIZEL,"Do bid it welcome."
IV,IV,CAMILLO,"This is desperate, sir."
IV,IV,FLORIZEL,"So call it: but it does fulfil my vow;"
IV,IV,FLORIZEL,"I needs must think it honesty. Camillo,"
IV,IV,FLORIZEL,"Not for Bohemia, nor the pomp that may"
IV,IV,FLORIZEL,"Be thereat glean'd, for all the sun sees or"
IV,IV,FLORIZEL,"The close earth wombs or the profound sea hides"
IV,IV,FLORIZEL,"In unknown fathoms, will I break my oath"
IV,IV,FLORIZEL,"To this my fair beloved: therefore, I pray you,"
IV,IV,FLORIZEL,"As you have ever been my father's honour'd friend,"
IV,IV,FLORIZEL,"When he shall miss me,--as, in faith, I mean not"
IV,IV,FLORIZEL,"To see him any more,--cast your good counsels"
IV,IV,FLORIZEL,"Upon his passion; let myself and fortune"
IV,IV,FLORIZEL,"Tug for the time to come. This you may know"
IV,IV,FLORIZEL,"And so deliver, I am put to sea"
IV,IV,FLORIZEL,"With her whom here I cannot hold on shore;"
IV,IV,FLORIZEL,"And most opportune to our need I have"
IV,IV,FLORIZEL,"A vessel rides fast by, but not prepared"
IV,IV,FLORIZEL,"For this design. What course I mean to hold"
IV,IV,FLORIZEL,"Shall nothing benefit your knowledge, nor"
IV,IV,FLORIZEL,"Concern me the reporting."
IV,IV,CAMILLO,"O my lord!"
IV,IV,CAMILLO,"I would your spirit were easier for advice,"
IV,IV,CAMILLO,"Or stronger for your need."
IV,IV,FLORIZEL,"Hark, Perdita"
IV,IV,FLORIZEL,"I'll hear you by and by."
IV,IV,CAMILLO,"He's irremoveable,"
