IV,IV,CAMILLO,"Resolved for flight. Now were I happy, if"
IV,IV,CAMILLO,"His going I could frame to serve my turn,"
IV,IV,CAMILLO,"Save him from danger, do him love and honour,"
IV,IV,CAMILLO,"Purchase the sight again of dear Sicilia"
IV,IV,CAMILLO,"And that unhappy king, my master, whom"
IV,IV,CAMILLO,"I so much thirst to see."
IV,IV,FLORIZEL,"Now, good Camillo;"
IV,IV,FLORIZEL,"I am so fraught with curious business that"
IV,IV,FLORIZEL,"I leave out ceremony."
IV,IV,CAMILLO,"Sir, I think"
IV,IV,CAMILLO,"You have heard of my poor services, i' the love"
IV,IV,CAMILLO,"That I have borne your father?"
IV,IV,FLORIZEL,"Very nobly"
IV,IV,FLORIZEL,"Have you deserved: it is my father's music"
IV,IV,FLORIZEL,"To speak your deeds, not little of his care"
IV,IV,FLORIZEL,"To have them recompensed as thought on."
IV,IV,CAMILLO,"Well, my lord,"
IV,IV,CAMILLO,"If you may please to think I love the king"
IV,IV,CAMILLO,"And through him what is nearest to him, which is"
IV,IV,CAMILLO,"Your gracious self, embrace but my direction:"
IV,IV,CAMILLO,"If your more ponderous and settled project"
IV,IV,CAMILLO,"May suffer alteration, on mine honour,"
IV,IV,CAMILLO,"I'll point you where you shall have such receiving"
IV,IV,CAMILLO,"As shall become your highness; where you may"
IV,IV,CAMILLO,"Enjoy your mistress, from the whom, I see,"
IV,IV,CAMILLO,"There's no disjunction to be made, but by--"
IV,IV,CAMILLO,"As heavens forefend!--your ruin; marry her,"
IV,IV,CAMILLO,"And, with my best endeavours in your absence,"
IV,IV,CAMILLO,"Your discontenting father strive to qualify"
IV,IV,CAMILLO,"And bring him up to liking."
IV,IV,FLORIZEL,"How, Camillo,"
IV,IV,FLORIZEL,"May this, almost a miracle, be done?"
IV,IV,FLORIZEL,"That I may call thee something more than man"
IV,IV,FLORIZEL,"And after that trust to thee."
IV,IV,CAMILLO,"Have you thought on"
IV,IV,CAMILLO,"A place whereto you'll go?"
IV,IV,FLORIZEL,"Not any yet:"
IV,IV,FLORIZEL,"But as the unthought-on accident is guilty"
IV,IV,FLORIZEL,"To what we wildly do, so we profess"
IV,IV,FLORIZEL,"Ourselves to be the slaves of chance and flies"
IV,IV,FLORIZEL,"Of every wind that blows."
IV,IV,CAMILLO,"Then list to me:"
IV,IV,CAMILLO,"This follows, if you will not change your purpose"
IV,IV,CAMILLO,"But undergo this flight, make for Sicilia,"
IV,IV,CAMILLO,"And there present yourself and your fair princess,"
IV,IV,CAMILLO,"For so I see she must be, 'fore Leontes:"
IV,IV,CAMILLO,"She shall be habited as it becomes"
IV,IV,CAMILLO,"The partner of your bed. Methinks I see"
IV,IV,CAMILLO,"Leontes opening his free arms and weeping"
IV,IV,CAMILLO,"His welcomes forth; asks thee the son forgiveness,"
IV,IV,CAMILLO,"As 'twere i' the father's person; kisses the hands"
IV,IV,CAMILLO,"Of your fresh princess; o'er and o'er divides him"
IV,IV,CAMILLO,"'Twixt his unkindness and his kindness; the one"
IV,IV,CAMILLO,"He chides to hell and bids the other grow"
IV,IV,CAMILLO,"Faster than thought or time."
IV,IV,FLORIZEL,"Worthy Camillo,"
IV,IV,FLORIZEL,"What colour for my visitation shall I"
IV,IV,FLORIZEL,"Hold up before him?"
IV,IV,CAMILLO,"Sent by the king your father"
IV,IV,CAMILLO,"To greet him and to give him comforts. Sir,"
IV,IV,CAMILLO,"The manner of your bearing towards him, with"
IV,IV,CAMILLO,"What you as from your father shall deliver,"
IV,IV,CAMILLO,"Things known betwixt us three, I'll write you down:"
IV,IV,CAMILLO,"The which shall point you forth at every sitting"
IV,IV,CAMILLO,"What you must say; that he shall not perceive"
IV,IV,CAMILLO,"But that you have your father's bosom there"
IV,IV,CAMILLO,"And speak his very heart."
IV,IV,FLORIZEL,"I am bound to you:"
IV,IV,FLORIZEL,"There is some sap in this."
IV,IV,CAMILLO,"A cause more promising"
IV,IV,CAMILLO,"Than a wild dedication of yourselves"
IV,IV,CAMILLO,"To unpath'd waters, undream'd shores, most certain"
IV,IV,CAMILLO,"To miseries enough; no hope to help you,"
IV,IV,CAMILLO,"But as you shake off one to take another;"
IV,IV,CAMILLO,"Nothing so certain as your anchors, who"
IV,IV,CAMILLO,"Do their best office, if they can but stay you"
IV,IV,CAMILLO,"Where you'll be loath to be: besides you know"
IV,IV,CAMILLO,"Prosperity's the very bond of love,"
IV,IV,CAMILLO,"Whose fresh complexion and whose heart together"
IV,IV,CAMILLO,"Affliction alters."
IV,IV,PERDITA,"One of these is true:"
IV,IV,PERDITA,"I think affliction may subdue the cheek,"
IV,IV,PERDITA,"But not take in the mind."
IV,IV,CAMILLO,"Yea, say you so?"
IV,IV,CAMILLO,"There shall not at your father's house these"
IV,IV,CAMILLO,"seven years"
IV,IV,CAMILLO,"Be born another such."
IV,IV,FLORIZEL,"My good Camillo,"
IV,IV,FLORIZEL,"She is as forward of her breeding as"
IV,IV,FLORIZEL,"She is i' the rear our birth."
IV,IV,CAMILLO,"I cannot say 'tis pity"
IV,IV,CAMILLO,"She lacks instructions, for she seems a mistress"
IV,IV,CAMILLO,"To most that teach."
IV,IV,PERDITA,"Your pardon, sir; for this"
IV,IV,PERDITA,"I'll blush you thanks."
IV,IV,FLORIZEL,"My prettiest Perdita!"
IV,IV,FLORIZEL,"But O, the thorns we stand upon! Camillo,"
IV,IV,FLORIZEL,"Preserver of my father, now of me,"
IV,IV,FLORIZEL,"The medicine of our house, how shall we do?"
IV,IV,FLORIZEL,"We are not furnish'd like Bohemia's son,"
IV,IV,FLORIZEL,"Nor shall appear in Sicilia."
IV,IV,CAMILLO,"My lord,"
IV,IV,CAMILLO,"Fear none of this: I think you know my fortunes"
IV,IV,CAMILLO,"Do all lie there: it shall be so my care"
IV,IV,CAMILLO,"To have you royally appointed as if"
IV,IV,CAMILLO,"The scene you play were mine. For instance, sir,"
IV,IV,CAMILLO,"That you may know you shall not want, one word."
IV,IV,AUTOLYCUS,"Ha, ha! what a fool Honesty is! and Trust, his"
IV,IV,AUTOLYCUS,"sworn brother, a very simple gentleman! I have sold"
IV,IV,AUTOLYCUS,"all my trumpery; not a counterfeit stone, not a"
IV,IV,AUTOLYCUS,"ribbon, glass, pomander, brooch, table-book, ballad,"
IV,IV,AUTOLYCUS,"knife, tape, glove, shoe-tie, bracelet, horn-ring,"
IV,IV,AUTOLYCUS,"to keep my pack from fasting: they throng who"
IV,IV,AUTOLYCUS,"should buy first, as if my trinkets had been"
IV,IV,AUTOLYCUS,"hallowed and brought a benediction to the buyer:"
IV,IV,AUTOLYCUS,"by which means I saw whose purse was best in"
IV,IV,AUTOLYCUS,"picture; and what I saw, to my good use I"
IV,IV,AUTOLYCUS,"remembered. My clown, who wants but something to"
IV,IV,AUTOLYCUS,"be a reasonable man, grew so in love with the"
IV,IV,AUTOLYCUS,"wenches' song, that he would not stir his pettitoes"
IV,IV,AUTOLYCUS,"till he had both tune and words; which so drew the"
IV,IV,AUTOLYCUS,"rest of the herd to me that all their other senses"
IV,IV,AUTOLYCUS,"stuck in ears: you might have pinched a placket, it"
IV,IV,AUTOLYCUS,"was senseless; 'twas nothing to geld a codpiece of a"
IV,IV,AUTOLYCUS,"purse; I could have filed keys off that hung in"
IV,IV,AUTOLYCUS,"chains: no hearing, no feeling, but my sir's song,"
IV,IV,AUTOLYCUS,"and admiring the nothing of it. So that in this"
IV,IV,AUTOLYCUS,"time of lethargy I picked and cut most of their"
IV,IV,AUTOLYCUS,"festival purses; and had not the old man come in"
IV,IV,AUTOLYCUS,"with a whoo-bub against his daughter and the king's"
IV,IV,AUTOLYCUS,"son and scared my choughs from the chaff, I had not"
IV,IV,AUTOLYCUS,"left a purse alive in the whole army."
IV,IV,CAMILLO,"Nay, but my letters, by this means being there"
IV,IV,CAMILLO,"So soon as you arrive, shall clear that doubt."
IV,IV,FLORIZEL,"And those that you'll procure from King Leontes--"
IV,IV,CAMILLO,"Shall satisfy your father."
IV,IV,PERDITA,"Happy be you!"
IV,IV,PERDITA,"All that you speak shows fair."
IV,IV,CAMILLO,"Who have we here?"
IV,IV,CAMILLO,"We'll make an instrument of this, omit"
IV,IV,CAMILLO,"Nothing may give us aid."
IV,IV,AUTOLYCUS,"If they have overheard me now, why, hanging."
IV,IV,CAMILLO,"How now, good fellow! why shakest thou so? Fear"
IV,IV,CAMILLO,"not, man; here's no harm intended to thee."
IV,IV,AUTOLYCUS,"I am a poor fellow, sir."
IV,IV,CAMILLO,"Why, be so still; here's nobody will steal that from"
IV,IV,CAMILLO,"thee: yet for the outside of thy poverty we must"
IV,IV,CAMILLO,"make an exchange; therefore discase thee instantly,"
IV,IV,CAMILLO,"--thou must think there's a necessity in't,--and"
IV,IV,CAMILLO,"change garments with this gentleman: though the"
IV,IV,CAMILLO,"pennyworth on his side be the worst, yet hold thee,"
IV,IV,CAMILLO,"there's some boot."
IV,IV,AUTOLYCUS,"I am a poor fellow, sir."
IV,IV,AUTOLYCUS,"I know ye well enough."
IV,IV,CAMILLO,"Nay, prithee, dispatch: the gentleman is half"
IV,IV,CAMILLO,"flayed already."
IV,IV,AUTOLYCUS,"Are you in earnest, sir?"
IV,IV,AUTOLYCUS,"I smell the trick on't."
IV,IV,FLORIZEL,"Dispatch, I prithee."
IV,IV,AUTOLYCUS,"Indeed, I have had earnest: but I cannot with"
IV,IV,AUTOLYCUS,"conscience take it."
IV,IV,CAMILLO,"Unbuckle, unbuckle."
IV,IV,CAMILLO,"Fortunate mistress,--let my prophecy"
IV,IV,CAMILLO,"Come home to ye!--you must retire yourself"
IV,IV,CAMILLO,"Into some covert: take your sweetheart's hat"
IV,IV,CAMILLO,"And pluck it o'er your brows, muffle your face,"
IV,IV,CAMILLO,"Dismantle you, and, as you can, disliken"
IV,IV,CAMILLO,"The truth of your own seeming; that you may--"
IV,IV,CAMILLO,"For I do fear eyes over--to shipboard"
IV,IV,CAMILLO,"Get undescried."
IV,IV,PERDITA,"I see the play so lies"
IV,IV,PERDITA,"That I must bear a part."
IV,IV,CAMILLO,"No remedy."
IV,IV,CAMILLO,"Have you done there?"
IV,IV,FLORIZEL,"Should I now meet my father,"
IV,IV,FLORIZEL,"He would not call me son."
IV,IV,CAMILLO,"Nay, you shall have no hat."
IV,IV,CAMILLO,"Come, lady, come. Farewell, my friend."
IV,IV,AUTOLYCUS,"Adieu, sir."
IV,IV,FLORIZEL,"O Perdita, what have we twain forgot!"
IV,IV,FLORIZEL,"Pray you, a word."
IV,IV,CAMILLO,"Of this escape and whither they are bound;"
IV,IV,CAMILLO,"Wherein my hope is I shall so prevail"
IV,IV,CAMILLO,"To force him after: in whose company"
IV,IV,CAMILLO,"I shall review Sicilia, for whose sight"
IV,IV,CAMILLO,"I have a woman's longing."
IV,IV,FLORIZEL,"Fortune speed us!"
IV,IV,FLORIZEL,"Thus we set on, Camillo, to the sea-side."
IV,IV,CAMILLO,"The swifter speed the better."
IV,IV,AUTOLYCUS,"I understand the business, I hear it: to have an"
IV,IV,AUTOLYCUS,"open ear, a quick eye, and a nimble hand, is"
IV,IV,AUTOLYCUS,"necessary for a cut-purse; a good nose is requisite"
IV,IV,AUTOLYCUS,"also, to smell out work for the other senses. I see"
IV,IV,AUTOLYCUS,"this is the time that the unjust man doth thrive."
IV,IV,AUTOLYCUS,"What an exchange had this been without boot! What"
IV,IV,AUTOLYCUS,"a boot is here with this exchange! Sure the gods do"
IV,IV,AUTOLYCUS,"this year connive at us, and we may do any thing"
IV,IV,AUTOLYCUS,"extempore. The prince himself is about a piece of"
IV,IV,AUTOLYCUS,"iniquity, stealing away from his father with his"
IV,IV,AUTOLYCUS,"clog at his heels: if I thought it were a piece of"
IV,IV,AUTOLYCUS,"honesty to acquaint the king withal, I would not"
IV,IV,AUTOLYCUS,"do't: I hold it the more knavery to conceal it;"
IV,IV,AUTOLYCUS,"and therein am I constant to my profession."
IV,IV,AUTOLYCUS,"Aside, aside; here is more matter for a hot brain:"
IV,IV,AUTOLYCUS,"every lane's end, every shop, church, session,"
IV,IV,AUTOLYCUS,"hanging, yields a careful man work."
IV,IV,Clown,"See, see; what a man you are now!"
IV,IV,Clown,"There is no other way but to tell the king"
IV,IV,Clown,"she's a changeling and none of your flesh and blood."
IV,IV,Shepherd,"Nay, but hear me."
IV,IV,Clown,"Nay, but hear me."
IV,IV,Shepherd,"Go to, then."
IV,IV,Clown,"She being none of your flesh and blood, your flesh"
IV,IV,Clown,"and blood has not offended the king; and so your"
IV,IV,Clown,"flesh and blood is not to be punished by him. Show"
IV,IV,Clown,"those things you found about her, those secret"
IV,IV,Clown,"things, all but what she has with her: this being"
IV,IV,Clown,"done, let the law go whistle: I warrant you."
IV,IV,Shepherd,"I will tell the king all, every word, yea, and his"
IV,IV,Shepherd,"son's pranks too; who, I may say, is no honest man,"
IV,IV,Shepherd,"neither to his father nor to me, to go about to make"
IV,IV,Shepherd,"me the king's brother-in-law."
IV,IV,Clown,"Indeed, brother-in-law was the farthest off you"
IV,IV,Clown,"could have been to him and then your blood had been"
IV,IV,Clown,"the dearer by I know how much an ounce."
IV,IV,Shepherd,"Well, let us to the king: there is that in this"
IV,IV,Shepherd,"fardel will make him scratch his beard."
IV,IV,AUTOLYCUS,"may be to the flight of my master."
IV,IV,Clown,"Pray heartily he be at palace."
IV,IV,AUTOLYCUS,"sometimes by chance: let me pocket up my pedlar's excrement."
IV,IV,AUTOLYCUS,"How now, rustics! whither are you bound?"
IV,IV,Shepherd,"To the palace, an it like your worship."
IV,IV,AUTOLYCUS,"Your affairs there, what, with whom, the condition"
IV,IV,AUTOLYCUS,"of that fardel, the place of your dwelling, your"
IV,IV,AUTOLYCUS,"names, your ages, of what having, breeding, and any"
IV,IV,AUTOLYCUS,"thing that is fitting to be known, discover."
IV,IV,Clown,"We are but plain fellows, sir."
IV,IV,AUTOLYCUS,"A lie; you are rough and hairy. Let me have no"
IV,IV,AUTOLYCUS,"lying: it becomes none but tradesmen, and they"
IV,IV,AUTOLYCUS,"often give us soldiers the lie: but we pay them for"
IV,IV,AUTOLYCUS,"it with stamped coin, not stabbing steel; therefore"
IV,IV,AUTOLYCUS,"they do not give us the lie."
IV,IV,Clown,"Your worship had like to have given us one, if you"
IV,IV,Clown,"had not taken yourself with the manner."
IV,IV,Shepherd,"Are you a courtier, an't like you, sir?"
IV,IV,AUTOLYCUS,"Whether it like me or no, I am a courtier. Seest"
IV,IV,AUTOLYCUS,"thou not the air of the court in these enfoldings?"
IV,IV,AUTOLYCUS,"hath not my gait in it the measure of the court?"
IV,IV,AUTOLYCUS,"receives not thy nose court-odor from me? reflect I"
IV,IV,AUTOLYCUS,"not on thy baseness court-contempt? Thinkest thou,"
IV,IV,AUTOLYCUS,"for that I insinuate, or toaze from thee thy"
IV,IV,AUTOLYCUS,"business, I am therefore no courtier? I am courtier"
IV,IV,AUTOLYCUS,"cap-a-pe; and one that will either push on or pluck"
IV,IV,AUTOLYCUS,"back thy business there: whereupon I command thee to"
IV,IV,AUTOLYCUS,"open thy affair."
IV,IV,Shepherd,"My business, sir, is to the king."
IV,IV,AUTOLYCUS,"What advocate hast thou to him?"
IV,IV,Shepherd,"I know not, an't like you."
IV,IV,Clown,"Advocate's the court-word for a pheasant: say you"
IV,IV,Clown,"have none."
IV,IV,Shepherd,"None, sir; I have no pheasant, cock nor hen."
IV,IV,AUTOLYCUS,"How blessed are we that are not simple men!"
IV,IV,AUTOLYCUS,"Yet nature might have made me as these are,"
IV,IV,AUTOLYCUS,"Therefore I will not disdain."
IV,IV,Clown,"This cannot be but a great courtier."
IV,IV,Shepherd,"His garments are rich, but he wears"
IV,IV,Shepherd,"them not handsomely."
IV,IV,Clown,"He seems to be the more noble in being fantastical:"
IV,IV,Clown,"a great man, I'll warrant; I know by the picking"
IV,IV,Clown,"on's teeth."
IV,IV,AUTOLYCUS,"The fardel there? what's i' the fardel?"
IV,IV,AUTOLYCUS,"Wherefore that box?"
IV,IV,Shepherd,"Sir, there lies such secrets in this fardel and box,"
IV,IV,Shepherd,"which none must know but the king; and which he"
IV,IV,Shepherd,"shall know within this hour, if I may come to the"
IV,IV,Shepherd,"speech of him."
IV,IV,AUTOLYCUS,"Age, thou hast lost thy labour."
IV,IV,Shepherd,"Why, sir?"
IV,IV,AUTOLYCUS,"The king is not at the palace; he is gone aboard a"
IV,IV,AUTOLYCUS,"new ship to purge melancholy and air himself: for,"
IV,IV,AUTOLYCUS,"if thou beest capable of things serious, thou must"
IV,IV,AUTOLYCUS,"know the king is full of grief."
IV,IV,Shepard,"So 'tis said, sir; about his son, that should have"
IV,IV,Shepard,"married a shepherd's daughter."
IV,IV,AUTOLYCUS,"If that shepherd be not in hand-fast, let him fly:"
IV,IV,AUTOLYCUS,"the curses he shall have, the tortures he shall"
IV,IV,AUTOLYCUS,"feel, will break the back of man, the heart of monster."
IV,IV,Clown,"Think you so, sir?"
IV,IV,AUTOLYCUS,"Not he alone shall suffer what wit can make heavy"
IV,IV,AUTOLYCUS,"and vengeance bitter; but those that are germane to"
IV,IV,AUTOLYCUS,"him, though removed fifty times, shall all come"
IV,IV,AUTOLYCUS,"under the hangman: which though it be great pity,"
IV,IV,AUTOLYCUS,"yet it is necessary. An old sheep-whistling rogue a"
IV,IV,AUTOLYCUS,"ram-tender, to offer to have his daughter come into"
IV,IV,AUTOLYCUS,"grace! Some say he shall be stoned; but that death"
IV,IV,AUTOLYCUS,"is too soft for him, say I draw our throne into a"
IV,IV,AUTOLYCUS,"sheep-cote! all deaths are too few, the sharpest too easy."
IV,IV,Clown,"Has the old man e'er a son, sir, do you hear. an't"
IV,IV,Clown,"like you, sir?"
IV,IV,AUTOLYCUS,"He has a son, who shall be flayed alive; then"
IV,IV,AUTOLYCUS,"'nointed over with honey, set on the head of a"
IV,IV,AUTOLYCUS,"wasp's nest; then stand till he be three quarters"
IV,IV,AUTOLYCUS,"and a dram dead; then recovered again with"
IV,IV,AUTOLYCUS,"aqua-vitae or some other hot infusion; then, raw as"
IV,IV,AUTOLYCUS,"he is, and in the hottest day prognostication"
IV,IV,AUTOLYCUS,"proclaims, shall be be set against a brick-wall, the"
IV,IV,AUTOLYCUS,"sun looking with a southward eye upon him, where he"
IV,IV,AUTOLYCUS,"is to behold him with flies blown to death. But what"
IV,IV,AUTOLYCUS,"talk we of these traitorly rascals, whose miseries"
IV,IV,AUTOLYCUS,"are to be smiled at, their offences being so"
IV,IV,AUTOLYCUS,"capital? Tell me, for you seem to be honest plain"
IV,IV,AUTOLYCUS,"men, what you have to the king: being something"
IV,IV,AUTOLYCUS,"gently considered, I'll bring you where he is"
IV,IV,AUTOLYCUS,"aboard, tender your persons to his presence,"
IV,IV,AUTOLYCUS,"whisper him in your behalfs; and if it be in man"
IV,IV,AUTOLYCUS,"besides the king to effect your suits, here is man"
IV,IV,AUTOLYCUS,"shall do it."
IV,IV,Clown,"He seems to be of great authority: close with him,"
IV,IV,Clown,"give him gold; and though authority be a stubborn"
IV,IV,Clown,"bear, yet he is oft led by the nose with gold: show"
IV,IV,Clown,"the inside of your purse to the outside of his hand,"
IV,IV,Clown,"and no more ado. Remember 'stoned,' and 'flayed alive.'"
IV,IV,Shepherd,"An't please you, sir, to undertake the business for"
IV,IV,Shepherd,"us, here is that gold I have: I'll make it as much"
IV,IV,Shepherd,"more and leave this young man in pawn till I bring it you."
IV,IV,AUTOLYCUS,"After I have done what I promised?"
IV,IV,Shepherd,"Ay, sir."
IV,IV,AUTOLYCUS,"Well, give me the moiety. Are you a party in this business?"
IV,IV,Clown,"In some sort, sir: but though my case be a pitiful"
IV,IV,Clown,"one, I hope I shall not be flayed out of it."
IV,IV,AUTOLYCUS,"O, that's the case of the shepherd's son: hang him,"
IV,IV,AUTOLYCUS,"he'll be made an example."
IV,IV,Clown,"Comfort, good comfort! We must to the king and show"
IV,IV,Clown,"our strange sights: he must know 'tis none of your"
IV,IV,Clown,"daughter nor my sister; we are gone else. Sir, I"
IV,IV,Clown,"will give you as much as this old man does when the"
IV,IV,Clown,"business is performed, and remain, as he says, your"
IV,IV,Clown,"pawn till it be brought you."
IV,IV,AUTOLYCUS,"I will trust you. Walk before toward the sea-side;"
IV,IV,AUTOLYCUS,"go on the right hand: I will but look upon the"
IV,IV,AUTOLYCUS,"hedge and follow you."
IV,IV,Clown,"We are blest in this man, as I may say, even blest."
IV,IV,Shepherd,"Let's before as he bids us: he was provided to do us good."
IV,IV,AUTOLYCUS,"If I had a mind to be honest, I see Fortune would"
IV,IV,AUTOLYCUS,"not suffer me: she drops booties in my mouth. I am"
IV,IV,AUTOLYCUS,"courted now with a double occasion, gold and a means"
IV,IV,AUTOLYCUS,"to do the prince my master good; which who knows how"
IV,IV,AUTOLYCUS,"that may turn back to my advancement? I will bring"
IV,IV,AUTOLYCUS,"these two moles, these blind ones, aboard him: if he"
IV,IV,AUTOLYCUS,"think it fit to shore them again and that the"
IV,IV,AUTOLYCUS,"complaint they have to the king concerns him"
IV,IV,AUTOLYCUS,"nothing, let him call me rogue for being so far"
IV,IV,AUTOLYCUS,"officious; for I am proof against that title and"
IV,IV,AUTOLYCUS,"what shame else belongs to't. To him will I present"
IV,IV,AUTOLYCUS,"them: there may be matter in it."
V,I,CLEOMENES,"Sir, you have done enough, and have perform'd"
V,I,CLEOMENES,"A saint-like sorrow: no fault could you make,"
V,I,CLEOMENES,"Which you have not redeem'd; indeed, paid down"
V,I,CLEOMENES,"More penitence than done trespass: at the last,"
V,I,CLEOMENES,"Do as the heavens have done, forget your evil;"
V,I,CLEOMENES,"With them forgive yourself."
V,I,LEONTES,"Whilst I remember"
V,I,LEONTES,"Her and her virtues, I cannot forget"
V,I,LEONTES,"My blemishes in them, and so still think of"
V,I,LEONTES,"The wrong I did myself; which was so much,"
V,I,LEONTES,"That heirless it hath made my kingdom and"
V,I,LEONTES,"Destroy'd the sweet'st companion that e'er man"
V,I,LEONTES,"Bred his hopes out of."
V,I,PAULINA,"True, too true, my lord:"
V,I,PAULINA,"If, one by one, you wedded all the world,"
V,I,PAULINA,"Or from the all that are took something good,"
V,I,PAULINA,"To make a perfect woman, she you kill'd"
V,I,PAULINA,"Would be unparallel'd."
V,I,LEONTES,"I think so. Kill'd!"
V,I,LEONTES,"She I kill'd! I did so: but thou strikest me"
V,I,LEONTES,"Sorely, to say I did; it is as bitter"
V,I,LEONTES,"Upon thy tongue as in my thought: now, good now,"
V,I,LEONTES,"Say so but seldom."
V,I,CLEOMENES,"Not at all, good lady:"
V,I,CLEOMENES,"You might have spoken a thousand things that would"
V,I,CLEOMENES,"Have done the time more benefit and graced"
V,I,CLEOMENES,"Your kindness better."
V,I,PAULINA,"You are one of those"
V,I,PAULINA,"Would have him wed again."
V,I,DION,"If you would not so,"
V,I,DION,"You pity not the state, nor the remembrance"
V,I,DION,"Of his most sovereign name; consider little"
V,I,DION,"What dangers, by his highness' fail of issue,"
V,I,DION,"May drop upon his kingdom and devour"
V,I,DION,"Incertain lookers on. What were more holy"
V,I,DION,"Than to rejoice the former queen is well?"
V,I,DION,"What holier than, for royalty's repair,"
V,I,DION,"For present comfort and for future good,"
V,I,DION,"To bless the bed of majesty again"
V,I,DION,"With a sweet fellow to't?"
V,I,PAULINA,"There is none worthy,"
V,I,PAULINA,"Respecting her that's gone. Besides, the gods"
V,I,PAULINA,"Will have fulfill'd their secret purposes;"
V,I,PAULINA,"For has not the divine Apollo said,"
V,I,PAULINA,"Is't not the tenor of his oracle,"
V,I,PAULINA,"That King Leontes shall not have an heir"
V,I,PAULINA,"Till his lost child be found? which that it shall,"
V,I,PAULINA,"Is all as monstrous to our human reason"
V,I,PAULINA,"As my Antigonus to break his grave"
V,I,PAULINA,"And come again to me; who, on my life,"
V,I,PAULINA,"Did perish with the infant. 'Tis your counsel"
V,I,PAULINA,"My lord should to the heavens be contrary,"
V,I,PAULINA,"Oppose against their wills."
V,I,PAULINA,"Care not for issue;"
V,I,PAULINA,"The crown will find an heir: great Alexander"
V,I,PAULINA,"Left his to the worthiest; so his successor"
V,I,PAULINA,"Was like to be the best."
V,I,LEONTES,"Good Paulina,"
V,I,LEONTES,"Who hast the memory of Hermione,"
V,I,LEONTES,"I know, in honour, O, that ever I"
V,I,LEONTES,"Had squared me to thy counsel! then, even now,"
V,I,LEONTES,"I might have look'd upon my queen's full eyes,"
V,I,LEONTES,"Have taken treasure from her lips--"
V,I,PAULINA,"And left them"
V,I,PAULINA,"More rich for what they yielded."
V,I,LEONTES,"Thou speak'st truth."
V,I,LEONTES,"No more such wives; therefore, no wife: one worse,"
V,I,LEONTES,"And better used, would make her sainted spirit"
V,I,LEONTES,"Again possess her corpse, and on this stage,"
V,I,LEONTES,"Where we're offenders now, appear soul-vex'd,"
V,I,LEONTES,"And begin, 'Why to me?'"
V,I,PAULINA,"Had she such power,"
V,I,PAULINA,"She had just cause."
V,I,LEONTES,"She had; and would incense me"
V,I,LEONTES,"To murder her I married."
V,I,PAULINA,"I should so."
V,I,PAULINA,"Were I the ghost that walk'd, I'ld bid you mark"
V,I,PAULINA,"Her eye, and tell me for what dull part in't"
V,I,PAULINA,"You chose her; then I'ld shriek, that even your ears"
V,I,PAULINA,"Should rift to hear me; and the words that follow'd"
V,I,PAULINA,"Should be 'Remember mine.'"
V,I,LEONTES,"Stars, stars,"
V,I,LEONTES,"And all eyes else dead coals! Fear thou no wife;"
V,I,LEONTES,"I'll have no wife, Paulina."
V,I,PAULINA,"Will you swear"
V,I,PAULINA,"Never to marry but by my free leave?"
V,I,LEONTES,"Never, Paulina; so be blest my spirit!"
V,I,PAULINA,"Then, good my lords, bear witness to his oath."
V,I,CLEOMENES,"You tempt him over-much."
V,I,PAULINA,"Unless another,"
V,I,PAULINA,"As like Hermione as is her picture,"
V,I,PAULINA,"Affront his eye."
V,I,CLEOMENES,"Good madam,--"
V,I,PAULINA,"I have done."
V,I,PAULINA,"Yet, if my lord will marry,--if you will, sir,"
V,I,PAULINA,"No remedy, but you will,--give me the office"
V,I,PAULINA,"To choose you a queen: she shall not be so young"
V,I,PAULINA,"As was your former; but she shall be such"
V,I,PAULINA,"As, walk'd your first queen's ghost,"
V,I,PAULINA,"it should take joy"
V,I,PAULINA,"To see her in your arms."
V,I,LEONTES,"My true Paulina,"
V,I,LEONTES,"We shall not marry till thou bid'st us."
V,I,PAULINA,"That"
V,I,PAULINA,"Shall be when your first queen's again in breath;"
V,I,PAULINA,"Never till then."
V,I,Gentleman,"One that gives out himself Prince Florizel,"
V,I,Gentleman,"Son of Polixenes, with his princess, she"
V,I,Gentleman,"The fairest I have yet beheld, desires access"
V,I,Gentleman,"To your high presence."
V,I,LEONTES,"What with him? he comes not"
V,I,LEONTES,"Like to his father's greatness: his approach,"
V,I,LEONTES,"So out of circumstance and sudden, tells us"
V,I,LEONTES,"'Tis not a visitation framed, but forced"
V,I,LEONTES,"By need and accident. What train?"
V,I,Gentleman,"But few,"
V,I,Gentleman,"And those but mean."
